poi_name,latitude,longitude,address,poi_type
Brunetti Western Restaurant BAR·A·MUNDI (Star Yang West Bund Center Store),31.161453,121.462353,,restaurant
Shanghai Century Park,31.215725,121.552563,,attraction
Chao Mansion · Chaozhou Cuisine (Century Park Store),31.211609,121.550205,,restaurant
Yanwu Restaurant (Golden Eagle Tower A Branch),31.220132,121.550164,,restaurant
One Foot Garden (Century Park),31.212024,121.548349,,restaurant
Ming Kee Roasted Meat Restaurant,31.210316,121.558746,,restaurant
Shanghai Renaissance Pudong Hotel - Banquet Hall,31.223894,121.552230,,restaurant
Yucui Pavilion Chinese Restaurant,31.214371,121.562219,,restaurant
Mi Xiang Yuan Smart Choice Restaurant (Shanghai Information Building Branch),31.224152,121.551100,,restaurant
Dao Xiang Qing Fashion Smart Choice Restaurant (Meihua Road Branch),31.210963,121.560861,,restaurant
BIANCHI PLUS Bianchi (Pudong Kerry Parkside Store),31.212770,121.562545,,restaurant
