city,attraction_name,attraction_id,description,attraction_type,address,latitude,longitude,rating,opening_time,closing_time,closing_dates,min_visit_hours,max_visit_hours,ticket_price
Shaoxing,Lu Xun's Hometown,B023F02PG3,"The birthplace and childhood home of Lu Xun, including his former residence, Sanwei Study, and Baicao Garden.",Historical and Cultural,,29.993263,120.584419,4.7,08:30,20:30,,2.5,4.0,0
Shaoxing,Keyan Scenic Area,B0FFG6LFPI,"A comprehensive scenic area combining Keyan rock formations, Jianhu lake views, and the cultural charm of Luzhen.",Natural Scenery,,30.046148,120.474709,4.7,08:30,17:00,,2.5,4.0,80
Shaoxing,Shenyuan (Shen Garden),B0FFFR0TIH,"A private garden from the Song Dynasty, the site of the love story between Lu You and Tang Wan, where you can enjoy Yue Opera performances.",Historical and Cultural,,29.990303,120.590035,4.6,08:00,21:00,,1.5,3.0,40
Shaoxing,Shaoxing Museum,B023F00OGK,"A comprehensive museum showcasing the history, culture, and local characteristics of Shaoxing.",Historical and Cultural,,29.997923,120.572327,4.7,Open 24 Hours,Open 24 Hours,,1.0,2.5,0
Shaoxing,Bazhi Bridge,B023F02KFF,"An ancient bridge from the Song Dynasty, a transportation hub during the Southern Song period, surrounded by the pristine water town scenery, making it an excellent place to experience old Shaoxing life.",Historical and Cultural,,29.999705,120.591561,4.7,Open 24 Hours,Open 24 Hours,,0.5,2.0,0
Shaoxing,Shaoxing East Lake Scenic Area,B023F02KB7,"The world's largest natural bonsai landscape, where you can take a traditional black-awning boat into caves to view cliff carvings.",Natural Scenery,,29.998452,120.632047,4.4,08:00,17:00,,2.0,3.5,50
Shaoxing,Cai Yuanpei Former Residence,B023F00C0A,"The birthplace of educator Cai Yuanpei, offering insights into the life, achievements, and ideological contributions of this pioneer of modern education reform.",Historical and Cultural,,30.006921,120.583356,3.0,Open 24 Hours,Open 24 Hours,,0.5,2.0,60
Shaoxing,Night Tour of the Ring City River,,Take a traditional black-awning boat to tour the Shaoxing Ring Canal and experience the nighttime charm of the water town.,Historical and Cultural,,29.995000,120.580000,4.5,19:00,21:00,,0.5,2.0,60
Shaoxing,Xiyuan (West Garden),B023F03AVW,"A traditional garden park in Shaoxing city, with a tranquil environment suitable for morning exercises and leisure.",Leisure Experience,,29.997169,120.568984,4.6,05:30,22:00,,0.5,2.0,0
