restaurant_name,city,latitude,longitude,price_per_person,cuisine,opening_time,closing_time,nearby_attraction_name,nearby_attraction_coords,query_latitude,query_longitude,rating
Suzhou Yanshan Lake Hilton Hotel - Qingya Chinese Restaurant,Suzhou,31.245443,120.698313,233.0,Chinese Restaurant;Local Specialty Restaurant,17:30,21:00,Hilton Suzhou Yanshan Lake,"120.698247,31.245259",31.245259,120.698247,4.0
Tianyou Restaurant,Suzhou,31.408360,120.447554,100.0,Chinese Restaurant;Chinese Restaurant,07:00,22:00,Atour Hotel Suzhou Taihu Scenic Area Wangting Commercial Plaza,"120.453376,31.416519",31.416519,120.453376,3.9
Heaven and Earth Tea Restaurant,Suzhou,31.405583,120.928290,100.0,Fast Food Restaurant;Fast Food Restaurant,17:00,21:00,Hilton Garden Inn Suzhou Kunshan,"120.928842,31.403129",31.403129,120.928842,4.2
Xinxin Smart Restaurant,Suzhou,31.406006,120.927792,100.0,Chinese Restaurant;Chinese Restaurant,10:45,22:00,Hilton Garden Inn Suzhou Kunshan,"120.928842,31.403129",31.403129,120.928842,4.2
Gumanle Self-Service Restaurant,Suzhou,31.399807,120.927797,100.0,Food Service Related;Food Service Related,11:00,21:00,Hilton Garden Inn Suzhou Kunshan,"120.928842,31.403129",31.403129,120.928842,3.6
Bawei Xian Taiwanese Restaurant,Suzhou,31.392038,120.929243,81.0,Chinese Restaurant;台湾菜,17:00,22:00,Hilton Garden Inn Suzhou Kunshan,"120.928842,31.403129",31.403129,120.928842,4.4
Putian Seafood Noodles,Suzhou,31.413783,120.933473,38.0,Chinese Restaurant;Chinese Restaurant,10:00,22:00,Hilton Garden Inn Suzhou Kunshan,"120.928842,31.403129",31.403129,120.928842,4.4
Chongqing No.1 Bridge Hotpot (Xueshi Street Branch),Suzhou,31.306095,120.611657,86.0,Chinese Restaurant;Hot Pot,11:00,03:00,Ji Hotel Suzhou Guanqian Street Ganjiang West Road,"120.615000,31.305700",31.305700,120.615000,4.4
Jiuchenli BBQ,Suzhou,31.308067,120.611178,85.0,Chinese Restaurant;Chinese Restaurant,16:30,24:00,Ji Hotel Suzhou Guanqian Street Ganjiang West Road,"120.615000,31.305700",31.305700,120.615000,4.7
Xuecun Renjia Restaurant,Suzhou,31.032350,120.850958,100.0,Chinese Restaurant;Chinese Restaurant,09:00,22:00,Suzhou Jingpu Hotel (Wujiang Fenhu Development Zone Branch),"120.846352,31.036820",31.036820,120.846352,4.5
Suzhou Zhiyin Wyndham Grand Hotel · Four Seasons Seafood Buffet Restaurant (Fenhu Branch),Suzhou,31.029844,120.845833,100.0,Food Service Related;Food Service Related,06:30,10:00,Suzhou Jingpu Hotel (Wujiang Fenhu Development Zone Branch),"120.846352,31.036820",31.036820,120.846352,4.3
Suzhou Zhiyin Wyndham Grand Hotel · Jinxiu Jiangnan Chinese Restaurant,Suzhou,31.029590,120.846262,273.0,Food Service Related;Food Service Related,17:00,21:30,Suzhou Jingpu Hotel (Wujiang Fenhu Development Zone Branch),"120.846352,31.036820",31.036820,120.846352,4.2
Jie Shao Hong Kong Style Tea Restaurant (Suzhou Musen International Life Plaza Branch),Suzhou,31.027681,120.844478,78.0,Fast Food Restaurant;Tea Restaurant,10:00,21:00,Suzhou Jingpu Hotel (Wujiang Fenhu Development Zone Branch),"120.846352,31.036820",31.036820,120.846352,4.2
Station Tea Restaurant,Suzhou,31.047681,120.849954,113.0,Fast Food Restaurant;Tea Restaurant,10:00,23:30,Suzhou Jingpu Hotel (Wujiang Fenhu Development Zone Branch),"120.846352,31.036820",31.036820,120.846352,4.0
Ludu Restaurant,Suzhou,31.470875,121.183775,100.0,Chinese Restaurant;Chinese Restaurant,11:00,21:00,Jinjiang Inn (Taicang Luduo Neighborhood Center Branch),"121.183540,31.469861",31.469861,121.183540,4.5
Baoshi Chinese Restaurant · Authentic Suzhou Cuisine (Ludu Branch),Suzhou,31.474993,121.183979,55.0,Chinese Restaurant;Chinese Restaurant,10:30,20:30,Jinjiang Inn (Taicang Luduo Neighborhood Center Branch),"121.183540,31.469861",31.469861,121.183540,4.4
Yunshangxuan Restaurant (Ludu Branch),Suzhou,31.464629,121.184501,100.0,Chinese Restaurant;Chinese Restaurant,11:00,21:00,Jinjiang Inn (Taicang Luduo Neighborhood Center Branch),"121.183540,31.469861",31.469861,121.183540,3.4
Xiangxuehai Hotel Chinese Restaurant · Banquet Hall,Suzhou,31.272630,120.627510,100.0,Chinese Restaurant;Chinese Restaurant,16:30,20:30,Suzhou Suyuan Hotel,"120.627785,31.273664",31.273664,120.627785,4.3
Suyuan Hotel Chinese Restaurant (Changqiao Area Branch),Suzhou,31.273756,120.630269,133.0,Fast Food Restaurant;Fast Food Restaurant,06:30,18:30,Suzhou Suyuan Hotel,"120.627785,31.273664",31.273664,120.627785,4.0
GreenTree Restaurant (Tianyue Building Branch),Suzhou,31.271822,120.629163,36.0,Chinese Restaurant;Chinese Restaurant,11:00,21:00,Suzhou Suyuan Hotel,"120.627785,31.273664",31.273664,120.627785,4.1
Park Area Lujin Restaurant (Xinglanhui · Lujin Plaza Branch),Suzhou,31.306525,120.765975,100.0,Chinese Restaurant;Chinese Restaurant,11:00,21:00,Hanting Hotel (Suzhou Industrial Park Olympic Sports Center Branch),"120.766000,31.304300",31.304300,120.766000,2.8
Super Paradise Restaurant,Suzhou,31.303940,120.751430,100.0,Chinese Restaurant;Chinese Restaurant,11:00,21:00,Hanting Hotel (Suzhou Industrial Park Olympic Sports Center Branch),"120.766000,31.304300",31.304300,120.766000,3.8
Mammamia Italian Restaurant (Olympic Sports Center Branch),Suzhou,31.303755,120.751343,128.0,Food Service Related;Food Service Related,10:00,22:00,Hanting Hotel (Suzhou Industrial Park Olympic Sports Center Branch),"120.766000,31.304300",31.304300,120.766000,4.5
McDonald's Artificial Intelligence Industrial Park Restaurant,Suzhou,31.293215,120.774965,23.0,Fast Food Restaurant;麦当劳,08:00,21:30,Hanting Hotel (Suzhou Industrial Park Olympic Sports Center Branch),"120.766000,31.304300",31.304300,120.766000,4.6
Yi He Restaurant (Shopping Park Branch),Suzhou,31.870323,120.513879,172.0,Chinese Restaurant;Chinese Restaurant,10:00,24:00,Zhangjiagang Meilun Boutique Hotel,"120.513160,31.869627",31.869627,120.513160,4.5
Yunduli Hotel (Zhangjiagang Shopping Park Branch),Suzhou,31.869403,120.516097,100.0,Accommodation Related;Accommodation Related,11:00,21:00,Zhangjiagang Meilun Boutique Hotel,"120.513160,31.869627",31.869627,120.513160,3.9
McDonald's Shopping Park Financial Street Restaurant (Huasheng Building Branch),Suzhou,31.867269,120.515086,35.0,Fast Food Restaurant;麦当劳,07:00,21:00,Zhangjiagang Meilun Boutique Hotel,"120.513160,31.869627",31.869627,120.513160,4.7
Bullfighter Steak Restaurant (Suzhou Zhangjiagang Shopping Park Clara Waterfront Commercial Street Branch),Suzhou,31.869985,120.516607,122.0,Foreign Restaurant;牛扒店(扒房)|Foreign Restaurant;Western Restaurant,11:00,21:00,Zhangjiagang Meilun Boutique Hotel,"120.513160,31.869627",31.869627,120.513160,4.1
Zhonglian Yuehai International Hotel Chinese Restaurant,Suzhou,31.867002,120.515547,134.0,Chinese Restaurant;Cantonese Cuisine,06:30,22:30,Zhangjiagang Meilun Boutique Hotel,"120.513160,31.869627",31.869627,120.513160,3.9
Qian Yuman · Nostalgic Restaurant,Suzhou,31.311636,120.603275,85.0,Chinese Restaurant;Chinese Restaurant,17:00,21:30,Jinjiang Inn (Suzhou Shilu Shantang Street Branch),"120.603258,31.311639",31.311639,120.603258,4.7
Qingle Residence [Northwest Ethnic Restaurant],Suzhou,31.311175,120.602679,31.0,Chinese Restaurant;Halal Restaurant,10:00,00:30,Jinjiang Inn (Suzhou Shilu Shantang Street Branch),"120.603258,31.311639",31.311639,120.603258,4.4
Yuexi Pig Trotters · Roast Meats · Restaurant (Jinza Building Branch),Suzhou,31.311453,120.600703,100.0,Food Service Related;Food Service Related,09:00,22:00,Jinjiang Inn (Suzhou Shilu Shantang Street Branch),"120.603258,31.311639",31.311639,120.603258,3.7
Little Joy Suzhou Cuisine,Suzhou,31.311662,120.605837,80.0,Chinese Restaurant;Chinese Restaurant,16:00,21:00,Jinjiang Inn (Suzhou Shilu Shantang Street Branch),"120.603258,31.311639",31.311639,120.603258,4.6
Meili Shanxia Mihuajian · Yunnan Cuisine (Shilu Branch),Suzhou,31.311974,120.605834,97.0,Chinese Restaurant;Chinese Restaurant,11:00,21:30,Jinjiang Inn (Suzhou Shilu Shantang Street Branch),"120.603258,31.311639",31.311639,120.603258,4.7
Suzhou Zhonghui Pullman Hotel · Liuyuan Chinese Restaurant (Suzhou Zhonghui Pullman Hotel Branch),Suzhou,31.372852,120.638483,73.0,Food Service Related;Food Service Related,17:30,21:00,Suzhou Zhonghui Pullman Hotel,"120.638261,31.373102",31.373102,120.638261,4.2
Home Away Home Quick Service Restaurant (Xiangcheng Avenue Branch),Suzhou,31.375461,120.637909,11.0,Fast Food Restaurant;Fast Food Restaurant,07:00,21:00,Suzhou Zhonghui Pullman Hotel,"120.638261,31.373102",31.373102,120.638261,3.7
Floral Music Bar & Bistro,Suzhou,31.375053,120.635620,100.0,Entertainment Venue;Bar,11:00,21:00,Suzhou Zhonghui Pullman Hotel,"120.638261,31.373102",31.373102,120.638261,4.3
Taitaiman Thai-Style Tea Restaurant (Suzhou Global Harbor Branch),Suzhou,31.374945,120.635231,99.0,Foreign Restaurant;泰国/越南菜品餐厅,10:00,22:00,Suzhou Zhonghui Pullman Hotel,"120.638261,31.373102",31.373102,120.638261,3.6
Krabi · Thai Restaurant (Xiangcheng Branch),Suzhou,31.370275,120.636550,86.0,Foreign Restaurant;Foreign Restaurant,16:30,21:00,Suzhou Zhonghui Pullman Hotel,"120.638261,31.373102",31.373102,120.638261,4.5
Tongli Zhuangyuanju,Suzhou,31.158314,120.716303,56.0,Chinese Restaurant;Chinese Restaurant,09:00,20:00,Three Bridges Scenic Area,"120.717448,31.158008",31.158008,120.717448,4.0
Yi Jiangnan Restaurant,Suzhou,31.156787,120.719058,65.0,Food Service Related;Food Service Related,09:00,21:00,Three Bridges Scenic Area,"120.717448,31.158008",31.158008,120.717448,4.1
Tongli Cheng'en Hall Courtyard Private Cuisine,Suzhou,31.158649,120.720713,56.0,Chinese Restaurant;Chinese Restaurant,10:00,22:00,Three Bridges Scenic Area,"120.717448,31.158008",31.158008,120.717448,4.5
Xinxin Noodle Restaurant,Suzhou,31.151863,120.718253,100.0,Chinese Restaurant;Chinese Restaurant,11:00,21:00,Three Bridges Scenic Area,"120.717448,31.158008",31.158008,120.717448,3.5
Tongli Lake Resort - Tongli No. 1 Boat Restaurant,Suzhou,31.156125,120.726825,100.0,Foreign Restaurant;Western Restaurant,10:00,22:00,Three Bridges Scenic Area,"120.717448,31.158008",31.158008,120.717448,4.3
KFC Drive-Thru Restaurant (Qianjin 986 Drive-Thru),Suzhou,31.384278,121.003647,100.0,Food Service Related;Food Service Related,06:00,23:00,Ji Hotel Kunshan Development Zone Qianjin East Road,"121.005351,31.384354",31.384354,121.005351,3.8
Queen's Restaurant (Hongji Fortune Plaza Branch),Suzhou,31.384484,121.008743,62.0,Chinese Restaurant;Chinese Restaurant,09:30,21:00,Ji Hotel Kunshan Development Zone Qianjin East Road,"121.005351,31.384354",31.384354,121.005351,3.9
Kuaike Restaurant (Hongji Fortune Plaza Branch),Suzhou,31.384770,121.009162,21.0,Chinese Restaurant;Chinese Restaurant,11:00,21:00,Ji Hotel Kunshan Development Zone Qianjin East Road,"121.005351,31.384354",31.384354,121.005351,4.0
Guziqing Fashion Smart Choice Restaurant,Suzhou,31.382917,121.012544,100.0,Chinese Restaurant;Chinese Restaurant,11:00,21:00,Ji Hotel Kunshan Development Zone Qianjin East Road,"121.005351,31.384354",31.384354,121.005351,3.6
Lao Xinpeng Restaurant (Jinhua Garden Branch),Suzhou,31.379381,121.000024,100.0,Chinese Restaurant;Chinese Restaurant,10:00,21:00,Ji Hotel Kunshan Development Zone Qianjin East Road,"121.005351,31.384354",31.384354,121.005351,4.1
Garden Inside Restaurant (Garden Outside Branch),Suzhou,31.323827,120.631367,100.0,Chinese Restaurant;Chinese Restaurant,07:00,19:00,Humble Administrator's Garden,"120.629211,31.324194",31.324194,120.629211,4.3
11:11 Restaurant,Suzhou,31.325814,120.627879,100.0,Food Service Related;Food Service Related,10:00,23:00,Humble Administrator's Garden,"120.629211,31.324194",31.324194,120.629211,3.5
Suzhou Madam Su Bang Cuisine · Su Noodles Banquet (Zhuozheng Garden Branch),Suzhou,31.321648,120.629695,59.0,Food Service Related;Food Service Related,08:30,21:00,Humble Administrator's Garden,"120.629211,31.324194",31.324194,120.629211,4.6
Sheng Chunyang Restaurant (Huayangli Branch),Suzhou,31.322492,120.632072,67.0,Chinese Restaurant;Chinese Restaurant,10:00,22:00,Humble Administrator's Garden,"120.629211,31.324194",31.324194,120.629211,4.0
Suzhouya Xing · Literati Su-Style Noodle House (Museum Branch),Suzhou,31.322121,120.626030,45.0,Food Service Related;Food Service Related,07:00,20:00,Humble Administrator's Garden,"120.629211,31.324194",31.324194,120.629211,4.6
Tongli Cheng'en Hall Courtyard Private Cuisine,Suzhou,31.158649,120.720713,56.0,Chinese Restaurant;Chinese Restaurant,10:00,22:00,Retreat and Reflection Garden,"120.720272,31.157833",31.157833,120.720272,4.5
Yi Jiangnan Restaurant,Suzhou,31.156787,120.719058,65.0,Food Service Related;Food Service Related,09:00,21:00,Retreat and Reflection Garden,"120.720272,31.157833",31.157833,120.720272,4.1
Tongli Zhuangyuanju,Suzhou,31.158314,120.716303,56.0,Chinese Restaurant;Chinese Restaurant,09:00,20:00,Retreat and Reflection Garden,"120.720272,31.157833",31.157833,120.720272,4.0
Tongli Lake Resort - Tongli No. 1 Boat Restaurant,Suzhou,31.156125,120.726825,100.0,Foreign Restaurant;Western Restaurant,10:00,22:00,Retreat and Reflection Garden,"120.720272,31.157833",31.157833,120.720272,4.3
Xinxin Noodle Restaurant,Suzhou,31.151863,120.718253,100.0,Chinese Restaurant;Chinese Restaurant,11:00,21:00,Retreat and Reflection Garden,"120.720272,31.157833",31.157833,120.720272,3.5
