poi_name,latitude,longitude,address,poi_type
Zhengzhou Yellow River Cultural Park,34.953667,113.512589,,attraction
David City Shopping Center,34.758202,113.666031,,attraction
Qianxi Square (Big Corn),34.769955,113.726322,,attraction
Zhengzhou Shangdu National Archaeological Site Park,34.753775,113.690498,,attraction
Chenghuang Temple,34.752061,113.686977,,attraction
Zhengdong New District CBD,34.769100,113.753400,,attraction
Zijing Mountain Park,34.761890,113.687708,,attraction
Zhengzhou Confucian Temple,34.748659,113.688345,,attraction
Yellow River Museum,34.871840,113.677764,,attraction
Huiji Bridge Ruins Park,34.892354,113.585469,,attraction
Zhengzhou Zhengbai Restaurant (Zhengzhou Department Store Branch),34.756286,113.668080,,restaurant
Route 5 Restaurant Stone-Grilled Steak (David City Branch),34.756777,113.666316,,restaurant
Mao Zhang Zhang Oil-Braised Skewers (Guomao 360 Branch),34.783597,113.675687,,restaurant
Cai Feng Lou Chinese Restaurant (Zhengzhou Dennis Plaza InterContinental Hotel),34.757771,113.665954,,restaurant
Yixu Sukiyaki (Dennis David Plaza Branch),34.757768,113.665886,,restaurant
The Boots Mud Boots Get Holiday (David City Branch),34.758578,113.666557,,restaurant
Wang Steak (Zhengzhou David Plaza Branch),34.757501,113.666208,,restaurant
Xiang Ding Sheng Premium Restaurant (David City Branch),34.757365,113.665761,,restaurant
Grandma's Kitchen (Dennis David City Branch),34.757262,113.666027,,restaurant
De Fu Indian Restaurant (David Plaza Branch),34.756973,113.665911,,restaurant
Manyu (Dennis David Plaza Branch),34.756848,113.666241,,restaurant
Haiyu Gourmet Seafood Restaurant,34.769787,113.726419,,restaurant
Zhengzhou Greenland JW Marriott Hotel (Marriott Chinese Restaurant),34.770905,113.727350,,restaurant
Qianxi Cloud Restaurant (Qianxi Plaza Branch),34.771075,113.727225,,restaurant
Zhengzhou Big Corn G PLUS Sky View Restaurant,34.770914,113.727493,,restaurant
Zhengzhou Greenland JW Marriott Hotel · Urban Bistro Buffet Restaurant,34.771054,113.727309,,restaurant
Zui Ba Xian Grilled Fish (Qianxi Plaza Branch),34.770902,113.727580,,restaurant
Yu Jian Tea Restaurant (New Australia Building Branch),34.767928,113.723581,,restaurant
Xinhuose (Freshly Cooked Restaurant),34.767451,113.723530,,restaurant
Jinyue Tea Restaurant (Henan Media Building Branch),34.767405,113.722783,,restaurant
Two Birds One Stone · Yishi Erniao (Muse Branch),34.767030,113.730428,,restaurant
Erguang Restaurant,34.757454,113.691651,,restaurant
Henan Provincial Traditional Chinese Medicine Research Institute Affiliated Hospital Restaurant,34.755083,113.685722,,restaurant
Henan University Affiliated Zhengzhou First People's Hospital · Nutrition Restaurant,34.750370,113.685219,,restaurant
Zhen Yuchuan Banquet Center,34.747760,113.691761,,restaurant
Old Wu's Meow Cafe & Restaurant (New World Department Store Branch),34.752925,113.682675,,restaurant
Zhengzhou Sofitel International Hotel · Dome Western Restaurant,34.761863,113.692708,,restaurant
Hongyuan Restaurant,34.761674,113.693653,,restaurant
Sofitel International Hotel (Yueweixian Chinese Restaurant),34.761932,113.692486,,restaurant
Yutong Retired Staff Restaurant (Yutong Garden Zhengbian Road No. 42 Courtyard Branch),34.747100,113.697080,,restaurant
Mama Restaurant (Chengdong Road Branch),34.748675,113.691225,,restaurant
Minyu Chinese Restaurant (Jinduoyinduo Jewelry Store),34.748684,113.681630,,restaurant
Mama's Restaurant,34.745025,113.680175,,restaurant
Song Laosan Su Meat and Lamb Soup Old Shop,34.751635,113.677244,,restaurant
Jingxin Yuan Restaurant,34.757702,113.678788,,restaurant
Fangzhongshan Spicy Soup (Flagship Store),34.760065,113.682462,,restaurant
Third Hospital Nutrition Restaurant,34.767625,113.751240,,restaurant
Supreme Qiangzai (Zhengguang North Street Branch),34.771566,113.754982,,restaurant
Yulongxuan Tea Restaurant (Yuhang Center Branch),34.771871,113.755230,,restaurant
Hairong Hotel Western Restaurant,34.768486,113.749551,,restaurant
Guangyi Xinyang Maojian Tea Restaurant (Yuhang Branch),34.771881,113.755782,,restaurant
Xinshi Lin Holiday Inn - Elemental Restaurant,34.771175,113.757935,,restaurant
Sheraton Grand Zhengzhou Hotel - Feast Signature Restaurant,34.764000,113.754711,,restaurant
Sheng · Star Court Steak Restaurant,34.763882,113.754664,,restaurant
Tianmingfang Five-Flavored Medicinal Cuisine Restaurant,34.772309,113.759111,,restaurant
Song Style Elegant Banquet · Song Culture Restaurant (Shangzuo Center Branch),34.763443,113.756145,,restaurant
Ginkgo Tree Seafood Restaurant (Jinshui Road Branch),34.763326,113.684358,,restaurant
Government Restaurant Fast Food Section,34.764882,113.689757,,restaurant
Tanghou Keyixing Tea Banquet,34.764738,113.684978,,restaurant
Zhengzhou Zhongzhou Holiday Inn Express Hotel Restaurant,34.762887,113.692533,,restaurant
Xingcan Restaurant,34.764980,113.691112,,restaurant
Zijing Mountain Hotel - Restaurant,34.764942,113.691889,,restaurant
Guangdong Restaurant (Erma Road),34.749825,113.660012,,restaurant
Royal Dining Hall · Medicinal Cuisine Restaurant (Yuxi Building Branch),34.747991,113.699877,,restaurant
Zhang's Goose Castle,34.870717,113.670712,,restaurant
Datang Restaurant Shrimp Dumpling Specialty Store (Yingbin Road Branch),34.871556,113.665047,,restaurant
Radisson Blu Hotel Zhengzhou - Pin Buffet Restaurant,34.859568,113.678526,,restaurant
Zhengzhou Normal University East Campus Jingxinyuan Restaurant,34.863435,113.659282,,restaurant
Xinyang Fusion Restaurant,34.889033,113.574616,,restaurant
Convenience Restaurant,34.886025,113.569690,,restaurant
KFC Drive-Thru Restaurant (Jiangshan Road DT Branch),34.880231,113.572945,,restaurant
Nutrition and Health Restaurant,34.744171,113.652484,,restaurant
Ah Xiang Rice Noodles (Zhengzhou Erqi Shanshan Outlet Restaurant),34.526573,113.855171,,restaurant
Zhengzhou Airport Grand Hotel Chinese Restaurant,34.528534,113.843450,,restaurant
Lounge Restaurant,34.754747,113.783314,,restaurant
Zhengzhou Heson Yiste Hotel · Xindi Restaurant (Greenland Colorful City Branch),34.761864,113.772727,,restaurant
Lanting Xu Tea Restaurant,34.753801,113.774832,,restaurant
Snow Deer All-Day Buffet Restaurant (Yinji Ice and Snow Hotel),34.481312,113.553247,,restaurant
Xuelongxuan Chinese Restaurant (Yinji Ice and Snow Hotel),34.480809,113.553406,,restaurant
Harbor Restaurant,34.484514,113.547905,,restaurant
South Windmill Geer International Hotel Chinese Restaurant,34.719198,113.764169,,restaurant
Zhengzhou Public Security Bureau Traffic Management Bureau Traffic Police Twelfth Detachment Restaurant,34.715080,113.765103,,restaurant
Yuanfuyuan Canteen (Jincheng Times Plaza Branch),34.776707,113.706486,,restaurant
You Jin Sheng Jewelry Tea Restaurant (Weiye Xianghu Garden Branch),34.769988,113.864010,,restaurant
Xinwaku Tea Restaurant (Weiye Xianghu Garden Branch),34.769990,113.864126,,restaurant
Starry Sky Restaurant,34.776286,113.866757,,restaurant
Tongshantang Experience Restaurant,34.764509,113.745962,,restaurant
Qingyuan Tea Restaurant,34.765092,113.744012,,restaurant
Chujing Restaurant (Provincial Government Branch),34.767275,113.746025,,restaurant
Bengbeng Music Restaurant,34.369146,113.919410,,restaurant
New Yijia (Zhengzhou Aviation Port Area) Themed Dining Restaurant (Individual Business),34.365406,113.918814,,restaurant
Shishang Restaurant (Beef Rice),34.718823,113.770208,,restaurant
Zhengzhou Concept Restaurant,34.763862,113.693297,,restaurant
Huimin Restaurant (Guanhutun Life Plaza Branch),34.782608,113.677926,,restaurant
Manyu Bistro (Guomao Branch),34.784425,113.679525,,restaurant
713 Institute Staff Restaurant,34.720756,113.654589,,restaurant
Xu Jia Spicy Chicken and Beef Noodle Restaurant (Clothing Center Residential Compound Branch),34.723499,113.657702,,restaurant
Zhou's Specialty Lamb Offal Soup (Jingguang Expressway Branch),34.725565,113.656808,,restaurant
Yuanwei Restaurant,34.789442,113.801597,,restaurant
Longzi Lake Qianna Yuanxi Hotel - Donghe Chinese Restaurant,34.789033,113.801807,,restaurant
Xingshan Omakase Japanese Cuisine,34.788855,113.801999,,restaurant
Chef's Mansion Restaurant - Gourmet Recommendation Store,34.774810,113.897450,,restaurant
Hetang Yueshe Restaurant,34.783838,113.897397,,restaurant
Sandwich Health Restaurant,34.786132,113.895445,,restaurant
Henan University of Animal Husbandry and Economy Beilin Road Campus Second Student Cafeteria,34.805001,113.686201,,restaurant
Qian Mei'er Yu Guizhou Sour Soup Bean Hot Pot,34.800082,113.675372,,restaurant
Firebird BBQ American Restaurant,34.798238,113.300273,,restaurant
Axiao Seafood Restaurant,34.812692,113.311948,,restaurant
Mixiangke Western Restaurant,34.802785,113.295809,,restaurant
Yunman Hotel (Zhengzhou Airport Zone BYD Factory Branch),34.368782,113.919851,"3-5 floors, Intersection of Linggang Avenue and Deyu Street, Gangli Township, Zhengzhou Airport Economic Zone",hotel
Kaili Hotel (Fantawild Branch),34.776107,113.898716,"200 meters west of the intersection of Fengxi Street and Junxian Road, Zhengdong New District",hotel
Yilong Ruiyun Hotel (Zhengzhou South Third Ring Investment Control Smart Logistics Industrial Park Branch),34.702123,113.851048,"Room 403, Building 9, No. 115 Jinqiu Road, Jinghang Office, Zhengzhou Economic and Technological Development Zone",hotel
Zhengzhou Hanfeng Business Hotel,34.802514,113.682103,"1st Floor, No. 145 Huayuan Road, Jinshui District (South of Beisanhuan Metro Station Exit A)",hotel
Zhengzhou Zhongmou Zhipu Hotel (Only Henan Movie Town Branch),34.786329,113.955310,"Building 6, Rongxin City Window, East of Jiaotong Road, South of Fugui Road, Green Expo Cultural Industry Park",hotel
Xinmi Huangdi Palace Royal Hot Spring Resort Hotel,34.481991,113.550337,"Yinji International Tourism Resort, Liuzhai Town, Xinmi City (5 kilometers from Xuanyuanqiu Exit, Zhengyao Expressway)",hotel
Dukang Grand Hotel (Zhongyuan Wanda May Day Park Metro Station Branch),34.758384,113.612902,No. 178 Tongbai Road.,hotel
Chenxi Hotel (Zhengzhou Convention and Exhibition Center Branch),34.764990,113.745222,"No. 16 Jinshui East Road, Jinshui District, Zhengzhou, Henan Province, at the northeast corner of the intersection of Jinshui East Road and Huanghe South Road",hotel
Zhengzhou High-Tech Holiday Inn,34.819372,113.484180,"No. 186 Heyang Road, High-tech Zone (Adjacent to the Cybersecurity Science and Technology Museum)",hotel
Ji Hotel Zhengzhou Jinshui Road,34.763800,113.693000,"No. 7 Jinshui Road, Jinshui District, Zhengzhou, Henan Province",hotel
Ji Hotel Zhengzhou Convention and Exhibition Center Future Road,34.772300,113.707000,"No. 60 Weilai Road, Jinshui District, Zhengzhou, Henan Province",hotel
Ji Hotel (Zhengzhou Zhongmou Lvbo Avenue Fantawild Tourism Resort Branch),34.760072,113.890748,"100 meters west of the intersection of Lvbo Avenue and Hengtong Road, Shenghe Jiayuan Courtyard 3, Zhongmu, China",hotel
Ji Hotel Zhengzhou Longzi Lake University Area,34.790156,113.800906,"1st Floor, Atour Hotel, Intersection of Boxue Road and Xiuxue Street, Longzihu",hotel
Zhengzhou Provincial Museum Huayuan Road Atour Hotel,34.784188,113.677554,"100 meters south of the intersection of Jingwu Road and Nongye Road, No. 21-5 Jingwu Road, Jinshui District, Zhengzhou",hotel
Zhengzhou Shangjie Aloft Hotel,34.801647,113.310118,No. 101 Zhongxin Road.,hotel
Home Inn - Zhengzhou Future Road Zhongyuan International Expo Center Branch,34.751806,113.707762,"Pangpang Apartment, Shangcheng East Road, Chengdong Street, Guancheng Hui District, Zhengzhou, Henan Province",hotel
Home Inn Business - Zhengzhou Xianghu University Town Fantawild Lvbo Park Branch,34.772125,113.863671,"Southwest corner of the intersection of Zhengkai Avenue and Jinxiu Road, Weiye International Building B, Zhengzhou",hotel
Jinjiang Inn (Zhengzhou Erqi Wanda Jingguang South Road Metro Station Branch),34.720634,113.653960,"No. 46 Hanghai Middle Road (Opposite Hanghai Road Passenger Terminal), near Jingguang Middle Road",hotel
Hanting Zhengzhou East Station Bada Street Hotel,34.712978,113.767825,"200 meters east of the intersection of Eighth Avenue and Jingnan Fourth Road, Zhengzhou Economic Development Zone",hotel
Orange Hotel Zhengzhou Provincial Government MixC Mall,34.771074,113.755528,"Partial 1st floor and 3rd-14th floors, East Unit, Building B, Meijian Building, Southwest corner of the intersection of Zhengguang North Street and Dehou Street, Zhengdong New District",hotel
Hongqiao International Airport,31.196029,121.339775,2550 Hongqiao Road,airport
Xinzheng International Airport,34.528476,113.856808,"No. 1 Yingbin Avenue, Zhengzhou Airport Zone",airport
Zhongchuan Airport,36.515199,103.633554,No. 59 Airport Avenue,airport
Binhai International Airport,39.127015,117.362116,Airport Avenue,airport
Baita International Airport,39.127015,117.362116,Airport Avenue,airport
Tianjin West Station,39.158704,117.162943,No. 1 West Station Front Street,train_station
Handan East Station,34.759081,113.779558,No. 199 Xinyi Road,train_station
Zhengzhou East Station,34.759081,113.779558,No. 199 Xinyi Road,train_station
Shijiazhuang Station,38.010275,114.484536,Jingguang West Street,train_station
Tianjin Station,39.135951,117.210089,No. 1 Xinwei Road,train_station
Zhengzhou Aviation Port Station,34.486036,113.932772,"West Side of National Highway 107, Sanguanmiao, Airport Zone",train_station
Bazhou West Station,34.744948,113.425242,Yulong Street,train_station
Qiandu Music Restaurant,34.741199,113.878040,,restaurant
Han Feng Yuan BBQ and Hot Pot Buffet Restaurant (Baisha Branch),34.736560,113.897986,,restaurant
Dingsheng Fashion Restaurant (Oriental · Dingsheng Center Branch),34.773840,113.759296,,restaurant
Western Restaurant,34.768817,113.933939,,restaurant
Ultraman Theme Restaurant Monster Store,34.789259,113.986234,,restaurant
Ultraman Theme Restaurant - Hero Branch,34.786826,113.988821,,restaurant
Zhongmu Yang's Braised Chicken Small Restaurant,34.756800,113.944461,,restaurant
Brothers Gourmet Small Restaurant,34.805008,113.919082,,restaurant
Yanqiu Golf Restaurant,34.923788,113.514385,,restaurant
Sinen Golf Green Farmhouse Restaurant,34.919063,113.515391,,restaurant
Sinian Golf Lakeside Flower House Restaurant,34.914813,113.516550,,restaurant
Second Owner's Restaurant,34.912985,113.515865,,restaurant
Zhengzhou Business College Restaurant,34.918067,113.537293,,restaurant
Zhengzhou Xinzheng International Airport,34.528476,113.856808,"No. 1 Yingbin Avenue, Zhengzhou Airport Zone",airport
Tianjin Binhai International Airport,39.127015,117.362116,Airport Avenue,airport
Ru Thai Restaurant,39.156418,117.160338,,restaurant
Lideshun Xiao Lao Fanzhuang (Fuxing Road Branch),39.151281,117.160536,,restaurant
Hongchunlai Restaurant (Yintai Apartment Branch),39.161463,117.152478,,restaurant
Tongfahao Fanzhuang,39.149775,117.161625,,restaurant
Luckin Coffee (Pengxin Aqua City Branch),39.150654,117.168945,,restaurant
Extraterrestrial Collection Restaurant (Tianjin Station),39.132228,117.207993,,restaurant
Youth Restaurant (Jinwan Branch),39.132001,117.207130,,restaurant
Halal Dongyishun Restaurant,39.136953,117.216094,,restaurant
Hampton by Hilton Tianjin Station - Hampton Restaurant,39.132857,117.204190,,restaurant
Junken Hotel · Xinjiang Specialty Restaurant,39.140001,117.214997,,restaurant
Guangweixuan Tea Restaurant,34.755575,113.709175,,restaurant
Defacai Chaoshan Claypot Porridge Restaurant (Manhattan Branch),34.755881,113.709081,,restaurant
Wanshengyuan Buffet Restaurant,34.751179,113.702047,,restaurant
Pinyi Era Fusion Restaurant (Lvdu Plaza Branch),34.747855,113.703342,,restaurant
Shang Restaurant (Fengtai Road Branch),34.750079,113.714568,,restaurant
Shi Sui Hot Pot Restaurant (Future Road Branch),34.771161,113.707663,,restaurant
Meilun Chinese Restaurant (Future Road Branch),34.773957,113.708770,,restaurant
Futures Restaurant (Future Building Branch),34.769968,113.708708,,restaurant
Future Grand Hotel · Golden Future Restaurant,34.769025,113.707177,,restaurant
Yanyu Le Fresh Grilled Fish Shop,34.761705,113.612585,,restaurant
Haoke Steak (Zhengzhou Jinyi Huadu Restaurant),34.762755,113.611070,,restaurant
Lao Gang Wei Hong Kong-Style Restaurant (Jinyi International Huadu · Meiyu Branch),34.763075,113.608554,,restaurant
Factory Four Internet-famous Grilled Buns,34.755958,113.621102,,restaurant
North Point Xiuwai Hong Kong-Style Tea Restaurant (Jinyi City Zone C Branch),34.763426,113.606488,,restaurant
Jitu Yayen,34.701940,113.851107,,restaurant
Good Days Restaurant,34.712158,113.844010,,restaurant
Heyuan Restaurant,34.693283,113.860558,,restaurant
Yiyuan Restaurant,34.694581,113.866988,,restaurant
Jiayuan Restaurant,34.690245,113.867122,,restaurant
Lakeview Restaurant,34.812680,113.480604,,restaurant
KFC Drive-Thru Restaurant (Kexue Avenue PetroChina DT),34.807940,113.489790,,restaurant
Little Pig · Lulu Children's Supplementary Food Restaurant,34.816074,113.501214,,restaurant
Shike Baihui Chinese Fast Food Restaurant,34.802844,113.492636,,restaurant
Zhengzhou Museum (Songshan Road Branch),34.723400,113.632600,,attraction
Dao Ben Dao Unmanned Restaurant (Shenglong City Branch),34.721237,113.632227,,restaurant
Music Restaurant & Bar,34.725040,113.629748,,restaurant
Little Lotus Restaurant,34.721666,113.636146,,restaurant
Zanbala Flower Market Second Floor Restaurant,34.726575,113.626975,,restaurant
Kunlun Leju Business Hotel Chinese Restaurant (Huaihe Road Branch),34.729111,113.631083,,restaurant
Mipiji Halal Restaurant (Huainan Street),34.728594,113.636312,,restaurant
Zhengzhou Second People's Hospital Main Campus Nutrition Restaurant (Lianxinli Branch),34.721965,113.639981,,restaurant
Zhuang Bar Music Restaurant,34.726061,113.640451,,restaurant
Painting Music Bar & Restaurant,34.717961,113.626270,,restaurant
Suyi Xiang Vegetarian Buffet Restaurant,34.725310,113.641557,,restaurant
Erqi Square,34.751860,113.666451,,attraction
Han Feng Yuan BBQ and Hotpot Buffet Restaurant (Asia Joy City Branch),34.751785,113.667704,,restaurant
Yuehai Hotel Xuan Palace Western Restaurant (Erqi Square),34.749629,113.667658,,restaurant
Yuehai Hotel - Yuehai Xuan Chinese Restaurant,34.749142,113.667796,,restaurant
Huya Fried Chicken (Henan Zhengzhou Erqi MixC Branch),34.754815,113.662798,,restaurant
Jixu Folk Ballad BBQ House (Zhengzhou Guangcai Branch),34.755287,113.669676,,restaurant
Green Tea Restaurant (Zhengzhou MixC Branch),34.754667,113.662403,,restaurant
Datong Hotel Restaurant,34.747498,113.663838,,restaurant
Henan Museum,34.788263,113.672097,,attraction
Dingyuan Buffet Restaurant,34.786308,113.672932,,restaurant
Enjoy House Tea Restaurant (Century Star Building Branch),34.786292,113.671079,,restaurant
Century Star Garden Restaurant,34.786256,113.671176,,restaurant
Gourmet Restaurant (Zhengzhou Times International Plaza Building 70 Branch),34.786608,113.670287,,restaurant
Agricultural University Home Faculty Restaurant (52 Wenhua Road Branch),34.785268,113.668041,,restaurant
Agricultural University Home Faculty and Staff Restaurant,34.784879,113.666814,,restaurant
Red Salt New-Style Indian-Pakistani Restaurant,34.793421,113.677088,,restaurant
Wentong Ice Room (Guomao 360 Branch),34.784943,113.679565,,restaurant
Wanda Vista Hotel Pinzhen Chinese Restaurant,34.792621,113.678848,,restaurant
Yellow River Huayuankou Tourist Area,34.903629,113.676636,,attraction
Luoshan Fisherman's Delight Restaurant,34.903556,113.670261,,restaurant
Wangwang Small Restaurant,34.901524,113.668069,,restaurant
Ruyi Lake Scenic Area,34.772895,113.724204,,attraction
No. 5 Restaurant (Henan International Chamber of Commerce Building Branch),34.770632,113.719294,,restaurant
Huayu Sichuan Restaurant (Dennis Seven Days Mall Branch),34.777780,113.722674,,restaurant
Dexian Zhijian · Teahouse · Eco Xinyang Cuisine (CBD Branch),34.774628,113.718260,,restaurant
Beilong Lake Wetland Park,34.812300,113.789100,,attraction
Twin Seasons Dessert Fusion Restaurant (Yaoqiao Community North Courtyard Branch),34.813115,113.795071,,restaurant
Xuan Ge Music Restaurant & Bar,34.809266,113.793947,,restaurant
Shijianli Fusion Restaurant,34.818459,113.794111,,restaurant
Lakeside Restaurant,34.803494,113.786967,,restaurant
Coarse Grain Kitchen Lamb Skewers & Stir-fried Chicken,34.809780,113.800337,,restaurant
Enjoy Baiwei Shangshang Pot 29 Yuan Hotpot Buffet Restaurant (Shigeng Community Branch) (Temporarily Closed),34.808834,113.797840,,restaurant
Sanhuangzhai,34.473496,112.952063,,attraction
Yiwei Shanfang Vegetarian Restaurant (Official Store in Songshan Shaolin Scenic Area),34.513012,112.952106,,restaurant
Shaolin Service Area Express Restaurant,34.427016,112.929723,,restaurant
Chanwu Grand Hotel - Chinese Restaurant,34.471305,113.017117,,restaurant
Songshan Unique Water Banquet Cultural Restaurant,34.449754,113.018493,,restaurant
Yunshe Tea Restaurant,34.468766,113.028504,,restaurant
Zhengzhou Museum New Hall,34.739600,113.546720,,attraction
Little Taste Restaurant,34.740996,113.539988,,restaurant
Zhengzhou Olympic Jian'guo Hotel - Seafood Buffet Restaurant,34.739770,113.537534,,restaurant
Zhengdi Olympic Jian'guo Hotel All-day Dining Restaurant,34.740659,113.537609,,restaurant
Jiupu Restaurant,34.739579,113.561973,,restaurant
Peony Restaurant (Yi'er Hotel Management Company),34.739995,113.562140,,restaurant
M Art Restaurant Qidesheng · Beef Noodles,34.739800,113.563173,,restaurant
Waku No. 50 (Kaixuan Road Branch),34.740377,113.563327,,restaurant
