city,attraction_name,attraction_id,description,attraction_type,address,latitude,longitude,rating,opening_time,closing_time,closing_dates,min_visit_hours,max_visit_hours,ticket_price
Suzhou,Yi Garden,B0FFG01X8U,"The last garden built among the Suzhou gardens, incorporating the essence of various garden styles.",Historical and Cultural,,31.307521,120.621266,4.8,07:30,17:30,,0.5,2.0,15
Suzhou,Pingjiang Road Historical and Cultural District,B0FFG6OTD5,"The most well-preserved ancient street district in Suzhou, featuring Ming and Qing dynasty buildings along the river, with enchanting night views.",Historical and Cultural,,31.313969,120.634556,4.9,Open 24 Hours,Open 24 Hours,,1.0,2.5,0
Suzhou,Pearl Tower Scenic Garden,B02001GTC8,"A classical garden within Tongli Ancient Town, famous for the Kunqu opera 'The Pearl Tower.'",Historical and Cultural,,31.160042,120.718122,4.6,08:00,17:15,,0.5,2.0,0
Suzhou,Shiquan Street,B02000JAH6,"A literary and artistic district in Suzhou, filled with cafes, bookstores, and galleries, exuding a strong cultural atmosphere.",Leisure Experience,,31.298923,120.632998,4.9,Open 24 Hours,Open 24 Hours,,1.5,3.0,0
Suzhou,Retreat & Reflection Garden,B02001D6W2,"The core garden of Tongli Ancient Town, a UNESCO World Heritage Site and a representative work of late Jiangnan garden design.",Historical and Cultural,,31.157833,120.720272,4.8,08:00,17:15,,1.0,2.5,50
Suzhou,Suzhou Museum,B020001285,"A perfect blend of modern architecture designed by I. M. Pei and classical gardens, showcasing the essence of Jiangnan culture.",Historical and Cultural,,31.322948,120.627856,4.8,09:00,17:00,Monday,1.0,2.5,0
Suzhou,Three Bridges Scenic Area,B0FFLMDS4P,"The iconic scenery of Tongli Ancient Town, featuring three stone bridges connected together, symbolizing good fortune and prosperity.",Historical and Cultural,,31.158008,120.717448,4.4,Open 24 Hours,Open 24 Hours,,0.0,1.5,0
Suzhou,Shantang Street Scenic Area,B0200178TG,"A thousand-year-old ancient street with picturesque night views, abundant traditional snacks, and an experience of Suzhou's classical nightlife.",Historical and Cultural,,31.317059,120.602105,4.8,Open 24 Hours,Open 24 Hours,,1.0,2.5,12
Suzhou,Humble Administrator's Garden,B020001R2Q,"One of China's Four Famous Gardens, an outstanding example of Ming dynasty garden art, with clear ponds and intricately arranged pavilions and towers.",Historical and Cultural,,31.324194,120.629211,4.8,07:30,17:30,,2.0,3.5,90
