restaurant_name,city,latitude,longitude,price_per_person,cuisine,opening_time,closing_time,nearby_attraction_name,nearby_attraction_coords,query_latitude,query_longitude,rating,tags
Louwailou (Hangzhou West Lake Scenic Area Branch),Hangzhou,30.250209,120.140723,157.0,Chinese Restaurant;General Restaurant,16:30,20:30,Solitary Hill Park,"120.142481,30.251654",30.251654,120.142481,4.5,Birthday Package
Hangzhou Shangri-La · Coffee Garden,Hangzhou,30.252574,120.137577,207.0,Cafe;Cafe,11:00,21:00,Solitary Hill Park,"120.142481,30.251654",30.251654,120.142481,4.1,Online Queue
Hangzhou Xinxin Hotel · 1913 Restaurant,Hangzhou,30.255994,120.144148,371.0,Food Service Related;Food Service Related,09:30,21:30,Solitary Hill Park,"120.142481,30.251654",30.251654,120.142481,4.3,Private Room;Birthday Package
Huabei Hotel - Chinese Restaurant,Hangzhou,30.253808,120.133460,112.0,Chinese Restaurant;Chinese Restaurant,17:30,20:30,Solitary Hill Park,"120.142481,30.251654",30.251654,120.142481,4.1,Must-Eat Top 10;Waiting Area
Twelve Hours Lakeview Restaurant,Hangzhou,30.251519,120.131988,100.0,Food Service Related;Food Service Related,10:30,20:00,Solitary Hill Park,"120.142481,30.251654",30.251654,120.142481,4.0,Waiting Area
Qinglan (Yang Gong Di Branch),Hangzhou,30.248263,120.131589,368.0,Food Service Related;Food Service Related,17:30,21:30,Solitary Hill Park,"120.142481,30.251654",30.251654,120.142481,4.4,Waiting Area;Birthday Package
Haihui Pavilion New Jiangnan Vegetarian Noodle Restaurant,Hangzhou,30.239004,120.105828,37.0,Food Service Related;Food Service Related,07:00,20:00,Lingyin Temple,"120.101406,30.240826",30.240826,120.101406,4.8,Must-Eat Top 10
Fayun Aman Western Restaurant,Hangzhou,30.237412,120.097724,100.0,Foreign Restaurant;Western Restaurant,11:00,21:00,Lingyin Temple,"120.101406,30.240826",30.240826,120.101406,4.3,Birthday Package
Dayin Qingxin Vegetarian Buffet Restaurant (Hidden Market Branch),Hangzhou,30.240622,120.106983,30.0,Chinese Restaurant;中式素菜馆,17:00,19:00,Lingyin Temple,"120.101406,30.240826",30.240826,120.101406,4.4,Waiting Area
Ru Yi Restaurant,Hangzhou,30.238028,120.106488,105.0,Chinese Restaurant;Chinese Restaurant,10:30,20:30,Lingyin Temple,"120.101406,30.240826",30.240826,120.101406,4.7,Waiting Area
Beigao Summit Cableway Restaurant,Hangzhou,30.243268,120.106763,21.0,Chinese Restaurant;Chinese Restaurant,10:00,21:00,Lingyin Temple,"120.101406,30.240826",30.240826,120.101406,4.1,Waiting Area
Luyingji Forest-Style Restaurant (Lingyin Scenic Area Branch),Hangzhou,30.238288,120.106949,100.0,Food Service Related;Food Service Related,11:00,21:00,Lingyin Temple,"120.101406,30.240826",30.240826,120.101406,4.0,Outdoor Seating;Private Room
Sansheng Xiaowu · Mountain Wild Food Collection (Hangzhou West Lake Lingyin Branch),Hangzhou,30.235894,120.105016,78.0,Chinese Restaurant;Chinese Restaurant,10:30,21:00,Lingyin Temple,"120.101406,30.240826",30.240826,120.101406,4.7,Private Room
Qiantang Courtyard Restaurant (Lingyin Branch),Hangzhou,30.243659,120.107314,106.0,Chinese Restaurant;Chinese Restaurant,10:00,22:00,Lingyin Temple,"120.101406,30.240826",30.240826,120.101406,4.7,Private Room
Manshu · Tianzhu Li Restaurant,Hangzhou,30.235660,120.104613,150.0,Chinese Restaurant;Chinese Restaurant,16:30,20:30,Lingyin Temple,"120.101406,30.240826",30.240826,120.101406,4.4,Must-Eat Top 10;Private Room
Qiaoshi Courtyard Restaurant,Hangzhou,30.235839,120.105186,132.0,Chinese Restaurant;Zhejiang Cuisine,09:00,22:00,Lingyin Temple,"120.101406,30.240826",30.240826,120.101406,4.3,Waiting Area;Birthday Package
Ten Years Courtyard Restaurant (Lingyin Branch),Hangzhou,30.238952,120.108082,81.0,Chinese Restaurant;Chinese Restaurant,16:30,21:00,Yongfu Temple,"120.097524,30.238978",30.238978,120.097524,4.4,Waiting Area;Online Queue
Zhiweiguan · Weizhuang (Yang Gong Di Branch),Hangzhou,30.230581,120.137300,141.0,Chinese Restaurant;Chinese Restaurant,16:30,20:00,Yang Gong Causeway,"120.136580,30.232456",30.232456,120.136580,4.3,Must-Eat Top 10;Outdoor Seating
Weilu · West Lake 1138 Cultural Tea Restaurant,Hangzhou,30.230253,120.138864,100.0,Chinese Restaurant;Chinese Restaurant,11:00,21:00,Yang Gong Causeway,"120.136580,30.232456",30.232456,120.136580,3.8,Must-Eat Top 10
Jie Xiang Lou,Hangzhou,30.229459,120.133953,751.0,Chinese Restaurant;Zhejiang Cuisine,17:00,20:30,Yang Gong Causeway,"120.136580,30.232456",30.232456,120.136580,4.5,Waiting Area
West Lake State Guesthouse Zihui Hall,Hangzhou,30.234669,120.133019,503.0,Chinese Restaurant;Chinese Restaurant,17:00,22:00,Yang Gong Causeway,"120.136580,30.232456",30.232456,120.136580,4.5,Online Queue
Purple Bamboo · Water Music West Lake · Courtyard Restaurant,Hangzhou,30.230567,120.131086,153.0,Chinese Restaurant;Zhejiang Cuisine,16:00,21:00,Yang Gong Causeway,"120.136580,30.232456",30.232456,120.136580,4.7,Must-Eat Top 10;Outdoor Seating
Yunshe Tea Restaurant,Hangzhou,30.227673,120.133043,60.0,Chinese Restaurant;Zhejiang Cuisine,08:00,22:30,Yang Gong Causeway,"120.136580,30.232456",30.232456,120.136580,4.1,Outdoor Seating;Birthday Package
Green Shade Restaurant,Hangzhou,30.227666,120.132958,100.0,Tea House;Tea House|Chinese Restaurant;Chinese Restaurant,08:00,21:00,Yang Gong Causeway,"120.136580,30.232456",30.232456,120.136580,4.3,Outdoor Seating;Private Room
Santai Villa Chinese Restaurant (Santai Road Branch),Hangzhou,30.229423,120.129591,100.0,Food Service Related;Food Service Related,17:00,20:30,Yang Gong Causeway,"120.136580,30.232456",30.232456,120.136580,4.3,Must-Eat Top 10;Online Queue
Zhejiang Hotel Garden Restaurant,Hangzhou,30.232224,120.127510,121.0,Chinese Restaurant;Chinese Restaurant,17:00,21:00,Yang Gong Causeway,"120.136580,30.232456",30.232456,120.136580,4.2,Waiting Area;Online Queue
Tulip Tea Dining (Prince Bay Park North Gate Welcome Pavilion Branch),Hangzhou,30.227600,120.143830,100.0,Fast Food Restaurant;Fast Food Restaurant,11:00,21:00,Yang Gong Causeway,"120.136580,30.232456",30.232456,120.136580,3.4,Waiting Area
Tomacado Flower Kitchen (in77 · Hangzhou First Store),Hangzhou,30.253352,120.162044,178.0,Foreign Restaurant;Western Restaurant,11:00,22:00,Hangzhou Hubin Intime in77 Area A,"120.162484,30.253160",30.253160,120.162484,4.7,Private Room;Birthday Package
Manyunli Garden Restaurant (Lakeside Yintai in77D District Branch),Hangzhou,30.253583,120.163793,121.0,Foreign Restaurant;Western Restaurant,11:00,21:00,Hangzhou Hubin Intime in77 Area A,"120.162484,30.253160",30.253160,120.162484,4.6,Waiting Area;Birthday Package
Xizi Restaurant (Xizi Qingyan),Hangzhou,30.252058,120.163461,97.0,Chinese Restaurant;Chinese Restaurant,16:30,21:00,Hangzhou Hubin Intime in77 Area A,"120.162484,30.253160",30.253160,120.162484,4.6,Waiting Area
Birdsong & Flowers · West Lake · Lakeview Restaurant (Renhe Branch),Hangzhou,30.252050,120.163604,500.0,Chinese Restaurant;Chinese Restaurant,16:00,21:00,Hangzhou Hubin Intime in77 Area A,"120.162484,30.253160",30.253160,120.162484,4.6,Waiting Area;Birthday Package
Sisi Pear Brunch & Lounge (Hangzhou Hubin 88 Branch),Hangzhou,30.254685,120.162456,100.0,Food Service Related;Food Service Related,11:00,21:00,Hangzhou Hubin Intime in77 Area A,"120.162484,30.253160",30.253160,120.162484,4.6,Private Room
Hangzhou Grand Hyatt Hotel · Lakeside 28 Chinese Restaurant,Hangzhou,30.254843,120.161906,302.0,Chinese Restaurant;Chinese Restaurant,17:30,21:30,Hangzhou Hubin Intime in77 Area A,"120.162484,30.253160",30.253160,120.162484,4.6,Online Queue
The 101st Garden Restaurant (Hangzhou Lakeside 88 Branch),Hangzhou,30.254945,120.162473,253.0,Foreign Restaurant;Western Restaurant,16:30,21:00,Hangzhou Hubin Intime in77 Area A,"120.162484,30.253160",30.253160,120.162484,4.5,Birthday Package;Online Queue
1921 Restaurant (West Lake Frontline Lake View Branch),Hangzhou,30.251796,120.163967,212.0,Chinese Restaurant;Chinese Restaurant,11:00,21:00,Hangzhou Hubin Intime in77 Area A,"120.162484,30.253160",30.253160,120.162484,4.5,Must-Eat Top 10
Pang Ge Lia Crab Pot (Lakeside Intime in77C2 Area Branch),Hangzhou,30.252520,120.164548,89.0,Chinese Restaurant;Chinese Restaurant,10:30,21:30,Hangzhou Hubin Intime in77 Area A,"120.162484,30.253160",30.253160,120.162484,4.7,Outdoor Seating;Birthday Package
Hangzhou Restaurant (Yan'an Road Branch),Hangzhou,30.251744,120.164014,79.0,Chinese Restaurant;General Restaurant,11:00,20:30,Hangzhou Hubin Intime in77 Area A,"120.162484,30.253160",30.253160,120.162484,4.6,Online Queue
Xinyaoji Ping Liang Zheng Tea Restaurant,Hangzhou,30.276975,120.163125,100.0,Fast Food Restaurant;Fast Food Restaurant,11:00,21:00,Zhejiang Museum of Natural History,"120.164581,30.276814",30.276814,120.164581,2.3,Private Room;Birthday Package
Zhang Zhengfa Tea Restaurant (West Lake Cultural Plaza Branch),Hangzhou,30.276600,120.163054,24.0,Fast Food Restaurant;Fast Food Restaurant,10:00,22:00,Zhejiang Museum of Natural History,"120.164581,30.276814",30.276814,120.164581,4.2,Private Room;Waiting Area
Huijuan Noodle House · Restaurant (Zhongbei Bridge Branch),Hangzhou,30.276871,120.166147,36.0,Chinese Restaurant;Chinese Restaurant,16:00,21:00,Zhejiang Museum of Natural History,"120.164581,30.276814",30.276814,120.164581,4.2,Private Room
Green Tea Restaurant (Hangzhou West Lake Cultural Plaza Branch),Hangzhou,30.277606,120.163290,71.0,Chinese Restaurant;Chinese Restaurant,10:00,20:00,Zhejiang Museum of Natural History,"120.164581,30.276814",30.276814,120.164581,4.5,Waiting Area
Dalaodian Hong Kong-Style Tea Restaurant (Hangzhou Branch),Hangzhou,30.276375,120.162975,100.0,Fast Food Restaurant;Fast Food Restaurant,11:00,21:00,Zhejiang Museum of Natural History,"120.164581,30.276814",30.276814,120.164581,3.8,Private Room;Online Queue
New Bailu Restaurant (Cultural Plaza Intime Department Store Branch),Hangzhou,30.277581,120.163050,49.0,Chinese Restaurant;Zhejiang Cuisine,16:30,21:00,Zhejiang Museum of Natural History,"120.164581,30.276814",30.276814,120.164581,4.7,Outdoor Seating;Online Queue
Pizza Marzano Italian Restaurant (West Lake Cultural Plaza Branch),Hangzhou,30.277919,120.163326,69.0,Foreign Restaurant;Italian Restaurant,10:00,22:00,Zhejiang Museum of Natural History,"120.164581,30.276814",30.276814,120.164581,4.3,Must-Eat Top 10
Shangxia Ruo Restaurant,Hangzhou,30.277879,120.161926,676.0,Chinese Restaurant;Chinese Restaurant,17:00,21:00,Zhejiang Museum of Natural History,"120.164581,30.276814",30.276814,120.164581,4.6,Birthday Package
Hejiaxuan Shunde Cuisine (Zhaohui Branch),Hangzhou,30.276753,120.168117,100.0,Chinese Restaurant;Chinese Restaurant,16:30,21:30,Zhejiang Museum of Natural History,"120.164581,30.276814",30.276814,120.164581,4.5,Private Room;Online Queue
POLUX Deli,Hangzhou,30.274607,120.161048,186.0,公司企业;公司;公司,11:00,21:00,Zhejiang Museum of Natural History,"120.164581,30.276814",30.276814,120.164581,4.7,Private Room
Rokko Hotel (Hangzhou West Lake Jiuxi Branch) · Restaurant,Hangzhou,30.195991,120.113222,100.0,Chinese Restaurant;Chinese Restaurant,11:00,21:00,Nine Creeks and Misty Trees,"120.113350,30.202395",30.202395,120.113350,3.4,Must-Eat Top 10;Birthday Package
Jiulong Xiangzhang Courtyard Restaurant (Jiuxi Branch),Hangzhou,30.193979,120.115111,80.0,Fast Food Restaurant;Tea Restaurant,08:30,19:30,Nine Creeks and Misty Trees,"120.113350,30.202395",30.202395,120.113350,4.2,Must-Eat Top 10;Online Queue
Jiuxi Xiaozhu · Xunwei Restaurant (Jiuxi Store),Hangzhou,30.193690,120.115651,96.0,Food Service Related;Food Service Related,08:30,20:00,Nine Creeks and Misty Trees,"120.113350,30.202395",30.202395,120.113350,4.1,Must-Eat Top 10;Private Room
Chalan Garden Restaurant (Jiuxi Branch),Hangzhou,30.212569,120.117874,92.0,Chinese Restaurant;Chinese Restaurant,10:00,20:00,Nine Creeks and Misty Trees,"120.113350,30.202395",30.202395,120.113350,4.6,Must-Eat Top 10;Private Room
Hangzhou Millennium Resort Hotel - Shixi Restaurant,Hangzhou,30.191025,120.115325,129.0,Foreign Restaurant;Western Restaurant,10:00,22:00,Nine Creeks and Misty Trees,"120.113350,30.202395",30.202395,120.113350,4.2,Private Room
Longjing Courtyard Restaurant,Hangzhou,30.214875,120.107925,100.0,Chinese Restaurant;Chinese Restaurant,11:00,21:00,Nine Creeks and Misty Trees,"120.113350,30.202395",30.202395,120.113350,4.1,Birthday Package;Online Queue
Shanghai Railway Qianjiang Hotel - Restaurant,Hangzhou,30.190588,120.120679,100.0,Food Service Related;Food Service Related,11:00,21:00,Nine Creeks and Misty Trees,"120.113350,30.202395",30.202395,120.113350,3.7,Online Queue
Lanxuan Restaurant,Hangzhou,30.215821,120.117607,100.0,Chinese Restaurant;Chinese Restaurant,10:00,21:00,Nine Creeks and Misty Trees,"120.113350,30.202395",30.202395,120.113350,4.4,Online Queue
Meiling Renjia Restaurant,Hangzhou,30.215918,120.117925,77.0,Chinese Restaurant;Chinese Restaurant,09:00,21:00,Nine Creeks and Misty Trees,"120.113350,30.202395",30.202395,120.113350,4.2,Outdoor Seating;Birthday Package
Hangzhou West Lake Scenic Area Mountain View Garden Restaurant,Hangzhou,30.216137,120.118931,486.0,Chinese Restaurant;Cantonese Cuisine,10:30,21:00,Nine Creeks and Misty Trees,"120.113350,30.202395",30.202395,120.113350,3.8,Must-Eat Top 10;Private Room
Ouxiangju Restaurant,Hangzhou,30.230372,120.148032,63.0,Chinese Restaurant;Chinese Restaurant,17:00,19:30,Leifeng Pagoda Scenic Area,"120.148849,30.230934",30.230934,120.148849,4.3,Waiting Area
Kouzi International Hotel Restaurant,Hangzhou,30.232386,120.149789,100.0,Chinese Restaurant;Chinese Restaurant,11:00,21:00,Leifeng Pagoda Scenic Area,"120.148849,30.230934",30.230934,120.148849,3.3,Outdoor Seating;Waiting Area
Zizhen Garden Tea Banquet,Hangzhou,30.225658,120.152509,100.0,Tea House;Tea House,10:00,22:00,Leifeng Pagoda Scenic Area,"120.148849,30.230934",30.230934,120.148849,4.2,Private Room
West Lake Banquet · Lakeview Restaurant,Hangzhou,30.236157,120.154292,360.0,Chinese Restaurant;Seafood Restaurant,11:00,21:00,Leifeng Pagoda Scenic Area,"120.148849,30.230934",30.230934,120.148849,4.5,Private Room;Birthday Package
Xiaolu Mansion · Republic Private Banquet,Hangzhou,30.225240,120.143968,206.0,Chinese Restaurant;Zhejiang Cuisine,11:00,21:00,Leifeng Pagoda Scenic Area,"120.148849,30.230934",30.230934,120.148849,4.3,Birthday Package;Online Queue
Xiaolu Creative Restaurant (Taiziwan Branch),Hangzhou,30.225213,120.143880,100.0,Food Service Related;Food Service Related,11:00,21:00,Leifeng Pagoda Scenic Area,"120.148849,30.230934",30.230934,120.148849,3.6,Must-Eat Top 10
West Lake Impressions Restaurant,Hangzhou,30.234732,120.156845,120.0,Chinese Restaurant;Chinese Restaurant,17:00,21:00,Leifeng Pagoda Scenic Area,"120.148849,30.230934",30.230934,120.148849,4.6,Waiting Area
Liuying Lakeside,Hangzhou,30.238732,120.154521,217.0,Chinese Restaurant;Chinese Restaurant,17:00,21:00,Leifeng Pagoda Scenic Area,"120.148849,30.230934",30.230934,120.148849,4.6,Waiting Area
Haoke Steak (Hangzhou Tianyang D32 Restaurant),Hangzhou,30.314744,120.137545,77.0,Foreign Restaurant;牛扒店(扒房),10:00,22:00,Hangzhou Arts and Crafts Museum,"120.136930,30.315645",30.315645,120.136930,4.4,Private Room
Courtyard Restaurant (Gongchen Bridge Store),Hangzhou,30.315401,120.138443,75.0,Chinese Restaurant;Chinese Restaurant,17:00,21:00,Hangzhou Arts and Crafts Museum,"120.136930,30.315645",30.315645,120.136930,4.3,Outdoor Seating
BRIDGE · Western Restaurant,Hangzhou,30.317777,120.136895,100.0,Foreign Restaurant;Foreign Restaurant,11:00,21:00,Hangzhou Arts and Crafts Museum,"120.136930,30.315645",30.315645,120.136930,3.6,Outdoor Seating;Waiting Area
Yiheng Yisu · Auspicious Restaurant (Gongchen Bridge Branch),Hangzhou,30.317787,120.136903,32.0,Chinese Restaurant;Chinese Restaurant,10:30,20:30,Hangzhou Arts and Crafts Museum,"120.136930,30.315645",30.315645,120.136930,4.8,Private Room
Sanren Noodle Restaurant (Jinchang Wenhua Branch),Hangzhou,30.312099,120.142601,25.0,Chinese Restaurant;Chinese Restaurant,16:30,21:00,Hangzhou Arts and Crafts Museum,"120.136930,30.315645",30.315645,120.136930,4.1,Must-Eat Top 10;Birthday Package
Thousand Islands Thousand Flavors (Canal Branch),Hangzhou,30.321992,120.137046,131.0,Chinese Restaurant;Chinese Restaurant,17:00,20:30,Hangzhou Arts and Crafts Museum,"120.136930,30.315645",30.315645,120.136930,4.6,Online Queue
Baijia Dajia Restaurant (Wenzhou Road Branch),Hangzhou,30.320706,120.141437,18.0,Chinese Restaurant;Chinese Restaurant,14:00,19:00,Hangzhou Arts and Crafts Museum,"120.136930,30.315645",30.315645,120.136930,4.2,Birthday Package;Online Queue
Shida Renjia Happy Restaurant (Jiru Garden Branch),Hangzhou,30.317507,120.129761,21.0,Food Service Related;Food Service Related,11:00,21:00,Hangzhou Arts and Crafts Museum,"120.136930,30.315645",30.315645,120.136930,4.1,Waiting Area;Birthday Package
Nongtangli (Xiaohe Branch),Hangzhou,30.309394,120.133173,75.0,Chinese Restaurant;Chinese Restaurant,16:30,21:00,Hangzhou Arts and Crafts Museum,"120.136930,30.315645",30.315645,120.136930,4.4,Must-Eat Top 10;Online Queue
Pizza Italian Restaurant (Grand Canal Street Branch),Hangzhou,30.319066,120.144087,56.0,Foreign Restaurant;Italian Restaurant,10:00,22:00,Hangzhou Arts and Crafts Museum,"120.136930,30.315645",30.315645,120.136930,4.6,Must-Eat Top 10
Xiaolu Creative Restaurant (Quyuan Branch),Hangzhou,30.246209,120.132068,158.0,Food Service Related;Food Service Related,10:00,21:00,Spring Dawn at Su Causeway,"120.137960,30.243880",30.243880,120.137960,4.3,Online Queue
Lotus Encounter Garden Restaurant,Hangzhou,30.247373,120.131962,103.0,Chinese Restaurant;Zhejiang Cuisine,11:00,19:30,Spring Dawn at Su Causeway,"120.137960,30.243880",30.243880,120.137960,4.7,Birthday Package
Qianyuan · Xingheji (Maojiabu Branch),Hangzhou,30.240230,120.126352,398.0,Chinese Restaurant;Cantonese Cuisine,17:00,21:30,Spring Dawn at Su Causeway,"120.137960,30.243880",30.243880,120.137960,4.5,Online Queue
Macau Chan Kwong Kee (Xiaoshan International Airport T4 Departure Mezzanine Branch),Hangzhou,30.234878,120.431013,100.0,Chinese Restaurant;Chinese Restaurant,11:00,21:00,Tianhe International Airport,"120.432413,30.234708",30.234708,120.432413,3.4,Must-Eat Top 10
Original No. 1 Restaurant,Hangzhou,30.228891,120.426744,100.0,Chinese Restaurant;Chinese Restaurant,11:00,21:00,Tianhe International Airport,"120.432413,30.234708",30.234708,120.432413,3.9,Must-Eat Top 10;Birthday Package
Go Wild Restaurant,Hangzhou,30.238984,120.446523,100.0,Chinese Restaurant;Chinese Restaurant,11:00,21:00,Tianhe International Airport,"120.432413,30.234708",30.234708,120.432413,4.0,Birthday Package
Grand Courtyard (Xixi Road),Hangzhou,30.257620,120.092557,86.0,Chinese Restaurant;Chinese Restaurant,16:30,20:30,Hangzhou West Station,"120.091014,30.260867",30.260867,120.091014,4.5,Online Queue
Fudi Restaurant,Hangzhou,30.260346,120.095285,100.0,Chinese Restaurant;Chinese Restaurant,11:00,21:00,Hangzhou West Station,"120.091014,30.260867",30.260867,120.091014,3.9,Outdoor Seating
Fuyuan New Village Elderly Restaurant,Hangzhou,30.264739,120.094010,100.0,Chinese Restaurant;Chinese Restaurant,11:00,21:00,Hangzhou West Station,"120.091014,30.260867",30.260867,120.091014,3.5,Private Room
Tu Haha Music Bar & Restaurant (Taifu Plaza Branch),Hangzhou,30.165000,120.285112,103.0,Chinese Restaurant;Chinese Restaurant,18:30,02:30,Hangzhou South Station,"120.295589,30.172640",30.172640,120.295589,4.3,Outdoor Seating;Waiting Area
Radisson Blu Hotel Xiaoshan · Jufeng Chinese Restaurant (Xiaoshan Branch),Hangzhou,30.163626,120.284667,105.0,Chinese Restaurant;Chinese Restaurant,16:30,20:30,Hangzhou South Station,"120.295589,30.172640",30.172640,120.295589,4.4,Birthday Package
Qingzhu Music Restaurant & Bar,Hangzhou,30.164001,120.283843,98.0,Chinese Restaurant;Chinese Restaurant,16:30,02:30,Hangzhou South Station,"120.295589,30.172640",30.172640,120.295589,4.1,Online Queue
Hangzhou Xiaoshan International Airport - Restaurant No. 3,Hangzhou,30.239055,120.446681,30.0,Chinese Restaurant;Chinese Restaurant,11:00,21:00,Xiaoshan International Airport,"120.432413,30.234708",30.234708,120.432413,4.0,Outdoor Seating
Air China Staff Restaurant (Air China Base Branch),Hangzhou,30.238608,120.449026,17.0,Chinese Restaurant;Chinese Restaurant,11:00,21:00,Xiaoshan International Airport,"120.432413,30.234708",30.234708,120.432413,4.1,Outdoor Seating
Guangweixuan Hong Kong-Style Tea Restaurant (Hangzhou East Station),Hangzhou,30.290107,120.209962,100.0,Fast Food Restaurant;Fast Food Restaurant,11:00,21:00,Hangzhou East Station,"120.212605,30.290846",30.290846,120.212605,2.5,Online Queue
Airuiyun Restaurant (Dongxi Debi Yiyuan Branch),Hangzhou,30.291007,120.217230,76.0,Chinese Restaurant;Chinese Restaurant|Cafe;Cafe,10:00,23:00,Hangzhou East Station,"120.212605,30.290846",30.290846,120.212605,4.0,Private Room;Online Queue
Shen Ji Hong Kong Style Tea Restaurant (Tiancheng Yinzuo Building 3 Branch),Hangzhou,30.289940,120.207477,30.0,Fast Food Restaurant;Tea Restaurant,10:00,19:00,Hangzhou East Station,"120.212605,30.290846",30.290846,120.212605,4.2,Outdoor Seating;Waiting Area
Green Tea Restaurant (Hangzhou East Station MixC Mall Branch),Hangzhou,30.293504,120.217725,74.0,Chinese Restaurant;Chinese Restaurant,10:30,21:30,Hangzhou East Station,"120.212605,30.290846",30.290846,120.212605,4.7,Must-Eat Top 10
Minhua Ice Room (Hangzhou East Station MixC Mall Branch),Hangzhou,30.294025,120.217615,57.0,Food Service Related;Food Service Related,10:00,21:00,Hangzhou East Station,"120.212605,30.290846",30.290846,120.212605,4.4,Private Room
Qilixiang Restaurant (Ouyada Hankou Life Mall Branch),Hangzhou,30.614857,114.254582,45.0,Chinese Restaurant;Chinese Restaurant,10:00,22:00,Hankou Station,"114.254822,30.618531",30.618531,114.254822,3.8,Online Queue
Wuhan Dongfang Jianguo Hotel Restaurant,Hangzhou,30.616003,114.258459,120.0,Chinese Restaurant;Hot Pot,17:00,21:00,Hankou Station,"114.254822,30.618531",30.618531,114.254822,4.0,Private Room
Hubei Specialty Restaurant (Ouyada International Plaza),Hangzhou,30.614411,114.253549,100.0,购物相关场所;购物相关场所,11:00,21:00,Hankou Station,"114.254822,30.618531",30.618531,114.254822,3.6,Waiting Area
Railway Mansion City Plaza Grand Hotel Chinese Restaurant,Hangzhou,30.243947,120.182733,100.0,Chinese Restaurant;Chinese Restaurant,11:00,21:00,Hangzhou Station,"120.182860,30.243482",30.243482,120.182860,3.8,Must-Eat Top 10;Waiting Area
Hangzhou Red Star Cultural Grand Hotel - Jade Dragonfly Restaurant,Hangzhou,30.243913,120.179120,114.0,Chinese Restaurant;Chinese Restaurant,11:00,21:00,Hangzhou Station,"120.182860,30.243482",30.243482,120.182860,3.9,Outdoor Seating;Online Queue
Jade Dragonfly Restaurant,Hangzhou,30.243917,120.178859,78.0,Chinese Restaurant;Chinese Restaurant,17:00,20:00,Hangzhou Station,"120.182860,30.243482",30.243482,120.182860,4.5,Private Room;Online Queue
Baozhongbao Dining Hall,Hangzhou,30.247432,120.180539,100.0,Chinese Restaurant;General Restaurant,16:30,21:00,Hangzhou Station,"120.182860,30.243482",30.243482,120.182860,4.5,Waiting Area;Online Queue
Hangzhou Postal Staff Restaurant (Hangzhou Postal Hub Building),Hangzhou,30.248660,120.184147,100.0,Chinese Restaurant;Chinese Restaurant,11:00,21:00,Hangzhou Station,"120.182860,30.243482",30.243482,120.182860,3.6,Must-Eat Top 10
Xiaoman Food Restaurant (Jinmao Mansion Sales Office Branch),Hangzhou,30.602733,114.421393,38.0,Chinese Restaurant;Chinese Restaurant,11:00,21:00,Wuhan Station,"114.424338,30.606981",30.606981,114.424338,4.0,Outdoor Seating;Private Room
Fuman 1955 · Art Restaurant,Hangzhou,30.608037,114.431900,100.0,Chinese Restaurant;Chinese Restaurant,12:00,21:00,Wuhan Station,"114.424338,30.606981",30.606981,114.424338,4.3,Private Room;Online Queue
Haochiguan Restaurant,Hangzhou,30.611859,114.436241,100.0,Chinese Restaurant;Chinese Restaurant,11:00,21:00,Wuhan Station,"114.424338,30.606981",30.606981,114.424338,3.6,Private Room;Birthday Package
Shun'an Restaurant,Hangzhou,30.609560,114.410848,100.0,Chinese Restaurant;Chinese Restaurant,17:00,21:00,Wuhan Station,"114.424338,30.606981",30.606981,114.424338,3.6,Private Room
Lakeside BBQ Shrimp & Crab House (Yangchun Lakeside Branch),Hangzhou,30.618077,114.417103,42.0,Chinese Restaurant;General Restaurant,16:00,03:00,Wuhan Station,"114.424338,30.606981",30.606981,114.424338,4.3,Private Room;Online Queue
Sifang Restaurant,Hangzhou,30.529796,114.316387,100.0,Chinese Restaurant;Chinese Restaurant,08:00,18:00,Wuchang Station,"114.317603,30.528545",30.528545,114.317603,3.6,Must-Eat Top 10;Outdoor Seating
Daye Restaurant,Hangzhou,30.526811,114.318071,100.0,Chinese Restaurant;Chinese Restaurant,11:00,21:00,Wuchang Station,"114.317603,30.528545",30.528545,114.317603,3.7,Must-Eat Top 10;Private Room
Boqiang Restaurant,Hangzhou,30.526381,114.315283,100.0,Chinese Restaurant;Chinese Restaurant,11:00,21:00,Wuchang Station,"114.317603,30.528545",30.528545,114.317603,3.8,Private Room;Waiting Area
Dabieshan Half Fish Restaurant (Ziyang Village Community Branch),Hangzhou,30.524663,114.317663,46.0,Chinese Restaurant;Chinese Restaurant,09:00,22:00,Wuchang Station,"114.317603,30.528545",30.528545,114.317603,4.1,Must-Eat Top 10;Birthday Package
Lisheng Restaurant (Wuchang Apartment Branch),Hangzhou,30.530909,114.321198,29.0,Chinese Restaurant;Chinese Restaurant,10:00,22:00,Wuchang Station,"114.317603,30.528545",30.528545,114.317603,4.0,Must-Eat Top 10;Outdoor Seating
Songlin Bieyuan Restaurant,Hangzhou,29.473420,119.263381,100.0,Chinese Restaurant;Chinese Restaurant,11:00,21:00,Jianguo Guirui Grand Hotel,"119.263331,29.473498",29.473498,119.263331,2.9,Must-Eat Top 10;Private Room
City Canopy Restaurant (Dianli Lane),Hangzhou,29.473320,119.269756,58.0,Chinese Restaurant;Chinese Restaurant,11:00,21:00,Jianguo Guirui Grand Hotel,"119.263331,29.473498",29.473498,119.263331,4.5,Outdoor Seating;Online Queue
Jinglan Muzhou Chinese Restaurant,Hangzhou,29.474565,119.256898,100.0,Chinese Restaurant;Chinese Restaurant,09:00,22:30,Jianguo Guirui Grand Hotel,"119.263331,29.473498",29.473498,119.263331,3.7,Must-Eat Top 10;Private Room
