poi_name,latitude,longitude,address,poi_type
Wangfujing Pedestrian Street,39.913399,116.412420,,attraction
Summer Palace,39.999617,116.275179,,attraction
National Stadium (Bird's Nest),39.993330,116.395784,,attraction
Jingshan Park,39.925875,116.396551,,attraction
Beihai Park,39.928775,116.391802,,attraction
Wudaoying Hutong,39.947899,116.411707,,attraction
Shichahai,39.941893,116.385121,,attraction
Capital Museum,39.906412,116.342067,,attraction
Tsinghua University,40.003220,116.325899,,attraction
798 Art District,39.984456,116.503789,,attraction
Jingyun Gate Forbidden City Restaurant,39.918509,116.398455,,restaurant
Icehouse Restaurant,39.917514,116.395284,,restaurant
Wanchun Golden Fortune Afternoon Tea,39.921094,116.397019,,restaurant
Kunning Palace East Courtyard Restaurant,39.921089,116.397327,,restaurant
Chengdu Beijing Office Restaurant (Shudu Hotel Branch),39.925170,116.400666,,restaurant
Beach Restaurant,39.925352,116.403318,,restaurant
Tim Ho Wan (Beijing apm Branch),39.914205,116.411651,,restaurant
Zhecha Tea Restaurant (Beijing apm Branch),39.914339,116.411941,,restaurant
Juqi Roast Duck · Beijing Cuisine (Beijing APM Branch),39.914449,116.411633,,restaurant
Fuwan Vietnamese Restaurant (Beijing apm Branch),39.914674,116.412005,,restaurant
Hilton Hotel Qin Tang Chinese Restaurant (Wangfujing Branch),39.914647,116.413364,,restaurant
New Brother Chef · Modern Cantonese Cuisine (Wangfujing APM Branch),39.914862,116.411943,,restaurant
Crab Way (Wangfu Central East Tower Branch),39.912274,116.410801,,restaurant
Tongren Four Seasons Coconut Chicken (Beijing apm Branch),39.915237,116.412169,,restaurant
THE WOODS Restaurant (Wangfujing Macau Center Branch),39.915041,116.413588,,restaurant
Lemeixin Restaurant (Wangfu Central East Tower),39.912471,116.410044,,restaurant
Songtang Fast Food Restaurant,40.001225,116.274375,,restaurant
Light and Shadow Restaurant (Summer Palace Branch),40.003150,116.277638,,restaurant
Third Restaurant of the Central Party School,40.001430,116.285402,,restaurant
Central Party School Graduate School Restaurant,39.999592,116.287885,,restaurant
Dongting Chuxiang (Xiangshan Summer Palace Branch),40.006063,116.264753,,restaurant
Green Tea Restaurant (Beijing Longfor Starry Hui Branch),39.998068,116.289861,,restaurant
Dechang Garden Beijing Cuisine Restaurant (Summer Palace Branch),39.996701,116.291357,,restaurant
Dechang Garden Restaurant (Liangli Garden Branch),39.997009,116.293362,,restaurant
Dayou Shangpin Community Restaurant (Central Party School Community Branch),40.014066,116.277948,,restaurant
Saizeriya Italian Restaurant (Xiaojiuhe Beijing Hualian BHG Mall Branch),40.015633,116.270935,,restaurant
Guofeng · Home Restaurant (Bird's Nest Scenic View Branch),39.992725,116.395475,,restaurant
Bird's Nest Cultural Center Guofengjia Restaurant,39.992875,116.397025,,restaurant
Zhonghong Feast · Bird's Nest Restaurant (Asian Games Village Branch),39.992378,116.395075,,restaurant
Beijing Grand Skylight Hotel Elysee Western Restaurant (Asian Games Village Branch),39.992708,116.400185,,restaurant
AmazingThai Authentic Thai Restaurant (Beitou New World Shopping Center Branch),39.999286,116.395925,,restaurant
Little Sheep (Beitou Xinao Shopping Center Branch),40.000038,116.396371,,restaurant
Caiyan Restaurant,39.999047,116.401002,,restaurant
Beijing North Star InterContinental Hotel · Italian Trattoria,39.998325,116.388176,,restaurant
VIP Mansion Banyan Tree Restaurant,39.992864,116.406078,,restaurant
Huiyuan Restaurant,39.994536,116.406367,,restaurant
Jinfu Hotel Restaurant,39.927334,116.393352,,restaurant
Shanxi Beijing Office Restaurant,39.927321,116.393306,,restaurant
Wangchun Food Pavilion,39.927349,116.400152,,restaurant
Eatalia Carpe Diem Italian Restaurant,39.933060,116.395723,,restaurant
Neighbor's Delight Restaurant,39.934005,116.388577,,restaurant
Longhong Restaurant,39.933970,116.388425,,restaurant
Ancient Bronze Courtyard Copper Pot Hotpot · Halal (Di'anmen Branch),39.934360,116.396446,,restaurant
Courtyard (Di'anmen Branch),39.933384,116.384409,,restaurant
Camellia Sister Yunnan Restaurant (Di'anmen Branch),39.935500,116.396060,,restaurant
Green Tea Restaurant (Beijing Yintai IN88 Branch),39.916285,116.411819,,restaurant
Candu Southeast Asian Restaurant (Wudaoying Branch),39.948454,116.415557,,restaurant
Xinyuan,39.948714,116.415077,,restaurant
Tang Chef (Wudaoying Branch),39.948338,116.414674,,restaurant
Ye Bo Zhai Palace Vegetarian Cuisine,39.948362,116.413730,,restaurant
Pebbles Courtyard Mexican Restaurant,39.948375,116.410797,,restaurant
Hepingli Street Senior Restaurant,39.950750,116.410857,,restaurant
Manxiang Wonton (Andingmen Branch),39.947013,116.408068,,restaurant
Lan Yue Zhai Grilled Meat · Halal (Wudaoying Flagship Store),39.944945,116.408583,,restaurant
Miao's Baozi Shop (Chengxian Street Branch),39.944925,116.408601,,restaurant
Outside the Gate Restaurant,39.943769,116.411497,,restaurant
Yifeng Restaurant (Gulou Branch),39.943748,116.388507,,restaurant
DAddario Italian Restaurant (Houhai Branch),39.939364,116.388671,,restaurant
Mount Everest Restaurant,39.945551,116.386140,,restaurant
Capital Courtyard Hutong Cuisine Rooftop Bistro,39.938065,116.379287,,restaurant
Huluwa Beef Tendon Hotpot (Gulou Branch),39.946717,116.389982,,restaurant
Zhong Restaurant (Gulou West Street Branch),39.940920,116.393099,,restaurant
Dingxiangrun,39.947191,116.380111,,restaurant
Raj Indian Music Restaurant,39.940937,116.393636,,restaurant
Papà Danilo Uncle Danilo · Italian Pasta (Gulou Branch),39.942844,116.393822,,restaurant
Old Yang Restaurant,39.942450,116.376358,,restaurant
Tangyuan Chinese Restaurant (Fuxingmen Branch),39.908020,116.342580,,restaurant
Jing Xiaoyan · Hunan and Cantonese Fusion Cuisine · Chinese Restaurant (Fuxingmen Branch),39.907965,116.343105,,restaurant
Tang Xiuwang Music Bistro (Fuxingmen Branch),39.907965,116.343105,,restaurant
Xijin Hui Western Restaurant,39.908111,116.343154,,restaurant
Three-Colored Lotus Indian Restaurant (Chang'an Mall Branch),39.907957,116.344377,,restaurant
China Workers' Home B4th Floor Weishan Restaurant,39.905786,116.345617,,restaurant
Jiayue Restaurant,39.906653,116.345942,,restaurant
Yamei Restaurant (Zhenwumiao Fourth Alley Branch),39.903774,116.346399,,restaurant
China People's Public Security University Muxidi Campus West District Restaurant,39.902444,116.336961,,restaurant
Beijing Sanli Mingyue Restaurant,39.910039,116.336159,,restaurant
Yuyuan Staff Restaurant,39.998357,116.319091,,restaurant
Tsinghua University Xichunyuan Restaurant,40.002051,116.321323,,restaurant
Tsinghua University Jia Institute Restaurant,40.001088,116.322559,,restaurant
Tsinghua University Heyuan Restaurant,40.002773,116.321093,,restaurant
Tsinghua University Lanyuan Staff Restaurant,39.998575,116.325267,,restaurant
Tsinghua University Nanyuan Restaurant,39.995864,116.327299,,restaurant
Tsinghua University Qingqing Fast Food Restaurant,40.006939,116.328559,,restaurant
Tsinghua University Guanchou Garden (Restaurant),40.006900,116.322438,,restaurant
Tsinghua University Taoliyuan Restaurant,40.010939,116.326059,,restaurant
Huaqing Yongsheng Restaurant (Chuangxin Building Branch),39.995580,116.330193,,restaurant
New Zealand Restaurant Cafe Flatwhite (798 Branch),39.984441,116.498919,,restaurant
Hong Kong & American Restaurant,39.983709,116.498804,,restaurant
Pu Xian Cuisine,39.988739,116.502927,,restaurant
Blu. Lan Italian Restaurant,39.986562,116.498549,,restaurant
Coconut Fragrance Thai · Thai Cuisine (798 Branch),39.986400,116.497871,,restaurant
Xiao Wan Canteen (798 Art District Branch),39.986677,116.497942,,restaurant
He Space,39.986777,116.497291,,restaurant
Mao Mansion Restaurant,39.989188,116.499703,,restaurant
Care Shell · Museum of Love Restaurant,39.987656,116.496193,,restaurant
Wangxiang Banquet · Courtyard Restaurant · 798 Reception Hall (Jiuxianqiao · Wangjing Branch),39.980125,116.496768,,restaurant
HAN JIMMY Cheese Teppanyaki Chicken (Sanlitun Branch),39.936137,116.449340,,restaurant
Post-Ganges Era Indian Folk Cuisine Restaurant,39.936038,116.449604,,restaurant
ENCUENTRO Encounter · Latin American Cultural Travel Restaurant,39.934306,116.446518,,restaurant
Huixuange Restaurant (Hunan Cuisine),40.071405,116.593500,,restaurant
Zhonghua Ma's Restaurant,39.851353,116.309616,,restaurant
Beijing West International Trade Hotel - Yipinxuan Chinese Restaurant,39.855510,116.309066,,restaurant
Kandan Red Restaurant,39.843323,116.300269,,restaurant
China Eastern Airlines Preferred Restaurant (Eastern Airlines Shift Dormitory Branch),39.526675,116.421725,,restaurant
Congee King Hong Kong-Style Tea Restaurant,39.907249,116.662542,,restaurant
Zhengdong Canteen (Xidan Joy City Branch),39.910944,116.372836,,restaurant
Neighbor's Inn - Riverside Restaurant,40.648564,117.273002,,restaurant
Rainforest Restaurant,40.649386,117.272924,,restaurant
William Edgar Boutique Hotel Western Restaurant,40.649863,117.273504,,restaurant
Greedy Cat Skewer Bar · BBQ Tavern (Daxing Airport Branch),39.525582,116.410627,,restaurant
Radisson Hotel · Li Xuan Chinese Restaurant (Daxing Airport Branch),39.525847,116.412720,,restaurant
Hilton Garden Inn - Huahuiwei Restaurant,39.526497,116.412931,,restaurant
Happy Neighborhood Restaurant,39.943592,116.520437,,restaurant
Zhi Yi Wei Tea Restaurant,39.864813,116.380005,,restaurant
Beijing Marriott Hotel Changping - Marriott Chinese Restaurant,40.232883,116.188934,,restaurant
Baifu Lou Restaurant,40.238260,116.190910,,restaurant
Junle Restaurant,40.116141,116.221840,,restaurant
Jing Shu Ju Restaurant,39.883071,116.434363,,restaurant
Congee King Hong Kong-Style Tea Restaurant,39.884756,116.435591,,restaurant
Yuxiangyuan Restaurant (Beiyu Building Branch),39.884955,116.435397,,restaurant
Lavande Hotel Restaurant,39.905440,116.425014,,restaurant
KFC (Beijing Railway Station Square Second Branch),39.903999,116.426524,,restaurant
East Kitchen All-Day Dining Restaurant (Beijing Daxing Hilton Hotel),39.768784,116.339424,,restaurant
Wanlongzhou Seafood (Daxing Greenland Splendid City Branch),39.764618,116.334639,,restaurant
Saizeriya Italian Restaurant (Daxing Gaomidian South Branch),39.764419,116.333979,,restaurant
Restaurant,40.445714,115.959061,,restaurant
Xunwei Restaurant (Huihuang Songshan Resort Hotel Branch),40.463123,115.820469,,restaurant
Seventy Flavors Restaurant,40.469079,115.810675,,restaurant
Warm Family Restaurant,40.456685,115.801219,,restaurant
Yita Italian Restaurant (Songzhuang Branch),39.947272,116.719994,,restaurant
Garden Flavor Art Restaurant,39.947648,116.719949,,restaurant
Xiaohua Piaoxiang Art Restaurant,39.947811,116.719919,,restaurant
Ningxia Mansion Halal Restaurant,39.944378,116.406807,,restaurant
Congee King Hong Kong-Style Tea Restaurant,39.951643,116.365195,,restaurant
Tianlun Songhe Grand Hotel - Buffet Restaurant,39.918132,116.413396,,restaurant
Iris Palace 1893 (Wangfujing Pedestrian Street Branch),39.915862,116.413864,,restaurant
Beijing Zhongyu Century Yuli Hotel (Yuzhenfang Restaurant),39.897782,116.322878,,restaurant
Railway Inn Chain Hotel Beijing West Railway Station Branch - Restaurant,39.896025,116.322725,,restaurant
Beijing Yanqing Marriott Hotel - Marriott Chinese Restaurant,40.475837,115.983945,,restaurant
Big Pizza Buffet (Yanqing Wanda Branch),40.473634,115.984861,,restaurant
Bank of China Hotel Chinese Restaurant,40.471333,115.980564,,restaurant
Yuehu Restaurant,39.892858,116.325366,,restaurant
Xiangjian Tea House (Jianshe Building Branch),39.893729,116.326597,,restaurant
Dongfa Dao Tea Ice Hall (Xidan Joy City Branch),39.910702,116.373112,,restaurant
Wenyecai Shabu-shabu (Xidan Joy City Branch),39.911324,116.373273,,restaurant
Shuangliu Old Mama Rabbit Head (Shuangjing Branch),39.890496,116.461939,,restaurant
Zuo Zuo Grilled Meat (Shuangjing Branch),39.889782,116.463059,,restaurant
Happiness Canteen Korean Cuisine (Shuangjing Branch),39.892878,116.459697,,restaurant
Jin Hanzi Restaurant,40.079558,116.227381,,restaurant
Belun Restaurant,40.078595,116.229780,,restaurant
Academy Restaurant,40.088437,116.226564,,restaurant
James Joyce Coffetel (Beijing New China International Exhibition Ideal Auto R&D Headquarters),40.147076,116.553454,"Building 95, Courtyard 1, Zhangxizhuang Section, Shunsha Road",hotel
Ji Hotel Beijing Tongzhou Songzhuang Anzhen Hospital,39.946800,116.724000,"No. 47, East Xusong Road, Xiaobao Village, Songzhuang Town, Tongzhou District, Beijing",hotel
Beijing Cuihu Garden Hotel,40.112365,116.204964,"No. 8, Cuihu Road, Shangzhuang Town",hotel
Orange Hotel Beijing Shijingshan Bajiao Amusement Park,39.920499,116.205539,"Building 3, Floor 1 (partial) and Floors 3 to 10 (entire), Jindu Building, No. 25, Bajiao East Street",hotel
Fairfield by Marriott Beijing Daxing Airport,39.525579,116.409947,"Building 3, Courtyard 6, Yuanjing West Second Road, Daxing District, Beijing",hotel
Atour X Hotel Beijing Dacheng Road PLA 301 Hospital,39.888685,116.272711,"Building 1, Courtyard 6, Dacheng Road, Fengtai District, Beijing",hotel
Atour Hotel Beijing Zhongguancun Yongfeng Base,40.081823,116.229852,"Building 29, Courtyard 5, Fengrun Middle Road",hotel
Club Med Joyview Beijing Yanqing Resort,40.463240,115.820770,"No. 66, Gulong Road, Zhangshanying Town, Yanqing District, Beijing, China",hotel
Hilton Garden Inn Beijing Tiantan East Gate Station,39.883391,116.433820,"No. 3, Zuo'anmen Inner Street, Dongcheng District, Beijing",hotel
Beijing Joy Hotel,39.910967,116.373479,"No. 131B, Xidan North Street",hotel
Beijing Gubei Water Town Hotel,40.644311,117.269432,"Gubei Water Town Tourist Resort, Simatai District",hotel
Ji Hotel Beijing Nanluoguxiang Andingmen Subway Station,39.945500,116.406000,"No. 11A, Cheliandian Hutong, Andingmen Inner Street, Dongcheng District, Beijing",hotel
Ji Hotel Beijing Sanlitun Taikoo Li,39.934400,116.448000,"Building 1, No. 55, Xingfu Yicun, Chaoyang District, Beijing",hotel
Atour Hotel Beijing Guomao Shuangjing,39.890911,116.461003,"No. 5, East Third Ring South Road, Chaoyang District, Beijing, Chaoyang District, Beijing, China",hotel
Beijing Yanqing Marriott Hotel,40.476067,115.983884,"Courtyard 92, Xincheng Street, Yanqing District",hotel
Beijing Leduogang Marriott Hotel,40.232499,116.188641,"No. 29, Nankou Road, Chengnan Subdistrict",hotel
Hilton Beijing Daxing,39.768750,116.339146,"Building 18, Gaomidian Nanli, Daxing District, Beijing, China",hotel
Hampton by Hilton Beijing CBD Guomao Business District,39.908560,116.521174,"No. 37, Jianguo Road",hotel
Orange Hotel Beijing Wangfujing,39.918800,116.413000,"No. 57, Dengshikou Street, Dongcheng District, Beijing",hotel
Orange Hotel Beijing South Railway Station,39.863783,116.385804,"No. 12, Majiabao Road, Fengtai District, Beijing",hotel
Daxing International Airport,39.510561,116.429172,Da'an Road,airport
Capital International Airport,40.080213,116.602545,Capital Airport Road,airport
Taiping International Airport,45.611938,126.241474,Yingbin Road,airport
Penglai Airport,37.659253,120.989481,"No. 1 Konggang Road, Chaoshuizhen",airport
Wangcun Airport,39.748146,116.331461,"No. 3, Section 2, Xinghua Street, Huangcun Town, Pop Center",airport
Pudong International Airport,31.142267,121.808682,No. 6000 Yingbin Avenue,airport
Beijing Station,39.902830,116.427354,"No. Jia 13, Maojiawan Hutong",train_station
Beijing West Station,39.894912,116.322033,No. 118 Lianhuachi East Road,train_station
Beijing Fengtai Station,39.850889,116.301463,No. 4 Zhengyang Street (170 meters southeast from Exit C2 of Fengtai Station Metro Station),train_station
Harbin West Station,45.707228,126.577304,"No. 501 Harbin Street, Haxi Subdistrict",train_station
Changchun Station,43.911531,125.324675,No. 5 Changbai Road,train_station
Beijing Chaoyang Station,39.944819,116.508410,360 meters walking from the entrance/exit of Chaoyang Station Metro Station,train_station
Shenyang North Station,41.812779,123.430504,"No. 29 Beijing Street, China Merchants Bank (Shenyang North Station Branch)",train_station
Changchun West Station,43.876661,125.200895,Zhanqian Street,train_station
Harbin Station,45.761621,126.632690,No. 1 Tielu Street,train_station
Beidaihe Station,39.931340,119.349904,Jingha Expressway Beidaihe Service Area (Harbin Direction),train_station
Tieling West Station,45.707228,126.577304,"No. 501 Harbin Street, Haxi Subdistrict",train_station
Kexin Restaurant (Jinyu Office Building Branch),39.908966,116.516621,,restaurant
Tongshenghe Community Restaurant Elderly Canteen,39.906040,116.516907,,restaurant
Huadebao · Sky Garden Scenic Restaurant,39.907291,116.515221,,restaurant
Marriott Executive Apartments Beijing - Zitan Pavilion Restaurant,39.912174,116.525818,,restaurant
Ganluyuan Convenience Restaurant (Ganluyuan Nanli District 2 Branch),39.912617,116.516524,,restaurant
Mijiang Restaurant · New Chinese Fusion Cuisine (Comrades' Post | Conference Hosting),40.146818,116.556304,,restaurant
Kuaijiemei Chinese Cuisine Restaurant,40.153257,116.555294,,restaurant
Tiger Restaurant,40.135652,116.545556,,restaurant
Yuepin Pavilion Restaurant,40.149095,116.572778,,restaurant
Happiness No. 63 Courtyard Restaurant,40.144672,116.520296,,restaurant
Hampton by Hilton Beijing Shijingshan Amusement Park · Hampton Restaurant,39.920305,116.205832,,restaurant
Ximi Family Restaurant (Beijing Sam's Club),39.922476,116.203831,,restaurant
Chao Wei (Beijing Shijingshan District),39.917726,116.205327,,restaurant
"Old Place Restaurant (No. 11 Courtyard, Bajiao North Road Branch)",39.916955,116.204615,,restaurant
Fan Fou Restaurant,39.914365,116.209479,,restaurant
Beijing Daxing International Airport,39.510561,116.429172,Da'an Road,airport
Beijing Capital International Airport,40.080213,116.602545,Capital Airport Road,airport
Harbin Taiping International Airport,45.611938,126.241474,Yingbin Road,airport
Air Travel Home Restaurant,45.628764,126.248463,,restaurant
Pinghe Restaurant Home-style Dishes,39.904489,116.423507,,restaurant
Meijia Restaurant Convenience Chain,39.904531,116.423183,,restaurant
Little Train Fast Food Restaurant (Chaoyang Station Branch),39.944750,116.511127,,restaurant
1996 Sichuan Cuisine · Chef's Restaurant,39.951882,116.511319,,restaurant
106 Restaurant (Beijing Oceanwide International Commercial Street Branch),39.939411,116.501213,,restaurant
Xun Ji · Qingnian Road Courtyard · Halal,39.938576,116.516563,,restaurant
Haxi Restaurant,45.708071,126.576427,,restaurant
West Coast Restaurant (Huizhi Center Branch),45.709955,126.571347,,restaurant
Smart Choice Canteen Restaurant (Huizhi Center Branch),45.711548,126.572361,,restaurant
Nanjing Steamed Dumplings People's Restaurant (Donghui Mingzhu Garden Branch),45.702764,126.584887,,restaurant
Dianji Bento (China Resources Building Branch),45.699885,126.579721,,restaurant
Beibei Grand Hotel Restaurant & Banquet Hall,45.759977,126.634757,,restaurant
Kunlun Hotel (Jiaolan Garden Restaurant),45.758991,126.631942,,restaurant
Taste Fragrance Restaurant,45.759861,126.635958,,restaurant
Hanrui Hotel Western Restaurant,45.762412,126.628688,,restaurant
Stubborn Grandfather Sichuan-Style Boiled Fish and Pork Ribs Rice Restaurant,45.761693,126.638571,,restaurant
Old Beijing Flavor Restaurant (Beijing West Railway Station Branch),39.893083,116.321938,,restaurant
Shanglinyuan No. 89 Tea Restaurant,39.887645,116.273277,,restaurant
Qin Tang Dining Hall (Millennium Street Branch),39.889846,116.281864,,restaurant
Nanchengxiang (Meishikou Branch),39.880632,116.271846,,restaurant
Station Restaurant,39.892536,116.262592,,restaurant
Xiang Xiu Fang Restaurant (Dacheng Nanli Branch),39.889144,116.261171,,restaurant
Xiluoyuan Elderly Restaurant (Xiluoyuan Fourth Community Branch),39.863266,116.389969,,restaurant
Shanxi Mansion Jinlian Hotel Restaurant,39.857868,116.382764,,restaurant
Nanfeng Rui Taxi Restaurant (Yangqiao Xili Community Branch),39.859706,116.379230,,restaurant
LILYSWORLD (China Overseas Plaza West Tower Branch),39.870550,116.389176,,restaurant
Beijing Dashilan,39.895715,116.395042,,attraction
De Yue Lou,39.895540,116.394553,,restaurant
Jing B · Dongli Craft Beer Music Restaurant,39.896192,116.394755,,restaurant
Hidden Alley Night · Music Skewer Bar · LiveHouse,39.896375,116.395958,,restaurant
Suzuki Canteen (Yangmeizhu Branch),39.895977,116.393610,,restaurant
Taste Restaurant,39.896782,116.394354,,restaurant
Liu Ye Menkuang Century-Old Braised Delicacies (Dashilan West Street Commercial Branch),39.896964,116.395585,,restaurant
TIDU · TIDU (Beijing Fun Branch),39.897546,116.394922,,restaurant
Capital Nine Gates Roast Duck Restaurant (Qianmen Branch),39.895127,116.397562,,restaurant
Noah Restaurant,39.895318,116.397724,,restaurant
Liang · Restaurant PEKING LIANG (Qianmen Branch),39.897387,116.397002,,restaurant
Nanluoguxiang,39.937182,116.402394,,attraction
Shuhe Family (Nanluoguxiang Branch),39.936427,116.404800,,restaurant
Jingxiu Restaurant (Nanluoguxiang Branch),39.935583,116.404720,,restaurant
North Gate Hotpot · Copper Pot Hotpot (Shichahai Branch),39.936452,116.398466,,restaurant
Juer Renjia (Nanluoguxiang Branch),39.940056,116.404067,,restaurant
Fangzhuanchang No. 69 Zhajiangmian (Nanluoguxiang Branch),39.940598,116.403188,,restaurant
Halal Xinjiang Flavor Restaurant (Gulou East Street Branch),39.940633,116.402915,,restaurant
Little Yunnan Restaurant (Nanluoguxiang Branch),39.933624,116.401932,,restaurant
Xinjiang Flavored Halal Restaurant,39.940763,116.402868,,restaurant
Tea Soup Li Beijing Cuisine Restaurant (Gulou Branch),39.940706,116.403993,,restaurant
Camellia Girl Yunnan Restaurant,39.940723,116.399484,,restaurant
Tiananmen Square,39.903182,116.397755,,attraction
Jinmanshan Qianmen Hotpot (Qianmen Flagship Store),39.899557,116.400132,,restaurant
Huguosi Snacks (Roushi Street Branch),39.898374,116.398690,,restaurant
Jindou Restaurant,39.899020,116.393858,,restaurant
Beiping Garden (Tiananmen Branch),39.898039,116.395566,,restaurant
Juqi (Qianmen Branch),39.897718,116.397016,,restaurant
Liang · Restaurant PEKING LIANG (Qianmen Branch),39.897387,116.397002,,restaurant
Wanchun Jinfu Afternoon Tea (Qianmen Branch),39.897225,116.397475,,restaurant
TIDU · TIDU (Beijing Fun Branch),39.897546,116.394922,,restaurant
"Icehouse Restaurant at Qianmen, Forbidden City",39.896963,116.398256,,restaurant
National Centre for the Performing Arts Western Restaurant,39.904765,116.389734,,restaurant
Deyunshe Guangde Building,39.895856,116.395000,,attraction
Hidden Alley Night · Music Skewer Bar · LiveHouse,39.896375,116.395958,,restaurant
Liu Ye Menkuang Century-Old Braised Delicacies (Dashilan West Street Commercial Branch),39.896964,116.395585,,restaurant
Capital Nine Gates Roast Duck Restaurant (Qianmen Branch),39.895127,116.397562,,restaurant
Noah Restaurant,39.895318,116.397724,,restaurant
Monument to the People's Heroes,39.904632,116.397691,,attraction
Jinmanshan Qianmen Hotpot (Qianmen Flagship Store),39.899557,116.400132,,restaurant
National Centre for the Performing Arts Western Restaurant,39.904765,116.389734,,restaurant
Huguosi Snacks (Roushi Street Branch),39.898374,116.398690,,restaurant
Jindou Restaurant,39.899020,116.393858,,restaurant
Beiping Garden (Tiananmen Branch),39.898039,116.395566,,restaurant
Juqi (Qianmen Branch),39.897718,116.397016,,restaurant
Wanchun Jinfu Afternoon Tea (Qianmen Branch),39.897225,116.397475,,restaurant
"Icehouse Restaurant at Qianmen, Forbidden City",39.896963,116.398256,,restaurant
Ming Tombs - Changling Tomb,40.300235,116.248804,,attraction
Longxianfu Specialty Restaurant,40.289367,116.236644,,restaurant
Yangmeizhu Xiejie Street,39.895280,116.390844,,attraction
Jingyi Restaurant (Liulichang Cultural Street Branch),39.895208,116.389337,,restaurant
Jingfu Restaurant (Dashilan West Street Commercial Branch),39.893896,116.390485,,restaurant
ZENG Restaurant Theater Branch (Qianmen Branch),39.897474,116.390897,,restaurant
Suzuki Canteen (Yangmeizhu Branch),39.895977,116.393610,,restaurant
Golden Spoon (Qianmen Branch),39.893417,116.388955,,restaurant
Hemu THE HOME · Hutong,39.893584,116.388388,,restaurant
De Yue Lou,39.895540,116.394553,,restaurant
Taste Restaurant,39.896782,116.394354,,restaurant
Jing B · Dongli Craft Beer Music Restaurant,39.896192,116.394755,,restaurant
Yi De Le Halal Restaurant,39.893453,116.394739,,restaurant
Sanlitun Taikoo Li,39.934862,116.454406,,attraction
BROWNSTONE Spanish Restaurant (Sanlitun Taikoo Li South District Branch),39.934810,116.454541,,restaurant
Bacardi Club CASA BACARDI (Sanlitun Taikoo Li South District Branch),39.934825,116.454725,,restaurant
COMMUNE·X Illusionist (Sanlitun Taikoo Li South Area Branch),39.934918,116.454906,,restaurant
gaga (Sanlitun Taikoo Li South District Branch),39.935060,116.453830,,restaurant
Tairyo Teppanyaki · Grand Banquet,39.935220,116.455056,,restaurant
bluefrog Blue Frog (Sanlitun Taikoo Li South District Branch),39.935677,116.454238,,restaurant
Zhudi Canteen (Sanlitun First Branch),39.932974,116.453603,,restaurant
Xiaoxiang Pavilion (Sanlitun SOHO Branch),39.933111,116.452867,,restaurant
Alkhaleej Mandi Kitchen Gulf Mandi Restaurant,39.932837,116.453202,,restaurant
Yueshe Restaurant (T+MALL Branch),39.932637,116.454007,,restaurant
