poi_name,latitude,longitude,address,poi_type
Nanjing 1912 Block,32.044777,118.795778,,attraction
Music Stage of Sun Yat-sen Mausoleum Scenic Area in Zhongshan Scenic Area,32.055096,118.855382,,attraction
Nanjing Eye Pedestrian Bridge,31.995131,118.703146,,attraction
Linggu Temple,32.055418,118.867942,,attraction
China Nanjing Yunjin Museum,32.036390,118.744814,,attraction
Six Dynasties Museum,32.042840,118.799124,,attraction
Qinhuai River,32.020660,118.788899,,attraction
Nanjing Yangtze River Bridge,32.116040,118.738514,,attraction
Yuhuatai Martyrs' Cemetery,31.998425,118.780177,,attraction
Ke Lane,32.039213,118.796070,,attraction
Meilu Restaurant (Sifangcheng Branch),32.049053,118.850510,,restaurant
Nanjing Dongjiao State Guesthouse Daoxiangcun A La Carte Restaurant,32.058352,118.847527,,restaurant
Jingli Seafood Buffet Restaurant,32.058378,118.847167,,restaurant
Maisui Café (Restaurant),32.053088,118.840329,,restaurant
Yisheng Garden Restaurant,32.041985,118.849227,,restaurant
Kuandu Hotel (Kuandu · Emerald Garden Restaurant),32.043804,118.840376,,restaurant
Old Camera · Garden Restaurant,32.042471,118.841831,,restaurant
Frontline Courtyard Fanghua Cultural Theme Restaurant,32.042886,118.840991,,restaurant
Giraffe Tea Restaurant (Junlin Zijin Commercial Street Branch),32.037885,118.850974,,restaurant
Golden Almond Restaurant,32.037985,118.850289,,restaurant
Bailiu Garden Restaurant,32.041811,118.878425,,restaurant
Nanjing Dapaidang (1912 Presidential Palace Branch),32.045050,118.795997,,restaurant
Fine Recipe · Creative Western Cuisine (Presidential Palace 1912 Branch),32.044738,118.795705,,restaurant
Kao Yin Fresh Grill Social Tavern (Daxinggong 1912 Branch),32.044619,118.795650,,restaurant
Zhuque Bridge · Nanjing Duck Culture Themed Restaurant,32.045993,118.796627,,restaurant
Nanjing The Grand Mansion Luxury Collection Hotel Xuanling Pavilion Chinese Restaurant,32.042870,118.798986,,restaurant
Plum Blossom Ode · Jinling Bistro (Presidential Palace 1912 Branch),32.045954,118.796309,,restaurant
The Grand Mansion Luxury Collection Hotel · Old Nanjing Orange Twilight Restaurant,32.042545,118.798838,,restaurant
Ge Wai Xiang Restaurant (Taiping Bridge South Community South Area Branch),32.045396,118.799443,,restaurant
Xinjiang Cuisine Barbecue Restaurant (Taiping North Road Branch),32.045158,118.795034,,restaurant
La Nina Spanish Restaurant (Beiting Lane Branch),32.045045,118.794465,,restaurant
Sam's Mexican Restaurant (Nanjing D9 District Branch),32.045751,118.794110,,restaurant
No Worries Australian Bar & Restaurant (Shipopo'an Branch),32.045509,118.792470,,restaurant
Hanfu Hotel Chinese Restaurant,32.044040,118.792340,,restaurant
Wanquinglou Gourmet Pavilion,32.020352,118.789761,,restaurant
Zhengxing Restaurant,32.020275,118.790175,,restaurant
Lao Song Ji Marinated Seafood,32.021861,118.789212,,restaurant
Tianyuanlou True Jiangnan Fashion Restaurant (Confucius Temple Branch),32.019013,118.790272,,restaurant
Eleven Scenic Rooftop Bar (Confucius Temple Pedestrian Street Branch),32.021395,118.791283,,restaurant
Tianfenglou Restaurant,32.020696,118.786196,,restaurant
Yongheyuan Restaurant,32.022689,118.787481,,restaurant
Night Stay Qinhuai Junting Hotel Restaurant (Grand Theater Branch),32.021996,118.791824,,restaurant
Yongshengli Tea Restaurant (Fuzimiao Branch),32.023204,118.787265,,restaurant
Bella Kitchen Unlimited Steak Restaurant (Maoye Tiandi Branch),32.022530,118.786194,,restaurant
Abaji Xinjiang Barbecue Restaurant,32.032508,118.743635,,restaurant
Saizeriya Italian Restaurant (Nanjing Jianye Wanda Plaza Branch),32.033003,118.737038,,restaurant
Zhaoyang Hui Restaurant (Xicheng Plaza Branch),32.037808,118.747551,,restaurant
Langsheng Hilton Hotel · Cantonese and Yangzhou Cuisine Restaurant,32.031013,118.738209,,restaurant
Keming Ice Room (Jianye Wanda Branch),32.032169,118.736831,,restaurant
Ge Wei Xuan (Jianye Wuyue Branch),32.037366,118.735959,,restaurant
Haoji · Jinling Banquet (Jianye Wuyue Branch),32.037663,118.735970,,restaurant
Waanjai Restaurant (Nanjing Jianye Wuyue Plaza Branch),32.037628,118.735845,,restaurant
Hao Ke Lai (Nanjing Jianye Wuyue Plaza Restaurant),32.037600,118.735407,,restaurant
Yunshe Restaurant,32.009595,118.785806,,restaurant
Aftertaste · Chinese Restaurant,31.990868,118.708386,,restaurant
Pushan · Zen Cuisine Restaurant (Renheng Jiangwan New World Branch),31.992314,118.709804,,restaurant
International Youth Conference Hotel · Leiker German Beer Restaurant,31.991023,118.708803,,restaurant
Xiang · All-Day Dining Restaurant,31.990583,118.708585,,restaurant
International Youth Conference Hotel - Buffet Restaurant (Nanjing International Youth Conference Hotel),31.990660,118.708676,,restaurant
Nanjing Jumeirah Hotel · Luchao Contemporary Chinese Restaurant,31.991186,118.709348,,restaurant
Bama Ouyue Seafood House (Renhengli New World),31.992152,118.710080,,restaurant
RONG57 · Trendy Cantonese Cuisine (International Youth Conference Center),31.990397,118.708624,,restaurant
Furun Jiangwan Chinese Restaurant,31.998951,118.711814,,restaurant
ANTEP Turkish Restaurant (Jiangshan Center Branch),31.988663,118.710784,,restaurant
Xiao Panji Duck Blood Vermicelli Soup,32.040697,118.793211,,restaurant
Peng Xiaoxian Restaurant,32.038522,118.793875,,restaurant
Qiangye Restaurant (Changbai Street Branch),32.039040,118.798726,,restaurant
LA · Lan'an Riverside Restaurant,32.109562,118.748666,,restaurant
Sili Garden Restaurant,32.122554,118.727990,,restaurant
Green Tea Restaurant (Nanjing Jinxiangcheng Branch),32.126821,118.735120,,restaurant
German Garden Restaurant (Jinxiangcheng Branch),32.127651,118.736482,,restaurant
Grand Bridge Music Charcoal Grill Courtyard,32.127505,118.729171,,restaurant
Millennium Wanfu Pinzhiyan Grand Hotel,32.128655,118.746692,,restaurant
West Guest Music Restaurant,32.118627,118.720851,,restaurant
Junfu Lou Restaurant (Dahua Jinxiu Huacheng Aimeisong Branch),32.116935,118.719516,,restaurant
Nengren Slow Time Community Self-Service Restaurant,31.998338,118.773660,,restaurant
Xiao Wu Restaurant (Yuhua West Road),32.004719,118.778684,,restaurant
Smart Restaurant,32.004300,118.773048,,restaurant
Baoji Restaurant,32.005229,118.772592,,restaurant
Fengyang Restaurant,32.007525,118.774560,,restaurant
Xilankapu Restaurant,31.997514,118.792254,,restaurant
Nanjing Suchengxiang Restaurant,32.007026,118.787968,,restaurant
Impression Tuesday Nanjing Cuisine (1865 Creative Park Branch),32.006777,118.788451,,restaurant
Hua Jintang · Hidden Residence Chinese Restaurant,32.006899,118.789687,,restaurant
New Bailu (Nanjing Central Mall Branch),32.038933,118.785924,,restaurant
DAJE Restaurant,32.038484,118.793831,,restaurant
LAZEEZRESTAURANT Middle Eastern Cuisine Turkish Restaurant,32.038425,118.793375,,restaurant
Sichuan Restaurant (Taiping South Road Branch),32.036798,118.793557,,restaurant
Weibo Bistro (Xinjiekou Branch),32.035762,118.797508,,restaurant
Shi Popo Hotpot Restaurant (Yanling Lane Branch),32.038015,118.791627,,restaurant
Fish Flavors Restaurant (Zhongshan East Road Community Branch),32.038103,118.800913,,restaurant
Tangwu · Old Nanjing Cuisine Restaurant (Laomendong Branch),32.014340,118.786519,,restaurant
Mei Yi Ke Restaurant (Greenland Window South Plaza Branch),31.964275,118.798658,,restaurant
Xiyuexuan Chinese Restaurant (Nanjing South Station Branch),31.970608,118.792793,,restaurant
Tianxi Restaurant,31.970035,118.792453,,restaurant
Zhejiang-West Cuisine Self-Service Restaurant,31.982475,118.759775,,restaurant
Family Fortune Chinese Restaurant (Evergrande Huafu Branch),31.981074,118.747863,,restaurant
Jindi Weixin Restaurant,31.982044,118.763921,,restaurant
Chenxin Restaurant,31.832674,118.838708,,restaurant
Xian Le Wan Restaurant (Xinwang Huayuan East District Branch),31.838331,118.845945,,restaurant
Chunyang Restaurant (Temporarily Closed),31.838785,118.836462,,restaurant
Nanjing Jingfeng Marriott Hotel Chinese Restaurant,31.936447,118.822113,,restaurant
Nanjing Jingfeng Marriott Hotel Zhenchu Western Restaurant,31.936464,118.822102,,restaurant
Lihu Asia Premium Convention Center Hotel - Buffet Restaurant,31.937886,118.820249,,restaurant
Chengxin Restaurant,32.031873,118.782537,,restaurant
De Fa Cai Tea Restaurant Xinjiekou Branch,32.030469,118.783352,,restaurant
Hao Ke Lai Steak (Nanjing Qinhuai Shuguang Tiandi Restaurant),32.016973,118.788631,,restaurant
Sanxi Snack Shop,32.015303,118.787262,,restaurant
Kuaitianxia Premium Self-Service Restaurant,31.963579,118.799286,,restaurant
Delicious Forest Self-Service Restaurant,31.962499,118.799669,,restaurant
Yuwei Lou (Dongqi Road Branch),31.973559,118.874496,,restaurant
Hesheng Select Buffet Restaurant,31.971475,118.872275,,restaurant
Li Ji Halal Restaurant (Dading Lane Branch),32.029171,118.779822,,restaurant
Haoke Steak (Nanjing Getang Meili Plaza Restaurant),32.242223,118.750050,,restaurant
69+ Music Restaurant,32.246975,118.758325,,restaurant
KFC Drive-Thru Restaurant (Dachang Sports Center Branch),32.246594,118.758990,,restaurant
Hanqing New Concept Restaurant (Fengya Garden Branch),31.868621,118.710706,,restaurant
Platinum Hanjue Grand Hotel · Chinese Restaurant,32.103046,118.891205,,restaurant
Qinghe Qiujia Self-Service Restaurant,32.098674,118.886171,,restaurant
Dian Guang Ji (Xuzhuang Branch),32.091200,118.882883,,restaurant
Xunwei Restaurant (Taiping South Road Branch),32.037157,118.793687,,restaurant
Bay Corner Restaurant,31.995858,118.804423,,restaurant
Wanqianyun Stylish Smart Choice Restaurant (Daming Branch),31.994790,118.805429,,restaurant
Hong Kong Cafe (Zhongyang Road Boutique Branch),32.080387,118.784305,,restaurant
Wine Point Shifen,32.082386,118.784324,,restaurant
Afanti Barbecue Restaurant,32.083277,118.784426,,restaurant
Yunfeng Restaurant,32.034740,118.642470,,restaurant
Xiao Mai Jia Buffet Restaurant,32.036583,118.645029,,restaurant
Migu Coffee Restaurant (Yanchuangyuan Branch),32.036612,118.646979,,restaurant
Lavande Hotel (Nanjing Kazimen Metro Station Laomendong Branch),31.998648,118.797124,"5th Floor, Building B, MixC Commercial Plaza, No. 111 Yongle Road, near Yongle Road, Metro Line 3 Carmen Station",hotel
Orange Hotel Nanjing Jiangning Sandship Future Network Town,31.842300,118.826000,"No. 117 Suyuan Avenue, Jiangning District, Nanjing, Jiangsu Province",hotel
Campanile Hotel (Nanjing South Railway Station Branch),31.963761,118.796812,"Room 116, Building D-1, No. 7 Zhucui Road, MixC City, Jiangning District, Nanjing, Jiangsu Province",hotel
Nanjing Guli Grand Hotel,31.880630,118.709714,"No. 1 Niushou Avenue, Guli Street",hotel
Nanjing Jiangning Moxy Hotel,31.933570,118.846694,"No. 15 East Tianyuan Road (near Metro Line 1 Zhushan Road Exit 2, Metro Line 5 Zhushan Road Exit 5)",hotel
Nanjing Buckingham Grand Hotel (Xuanwu Avenue Branch),32.103049,118.891212,"No. 888 Xuanwu Avenue, Qixia District",hotel
Nanjing Jicui Jinling Jialong Hotel,32.030503,118.644410,"Building 8, Jiangsu Industrial Technology Research Institute Park, No. 7 Huafu Road, Dingshan Street",hotel
Ji Hotel Nanjing Minggugong,32.037193,118.816677,No. 12 Yudao Street,hotel
Ji Hotel Nanjing Jiangning Dongqi Road,31.978664,118.880017,"No. 1 Runqi South Road, Jiangning District, Nanjing, Jiangsu Province",hotel
Atour Hotel Nanjing Xuanwu Lake Xuanwumen,32.081227,118.785351,No. 266 Zhongyang Road (Metro Line 1 Xinmofan Malu Station Exit 2),hotel
Nanjing Jingfeng Marriott Hotel,31.936237,118.821917,No. 1519 Shuanglong Avenue,hotel
Home Inn·Neo - Nanjing Xinjiekou Daxinggong Metro Station Wenchang Lane Branch,32.037122,118.793920,"No. 147-1 Taiping South Road, Qinhuai District, Nanjing",hotel
Home Inn·Neo - Nanjing Xinjiekou Central Branch,32.037604,118.785660,"No. 36 Huaihai Road, Qinhuai District",hotel
Home Inn - Nanjing Andemen Metro Station Yuhuatai Scenic Area Branch,31.989178,118.754999,"Building 1, No. 52 Xiaxing Road, Andemen, Yuhuatai District, Nanjing",hotel
Home Inn·Neo - Nanjing Wutang Plaza Metro Station Branch,32.111498,118.779311,"No. 9 East Mufu Road, Gulou District, Nanjing",hotel
Jinjiang Inn (Nanjing Railway Station Xuanwu Lake Zhongfu Road Metro Station Hotel),32.091374,118.775473,No. 16 Jianning Road,hotel
Hanting Hotel Nanjing Xinjiekou Zhangfuyuan Metro Station,32.030400,118.782000,"No. 76 Jianye Road, Qinhuai District (150 meters right of Zhangfuyuan Metro Station Exit 3, Metro Line 1 Zhangfuyuan Station)",hotel
Hanting Hotel Nanjing Getang Metro Station,32.243900,118.754000,"No. 400 Ningliu Road, Jiangbei New Area",hotel
Hanting Hotel Nanjing Confucius Temple Pedestrian Street,32.018343,118.788350,"No. 146 Dashiba Street, Qinhuai District",hotel
Orange Hotel Nanjing Confucius Temple Laomendong,32.017272,118.786548,"No. 74-76 Changle Road, Fuzimiao, Qinhuai District (20 meters left of Tanhualou at Fuzimiao)",hotel
Wuxu Airport,22.601718,108.187631,"No. 1, Airport Avenue, Wuxu Town",airport
Lukou International Airport,31.731634,118.871181,South Airport Road,airport
Huanghua Airport,28.179749,113.235474,"No. 308, Airport Avenue, Huanghua Town",airport
Meilan International Airport,19.942495,110.467385,Intersection of Qiongwen Avenue and Provincial Highway 201,airport
Nanning Railway Station,22.826972,108.314849,"No. 82, Zhonghua Road",train_station
Changsha South Railway Station,31.968763,118.798034,"No. 98, Yulan Road, Yuhua Subdistrict",train_station
Nanjing South Railway Station,31.968763,118.798034,"No. 98, Yulan Road, Yuhua Subdistrict",train_station
Wuhan Railway Station,30.606981,114.424338,"Baiyun Road, Heping Subdistrict",train_station
Nanning East Railway Station,22.841826,108.413527,"No. 66, Changhong Road (230 meters walking from Exit B of East Railway Station Metro Station)",train_station
Yuyuan Hotel - Chinese Restaurant,32.034991,118.816403,,restaurant
Three Red Points Red Restaurant (Minggugong Road No. 21 Community Branch),32.043222,118.816105,,restaurant
Spicy House Fashion Boutique Restaurant,32.031203,118.813635,,restaurant
Yichun Restaurant (Nanjing Museum Branch),32.039269,118.825427,,restaurant
Xinjiang Aizizi Cuisine & Barbecue Restaurant (Yintong Apartment Branch),32.030227,118.810152,,restaurant
Yanzhenlou · Hampton by Hilton Chinese Restaurant (Nanjing Meiji Electronics Technology R&D Building Branch),31.933807,118.848798,,restaurant
Hampton by Hilton - Hampton Restaurant,31.933789,118.848862,,restaurant
Tao Da Noodle House (Qinhuai Courtyard Branch),31.936333,118.846642,,restaurant
Saizeriya Italian Restaurant (Longfor Nanjing Longwan Paradise Walk Branch),31.938382,118.844411,,restaurant
Jiangning Longhu Restaurant,31.938519,118.844766,,restaurant
Hanchiao Chinese Restaurant (Central North Road Branch),32.112616,118.775516,,restaurant
Kejia Restaurant,32.105654,118.780346,,restaurant
Xiaoman Music Restaurant,32.106223,118.772589,,restaurant
Yi Ethnic Night Nest Music Restaurant & Bar,32.106024,118.772382,,restaurant
Hobbit Self-Service Restaurant (Huashengtang Branch),32.097053,118.778817,,restaurant
Blue Bay Western Restaurant,32.089454,118.779471,,restaurant
Tong Zhanggui Family Restaurant,32.087971,118.772097,,restaurant
Fate Sky Tea Restaurant (Central Jindi Branch),32.092281,118.769398,,restaurant
Shuai Shuai Restaurant (Zhongfu Road Community Branch),32.087946,118.768697,,restaurant
Nanning Wuxu Airport,22.601718,108.187631,"No. 1, Airport Avenue, Wuxu Town",airport
Nanjing Lukou International Airport,31.731634,118.871181,South Airport Road,airport
Galaxy Hotel · Flavor Pavilion Dim Sum Restaurant (Chaoyang Road Branch),22.824902,108.316670,,restaurant
Yongpinxuan Restaurant,22.823068,108.315694,,restaurant
Wanchuan Restaurant,22.823026,108.315592,,restaurant
Phoenix Hotel Buffet Restaurant,22.822561,108.316658,,restaurant
One Dish Small Plates Theme Restaurant,22.825418,108.320948,,restaurant
East Iron Restaurant,22.840626,108.409876,,restaurant
Nanning Railway Grand Hotel Buffet Restaurant,22.836109,108.408937,,restaurant
Flying Restaurant,22.833173,108.416626,,restaurant
Xinluoge Restaurant,22.832503,108.410794,,restaurant
Xilu Restaurant (Lin Feng Yi Hao Branch),22.831775,108.402232,,restaurant
Airport Restaurant,22.601134,108.185224,,restaurant
Qinhuai River Painted Boat Cruise,32.020660,118.788899,,attraction
Linggu Scenic Area,32.056287,118.866392,,attraction
Yihe Road Mansion Area Zone 12,32.063981,118.770087,,attraction
Yihe Mansion · Le Siecle Centennial Western Restaurant (Jiangsu Road Branch),32.064186,118.770017,,restaurant
Wanjiahuan Sunny Days,32.065472,118.768555,,restaurant
Suoyu Lobster & Seafood House (Jiangsu Road Branch),32.066915,118.768259,,restaurant
Muxue Xinjiang Banquet Xinjiang Restaurant,32.066740,118.772695,,restaurant
Pin Yue Xuan · Farm-Themed Restaurant (Xiqiao Branch),32.061813,118.773670,,restaurant
Sofitel Galaxy Palace Chinese Restaurant,32.067405,118.772463,,restaurant
Jiangsu Yishiyuan Hotel · A La Carte Restaurant,32.064920,118.776260,,restaurant
Pinyi Tea Restaurant (Shuizuo Gang Branch),32.069369,118.767073,,restaurant
Hong Kong Boy Tea Restaurant,32.070778,118.770778,,restaurant
Top Fresh Seafood Garden Restaurant,32.068108,118.776615,,restaurant
Nanjing Deji Plaza,32.044077,118.784902,,attraction
Glad to Meet You (Deji Plaza Branch),32.044322,118.784931,,restaurant
ROIIN Heartfelt (Deji Plaza Branch),32.044322,118.785086,,restaurant
Banquet Encounter (Deji Plaza Branch),32.044163,118.784555,,restaurant
Dehexishi (Deji Plaza Branch),32.044494,118.784995,,restaurant
That Time Xinjiang (Deji Plaza Branch),32.044783,118.784572,,restaurant
Cuiyuan Restaurant (Deji Plaza Phase II Branch),32.044853,118.785127,,restaurant
Guanqiao Guoshida Hotel Restaurant,32.044801,118.783555,,restaurant
Central Grand Hotel · Gedun Bay Buffet Restaurant,32.045307,118.783591,,restaurant
JIA Restaurant (Jinling Hotel),32.043520,118.782963,,restaurant
Minghai Restaurant,32.044825,118.787025,,restaurant
Nanjing Confucius Temple,32.020660,118.788899,,attraction
Laomendong,32.011682,118.787631,,attraction
Wenliu Cuisine Restaurant (Laomendong Branch),32.011515,118.787387,,restaurant
Jiang Youji (Laomendong Branch),32.011774,118.786821,,restaurant
Xun Wei · Jinling Twelve Dishes (Lao Mendong Branch),32.012241,118.787144,,restaurant
Jiming Soup Dumplings (Nanjing Main Branch) Nanjing Cuisine,32.011940,118.786703,,restaurant
New Belle Italian Restaurant · Wood-Fired Pizza (Lao Mendong Branch),32.011064,118.786955,,restaurant
Six Dynasties Pine Teahouse,32.010760,118.788191,,restaurant
Nancheng Yanguilou (Lao Mendong Branch),32.012681,118.788744,,restaurant
Reunion Smoky Firewood Wonton Charity Snack Shop,32.011082,118.789613,,restaurant
Free Chef · Home Cooking (Laomendong Branch),32.014135,118.787506,,restaurant
Nanjing Jinghai Temple Memorial Hall,32.092359,118.744723,,attraction
Hobbit Chinese Self-Service Restaurant (Daguan Tiandi Branch),32.092845,118.743475,,restaurant
Guoshi. Simple Meals. Chess. Tea Restaurant,32.087244,118.748231,,restaurant
Haihonghui Restaurant (Zhongshan North Road Branch),32.085854,118.748233,,restaurant
Gulou District Bafanghui Tea Restaurant,32.097284,118.738466,,restaurant
Xinjiang Hetian Waili Barbecue Restaurant,32.083442,118.742272,,restaurant
Red Sun Restaurant,32.085026,118.752184,,restaurant
Xi Space,32.089317,118.733542,,restaurant
Xinglong Restaurant (Jiangbian Road Branch),32.087203,118.734081,,restaurant
Xinjiang Asimu Barbecue Restaurant (Shimao Bund New City Phase II Branch),32.083999,118.735139,,restaurant
Purple Mountain Observatory of the Chinese Academy of Sciences,32.064698,118.830719,,attraction
Lazy Life Art Restaurant,32.068502,118.820836,,restaurant
Yuejian Garden Restaurant,32.053654,118.826412,,restaurant
Nanjing Blossom Hill Hotel Pipa Mountain Residence · Blossom Restaurant,32.053020,118.826593,,restaurant
Kuandu · Lake Biwa Restaurant,32.052922,118.826357,,restaurant
Fenghefang Garden Restaurant,32.058898,118.817225,,restaurant
Pipa Islet Lakeside Green Organic Restaurant,32.054359,118.821680,,restaurant
Nanjing Forestry University - Nanda Mountain Apartment Restaurant,32.075920,118.821336,,restaurant
Century Fate Lakeside Garden Hotel · Lakeview Pavilion Chinese Restaurant,32.064443,118.814406,,restaurant
