restaurant_name,city,latitude,longitude,price_per_person,cuisine,opening_time,closing_time,nearby_attraction_name,nearby_attraction_coords,query_latitude,query_longitude,rating
Qianjiang Restaurant,Hangzhou,30.259527,120.148472,100.0,Chinese Restaurant;General Restaurant,10:00,20:00,Bai Causeway,"120.149189,30.255701",30.255701,120.149189,4.2
Le Shu Restaurant,Hangzhou,30.257025,120.144486,100.0,Chinese Restaurant;Chinese Restaurant,10:30,21:30,Bai Causeway,"120.149189,30.255701",30.255701,120.149189,4.0
Hangzhou Xinxin Hotel·1913 Restaurant,Hangzhou,30.255994,120.144148,371.0,Food Service Related;Food Service Related,09:30,21:30,Bai Causeway,"120.149189,30.255701",30.255701,120.149189,4.3
Zhejiang West Lake Villa Buffet Restaurant,Hangzhou,30.256935,120.142147,100.0,Chinese Restaurant;Chinese Restaurant,11:00,21:00,Bai Causeway,"120.149189,30.255701",30.255701,120.149189,4.1
In the Corner Restaurant,Hangzhou,30.260575,120.153651,28.0,Food Service Related;Food Service Related,11:00,21:00,Bai Causeway,"120.149189,30.255701",30.255701,120.149189,4.5
Green Tea Restaurant (Six Park Store),Hangzhou,30.257779,120.157824,63.0,Chinese Restaurant;Chinese Restaurant,10:30,21:00,Bai Causeway,"120.149189,30.255701",30.255701,120.149189,4.7
Yihu Chun Restaurant,Hangzhou,30.257141,120.158020,386.0,Chinese Restaurant;Chinese Restaurant,10:00,21:30,Bai Causeway,"120.149189,30.255701",30.255701,120.149189,4.5
Hangzhou Casablanca Music Bar & Restaurant,Hangzhou,30.260378,120.157253,109.0,Foreign Restaurant;Western Restaurant,10:00,02:00,Bai Causeway,"120.149189,30.255701",30.255701,120.149189,4.5
Yixiangyuan Restaurant - Halal Ethnic Cuisine,Hangzhou,30.257475,120.159475,100.0,Chinese Restaurant;Halal Restaurant,09:00,01:00,Bai Causeway,"120.149189,30.255701",30.255701,120.149189,4.2
Lou Wai Lou (Hangzhou West Lake Scenic Area Branch),Hangzhou,30.250209,120.140723,157.0,Chinese Restaurant;General Restaurant,16:30,20:30,Bai Causeway,"120.149189,30.255701",30.255701,120.149189,4.5
Hao Ke Lai Steak (Hangzhou Tianyang D32 Restaurant),Hangzhou,30.314744,120.137545,77.0,Foreign Restaurant;牛扒店(扒房),10:00,22:00,Hangzhou Arts and Crafts Museum,"120.136930,30.315645",30.315645,120.136930,4.4
Courtyard Restaurant (Gongchen Bridge Branch),Hangzhou,30.315401,120.138443,75.0,Chinese Restaurant;Chinese Restaurant,17:00,21:00,Hangzhou Arts and Crafts Museum,"120.136930,30.315645",30.315645,120.136930,4.3
BRIDGE Western Restaurant,Hangzhou,30.317777,120.136895,100.0,Foreign Restaurant;Foreign Restaurant,11:00,21:00,Hangzhou Arts and Crafts Museum,"120.136930,30.315645",30.315645,120.136930,3.6
Yiheng Yisu Jixiang Restaurant (Gongchen Bridge Branch),Hangzhou,30.317787,120.136903,32.0,Chinese Restaurant;Chinese Restaurant,10:30,20:30,Hangzhou Arts and Crafts Museum,"120.136930,30.315645",30.315645,120.136930,4.8
Sanren Noodle House Restaurant (Jinchang Wenhua Branch),Hangzhou,30.312099,120.142601,25.0,Chinese Restaurant;Chinese Restaurant,16:30,21:00,Hangzhou Arts and Crafts Museum,"120.136930,30.315645",30.315645,120.136930,4.1
Qianyu Qianwei (Canal Store),Hangzhou,30.321992,120.137046,131.0,Chinese Restaurant;Chinese Restaurant,17:00,20:30,Hangzhou Arts and Crafts Museum,"120.136930,30.315645",30.315645,120.136930,4.6
Baijia Dajia Restaurant (Wenzhou Road Branch),Hangzhou,30.320706,120.141437,18.0,Chinese Restaurant;Chinese Restaurant,14:00,19:00,Hangzhou Arts and Crafts Museum,"120.136930,30.315645",30.315645,120.136930,4.2
Shida Renjia Happy Restaurant (Jiru Garden Store),Hangzhou,30.317507,120.129761,21.0,Food Service Related;Food Service Related,11:00,21:00,Hangzhou Arts and Crafts Museum,"120.136930,30.315645",30.315645,120.136930,4.1
Nongtangli (Xiaohe Branch),Hangzhou,30.309394,120.133173,75.0,Chinese Restaurant;Chinese Restaurant,16:30,21:00,Hangzhou Arts and Crafts Museum,"120.136930,30.315645",30.315645,120.136930,4.4
Pizza Italian Restaurant (Canal Street Store),Hangzhou,30.319066,120.144087,56.0,Foreign Restaurant;Italian Restaurant,10:00,22:00,Hangzhou Arts and Crafts Museum,"120.136930,30.315645",30.315645,120.136930,4.6
Liujia Hotel (Hangzhou West Lake Jiuxi Branch) Restaurant,Hangzhou,30.195991,120.113222,100.0,Chinese Restaurant;Chinese Restaurant,11:00,21:00,Nine Creeks and Misty Trees,"120.113350,30.202395",30.202395,120.113350,3.4
Jiulong Xiangzhang Courtyard Restaurant (Jiuxi Store),Hangzhou,30.193979,120.115111,80.0,Fast Food Restaurant;Tea Restaurant,08:30,19:30,Nine Creeks and Misty Trees,"120.113350,30.202395",30.202395,120.113350,4.2
Jiuxi Xiaozhu·Xunwei Restaurant (Jiuxi Store),Hangzhou,30.193690,120.115651,96.0,Food Service Related;Food Service Related,08:30,20:00,Nine Creeks and Misty Trees,"120.113350,30.202395",30.202395,120.113350,4.1
Chalan Garden Restaurant (Jiuxi Branch),Hangzhou,30.212569,120.117874,92.0,Chinese Restaurant;Chinese Restaurant,10:00,20:00,Nine Creeks and Misty Trees,"120.113350,30.202395",30.202395,120.113350,4.6
Hangzhou Millennium Resort Hotel - Shixi Restaurant,Hangzhou,30.191025,120.115325,129.0,Foreign Restaurant;Western Restaurant,10:00,22:00,Nine Creeks and Misty Trees,"120.113350,30.202395",30.202395,120.113350,4.2
Longjing Courtyard Restaurant,Hangzhou,30.214875,120.107925,100.0,Chinese Restaurant;Chinese Restaurant,11:00,21:00,Nine Creeks and Misty Trees,"120.113350,30.202395",30.202395,120.113350,4.1
Shanghai Railway Qianjiang Hotel - Restaurant,Hangzhou,30.190588,120.120679,100.0,Food Service Related;Food Service Related,11:00,21:00,Nine Creeks and Misty Trees,"120.113350,30.202395",30.202395,120.113350,3.7
Lanxuan Restaurant,Hangzhou,30.215821,120.117607,100.0,Chinese Restaurant;Chinese Restaurant,10:00,21:00,Nine Creeks and Misty Trees,"120.113350,30.202395",30.202395,120.113350,4.4
Meiling Family Restaurant,Hangzhou,30.215918,120.117925,77.0,Chinese Restaurant;Chinese Restaurant,09:00,21:00,Nine Creeks and Misty Trees,"120.113350,30.202395",30.202395,120.113350,4.2
Hangzhou West Lake Scenic Area Mountain View Garden Restaurant,Hangzhou,30.216137,120.118931,486.0,Chinese Restaurant;Cantonese Cuisine,10:30,21:00,Nine Creeks and Misty Trees,"120.113350,30.202395",30.202395,120.113350,3.8
Yuhe Bistro & Canteen Restaurant,Hangzhou,30.307864,120.135234,121.0,Food Service Related;Food Service Related,11:00,21:00,Xiaohe Historical and Cultural Block,"120.135337,30.308302",30.308302,120.135337,4.7
Lulege Cat Garden Restaurant,Hangzhou,30.307912,120.136153,100.0,Chinese Restaurant;Chinese Restaurant,11:00,21:00,Xiaohe Historical and Cultural Block,"120.135337,30.308302",30.308302,120.135337,4.6
Heyixuan Garden Restaurant,Hangzhou,30.308787,120.134207,88.0,Chinese Restaurant;Chinese Restaurant,09:00,21:00,Xiaohe Historical and Cultural Block,"120.135337,30.308302",30.308302,120.135337,4.5
The 101st Garden Restaurant (Xiaohe Straight Street Branch),Hangzhou,30.308955,120.133764,120.0,Food Service Related;Food Service Related,16:30,21:00,Xiaohe Historical and Cultural Block,"120.135337,30.308302",30.308302,120.135337,4.6
Tengfei Bistro · Artisan Handmade · Tea & Wine Restaurant,Hangzhou,30.308920,120.133695,76.0,Chinese Restaurant;Chinese Restaurant,16:30,21:30,Xiaohe Historical and Cultural Block,"120.135337,30.308302",30.308302,120.135337,4.4
New Tengfei Flower Language Restaurant (Xiaohe Straight Street Store),Hangzhou,30.308929,120.133698,51.0,Chinese Restaurant;Chinese Restaurant,11:00,20:30,Xiaohe Historical and Cultural Block,"120.135337,30.308302",30.308302,120.135337,4.4
Ancient Path Lamb Flavor Restaurant,Hangzhou,30.307053,120.137177,79.0,Chinese Restaurant;Chinese Restaurant,17:00,24:00,Xiaohe Historical and Cultural Block,"120.135337,30.308302",30.308302,120.135337,4.3
Yunshuiyao - Yunnan Flavors,Hangzhou,30.306812,120.137098,103.0,Food Service Related;Food Service Related,09:00,21:00,Xiaohe Historical and Cultural Block,"120.135337,30.308302",30.308302,120.135337,4.4
Geju Dining & Wine Lounge,Hangzhou,30.306462,120.136888,100.0,Chinese Restaurant;Chinese Restaurant,11:00,21:00,Xiaohe Historical and Cultural Block,"120.135337,30.308302",30.308302,120.135337,3.3
Hangzhou Shangri-La·Coffee Garden,Hangzhou,30.252574,120.137577,207.0,Cafe;Cafe,11:00,21:00,Zhejiang Provincial Museum (Gushan Branch),"120.143778,30.251243",30.251243,120.143778,4.1
North China Hotel - Chinese Restaurant,Hangzhou,30.253808,120.133460,112.0,Chinese Restaurant;Chinese Restaurant,17:30,20:30,Zhejiang Provincial Museum (Gushan Branch),"120.143778,30.251243",30.251243,120.143778,4.1
Zhanbilou - West Lake Scenic Restaurant,Hangzhou,30.247279,120.133313,100.0,Chinese Restaurant;Chinese Restaurant,11:00,22:30,Zhejiang Provincial Museum (Gushan Branch),"120.143778,30.251243",30.251243,120.143778,4.6
Twelve Hours Lakeview Restaurant,Hangzhou,30.251519,120.131988,100.0,Food Service Related;Food Service Related,10:30,20:00,Zhejiang Provincial Museum (Gushan Branch),"120.143778,30.251243",30.251243,120.143778,4.0
Lotus Encounter Garden Restaurant,Hangzhou,30.247373,120.131962,103.0,Chinese Restaurant;Zhejiang Cuisine,11:00,19:30,Zhejiang Provincial Museum (Gushan Branch),"120.143778,30.251243",30.251243,120.143778,4.7
Wei Lu · West Lake 1138 Cultural Tea Restaurant,Hangzhou,30.230253,120.138864,100.0,Chinese Restaurant;Chinese Restaurant,11:00,21:00,Viewing Fish at Flower Harbor,"120.139095,30.230233",30.230233,120.139095,3.8
Zhiweiguan Weizhuang (Yang Gong Di Branch),Hangzhou,30.230581,120.137300,141.0,Chinese Restaurant;Chinese Restaurant,16:30,20:00,Viewing Fish at Flower Harbor,"120.139095,30.230233",30.230233,120.139095,4.3
Jiexiang Pavilion,Hangzhou,30.229459,120.133953,751.0,Chinese Restaurant;Zhejiang Cuisine,17:00,20:30,Viewing Fish at Flower Harbor,"120.139095,30.230233",30.230233,120.139095,4.5
Tulip Tea Restaurant (Prince Bay Park North Gate Welcome Pavilion Branch),Hangzhou,30.227600,120.143830,100.0,Fast Food Restaurant;Fast Food Restaurant,11:00,21:00,Viewing Fish at Flower Harbor,"120.139095,30.230233",30.230233,120.139095,3.4
Yunshe Tea Restaurant,Hangzhou,30.227673,120.133043,60.0,Chinese Restaurant;Zhejiang Cuisine,08:00,22:30,Viewing Fish at Flower Harbor,"120.139095,30.230233",30.230233,120.139095,4.1
Green Shade Restaurant,Hangzhou,30.227666,120.132958,100.0,Tea House;Tea House|Chinese Restaurant;Chinese Restaurant,08:00,21:00,Viewing Fish at Flower Harbor,"120.139095,30.230233",30.230233,120.139095,4.3
Haina Leisure Restaurant,Hangzhou,30.224264,120.137429,57.0,Food Service Related;Food Service Related,09:00,21:00,Viewing Fish at Flower Harbor,"120.139095,30.230233",30.230233,120.139095,4.5
Halal Yixiangyuan Restaurant - Roasted Lamb Ribs & Pilaf,Hangzhou,30.224122,120.137461,100.0,Chinese Restaurant;Halal Restaurant,09:00,24:00,Viewing Fish at Flower Harbor,"120.139095,30.230233",30.230233,120.139095,3.9
Zheli Authentic Flavor,Hangzhou,30.224114,120.137490,146.0,Chinese Restaurant;Chinese Restaurant,16:30,21:00,Viewing Fish at Flower Harbor,"120.139095,30.230233",30.230233,120.139095,4.5
Hangzhou West Lake Dianying Hotel · 1937 Restaurant,Hangzhou,30.263206,120.155350,447.0,Food Service Related;Food Service Related,11:00,21:00,Broken Bridge and Remaining Snow,"120.151299,30.258106",30.258106,120.151299,4.2
Sullivan Western Restaurant (WAKE TOWN Commercial Street Branch),Hangzhou,30.259038,120.159258,158.0,Foreign Restaurant;Western Restaurant,17:30,21:00,Broken Bridge and Remaining Snow,"120.151299,30.258106",30.258106,120.151299,3.9
Wanghu Building · Chinese Restaurant,Hangzhou,30.259017,120.159309,144.0,Chinese Restaurant;Chinese Restaurant,17:30,21:00,Broken Bridge and Remaining Snow,"120.151299,30.258106",30.258106,120.151299,4.2
Ouxiangju Restaurant,Hangzhou,30.230372,120.148032,63.0,Chinese Restaurant;Chinese Restaurant,17:00,19:30,Leifeng Pagoda Scenic Area,"120.148849,30.230934",30.230934,120.148849,4.3
Kouzi International Grand Hotel Restaurant,Hangzhou,30.232386,120.149789,100.0,Chinese Restaurant;Chinese Restaurant,11:00,21:00,Leifeng Pagoda Scenic Area,"120.148849,30.230934",30.230934,120.148849,3.3
Zizhen Garden Tea Banquet,Hangzhou,30.225658,120.152509,100.0,Tea House;Tea House,10:00,22:00,Leifeng Pagoda Scenic Area,"120.148849,30.230934",30.230934,120.148849,4.2
West Lake Banquet - Scenic Restaurant,Hangzhou,30.236157,120.154292,360.0,Chinese Restaurant;Seafood Restaurant,11:00,21:00,Leifeng Pagoda Scenic Area,"120.148849,30.230934",30.230934,120.148849,4.5
Xiaolu Mansion · Republic Private Banquet,Hangzhou,30.225240,120.143968,206.0,Chinese Restaurant;Zhejiang Cuisine,11:00,21:00,Leifeng Pagoda Scenic Area,"120.148849,30.230934",30.230934,120.148849,4.3
Xiaolu Creative Restaurant (Taiziwan Branch),Hangzhou,30.225213,120.143880,100.0,Food Service Related;Food Service Related,11:00,21:00,Leifeng Pagoda Scenic Area,"120.148849,30.230934",30.230934,120.148849,3.6
West Lake Impression Restaurant,Hangzhou,30.234732,120.156845,120.0,Chinese Restaurant;Chinese Restaurant,17:00,21:00,Leifeng Pagoda Scenic Area,"120.148849,30.230934",30.230934,120.148849,4.6
Liuying Lakeside,Hangzhou,30.238732,120.154521,217.0,Chinese Restaurant;Chinese Restaurant,17:00,21:00,Leifeng Pagoda Scenic Area,"120.148849,30.230934",30.230934,120.148849,4.6
Paper Kite Fusion Restaurant & Tavern,Hangzhou,30.240719,120.169041,100.0,Chinese Restaurant;Chinese Restaurant,17:00,21:30,Qinghefang Pedestrian Street,"120.168923,30.240073",30.240073,120.168923,4.6
Xiyue Garden Restaurant,Hangzhou,30.239312,120.169339,174.0,Chinese Restaurant;Chinese Restaurant,17:00,21:00,Qinghefang Pedestrian Street,"120.168923,30.240073",30.240073,120.168923,4.6
"MaLaMaLa Garden Restaurant, Coffee & Afternoon Tea",Hangzhou,30.239071,120.169689,100.0,Food Service Related;Food Service Related,11:00,21:00,Qinghefang Pedestrian Street,"120.168923,30.240073",30.240073,120.168923,4.7
Haipai Hui Restaurant,Hangzhou,30.240777,120.170435,98.0,Chinese Restaurant;Chinese Restaurant,10:00,22:00,Qinghefang Pedestrian Street,"120.168923,30.240073",30.240073,120.168923,4.5
Jiujiali·Creative Hangzhou Cuisine (Hefang Street Store),Hangzhou,30.240648,120.171031,82.0,Chinese Restaurant;General Restaurant,10:00,23:30,Qinghefang Pedestrian Street,"120.168923,30.240073",30.240073,120.168923,4.6
Yuting Zhandie (Drum Tower Store),Hangzhou,30.239810,120.171980,68.0,Chinese Restaurant;Zhejiang Cuisine,16:30,21:00,Qinghefang Pedestrian Street,"120.168923,30.240073",30.240073,120.168923,4.4
Jiang Xiaoxie (Xinjiang Cuisine Restaurant · Hefang Street Store),Hangzhou,30.239330,120.171880,75.0,Chinese Restaurant;Chinese Restaurant,11:30,21:30,Qinghefang Pedestrian Street,"120.168923,30.240073",30.240073,120.168923,4.6
New Zhou Ji · Jiangnan Flavors in the Alley (Drum Tower Branch),Hangzhou,30.237432,120.171040,64.0,Chinese Restaurant;Chinese Restaurant,10:30,23:30,Qinghefang Pedestrian Street,"120.168923,30.240073",30.240073,120.168923,4.6
Pan Fang Chun Fried Dumplings Michelin Restaurant (Zhongshan South Road Branch),Hangzhou,30.237205,120.171034,17.0,Chinese Restaurant;Chinese Restaurant,06:00,20:00,Qinghefang Pedestrian Street,"120.168923,30.240073",30.240073,120.168923,4.6
Xinbailu (West Lake Yintai Department Store Branch),Hangzhou,30.242989,120.165847,53.0,Chinese Restaurant;Zhejiang Cuisine|Cold Beverage Shop;Cold Beverage Shop,16:00,21:00,Qinghefang Pedestrian Street,"120.168923,30.240073",30.240073,120.168923,4.7
Funloop Fanglu · Lakeside Southern European Restaurant (Xihu Tiandi Branch),Hangzhou,30.246602,120.158183,117.0,Food Service Related;Food Service Related,11:00,21:00,Impression West Lake Performance,"120.149800,30.250800",30.250800,120.149800,4.7
Dahua Hotel Chinese Restaurant (Minghu Court),Hangzhou,30.248644,120.159973,142.0,Chinese Restaurant;Zhejiang Cuisine,17:30,20:30,Impression West Lake Performance,"120.149800,30.250800",30.250800,120.149800,4.2
One Way Eat · Lakeside Restaurant · Taste West Lake,Hangzhou,30.249628,120.160452,64.0,Chinese Restaurant;Chinese Restaurant,10:00,24:00,Impression West Lake Performance,"120.149800,30.250800",30.250800,120.149800,4.5
Airport Living Area Staff Restaurant,Hangzhou,25.921943,119.656431,100.0,Chinese Restaurant;Chinese Restaurant,08:00,22:00,Changle International Airport,"119.674042,25.928896",25.928896,119.674042,4.0
Grand Courtyard (Xixi Road),Hangzhou,30.257620,120.092557,86.0,Chinese Restaurant;Chinese Restaurant,16:30,20:30,Hangzhou West Station,"120.091014,30.260867",30.260867,120.091014,4.5
Fudi Restaurant,Hangzhou,30.260346,120.095285,100.0,Chinese Restaurant;Chinese Restaurant,11:00,21:00,Hangzhou West Station,"120.091014,30.260867",30.260867,120.091014,3.9
Fuyuan New Village Elderly Restaurant,Hangzhou,30.264739,120.094010,100.0,Chinese Restaurant;Chinese Restaurant,11:00,21:00,Hangzhou West Station,"120.091014,30.260867",30.260867,120.091014,3.5
Tu Haha Music Restaurant & Bar (Taifu Plaza Store),Hangzhou,30.165000,120.285112,103.0,Chinese Restaurant;Chinese Restaurant,18:30,02:30,Hangzhou South Station,"120.295589,30.172640",30.172640,120.295589,4.3
Radisson Blu Hotel Xiaoshan · Jufeng Chinese Restaurant (Xiaoshan Branch),Hangzhou,30.163626,120.284667,105.0,Chinese Restaurant;Chinese Restaurant,16:30,20:30,Hangzhou South Station,"120.295589,30.172640",30.172640,120.295589,4.4
Qingzhu Music Restaurant & Bar,Hangzhou,30.164001,120.283843,98.0,Chinese Restaurant;Chinese Restaurant,16:30,02:30,Hangzhou South Station,"120.295589,30.172640",30.172640,120.295589,4.1
Jiayan Restaurant (Wenxinyuan Store),Hangzhou,26.110632,119.319754,100.0,Chinese Restaurant;Chinese Restaurant,11:00,21:00,Fuzhou Station,"119.320571,26.113972",26.113972,119.320571,3.9
No. 8 Restaurant (Xiyuan Branch),Hangzhou,26.113752,119.328643,56.0,Chinese Restaurant;Chinese Restaurant,10:00,23:30,Fuzhou Station,"119.320571,26.113972",26.113972,119.320571,3.8
No. 6 Restaurant (Guishan Store),Hangzhou,26.113630,119.328650,100.0,Chinese Restaurant;Chinese Restaurant,11:00,21:00,Fuzhou Station,"119.320571,26.113972",26.113972,119.320571,4.2
Farmhouse Restaurant (Xiyuan Road Branch),Hangzhou,26.122599,119.325070,100.0,Chinese Restaurant;Chinese Restaurant,11:00,21:00,Fuzhou Station,"119.320571,26.113972",26.113972,119.320571,3.7
Bancheng Yanhuo BBQ & Music Restaurant Bar (Houshanli Branch),Hangzhou,26.123765,119.326985,100.0,Chinese Restaurant;General Restaurant,16:00,03:00,Fuzhou Station,"119.320571,26.113972",26.113972,119.320571,4.2
Macau Chen Guang Ji (Xiaoshan International Airport T4 Departure Mezzanine Branch),Hangzhou,30.234878,120.431013,100.0,Chinese Restaurant;Chinese Restaurant,11:00,21:00,Xiaoshan International Airport,"120.432413,30.234708",30.234708,120.432413,3.4
Original No. 1 Restaurant,Hangzhou,30.228891,120.426744,100.0,Chinese Restaurant;Chinese Restaurant,11:00,21:00,Xiaoshan International Airport,"120.432413,30.234708",30.234708,120.432413,4.0
Qu Wild Restaurant,Hangzhou,30.238984,120.446523,100.0,Chinese Restaurant;Chinese Restaurant,11:00,21:00,Xiaoshan International Airport,"120.432413,30.234708",30.234708,120.432413,4.0
Hangzhou Xiaoshan International Airport - No. 3 Restaurant,Hangzhou,30.239055,120.446681,30.0,Chinese Restaurant;Chinese Restaurant,11:00,21:00,Xiaoshan International Airport,"120.432413,30.234708",30.234708,120.432413,4.0
Air China Staff Restaurant (Air China Base Branch),Hangzhou,30.238608,120.449026,17.0,Chinese Restaurant;Chinese Restaurant,11:00,21:00,Xiaoshan International Airport,"120.432413,30.234708",30.234708,120.432413,4.1
Guangwei Xuan Hong Kong Tea Restaurant (Hangzhou East Station),Hangzhou,30.290107,120.209962,100.0,Fast Food Restaurant;Fast Food Restaurant,11:00,21:00,Hangzhou East Station,"120.212605,30.290846",30.290846,120.212605,2.5
Airuiyun Restaurant (Dongxi Debi Yiyuan Branch),Hangzhou,30.291007,120.217230,76.0,Chinese Restaurant;Chinese Restaurant|Cafe;Cafe,10:00,23:00,Hangzhou East Station,"120.212605,30.290846",30.290846,120.212605,4.0
Shenji Hong Kong-Style Tea Restaurant (Tiancheng Yinzuo Building 3 Branch),Hangzhou,30.289940,120.207477,30.0,Fast Food Restaurant;Tea Restaurant,10:00,19:00,Hangzhou East Station,"120.212605,30.290846",30.290846,120.212605,4.2
Green Tea Restaurant (Hangzhou East Station MixC Store),Hangzhou,30.293504,120.217725,74.0,Chinese Restaurant;Chinese Restaurant,10:30,21:30,Hangzhou East Station,"120.212605,30.290846",30.290846,120.212605,4.7
Minhua Ice Room (Hangzhou East Station MixC Mall Branch),Hangzhou,30.294025,120.217615,57.0,Food Service Related;Food Service Related,10:00,21:00,Hangzhou East Station,"120.212605,30.290846",30.290846,120.212605,4.4
Xinjudian Restaurant,Hangzhou,25.986874,119.388768,100.0,Chinese Restaurant;Chinese Restaurant,11:00,21:00,Fuzhou South Station,"119.391728,25.986348",25.986348,119.391728,3.6
Jufeng Restaurant,Hangzhou,25.984225,119.386025,100.0,Chinese Restaurant;Chinese Restaurant,11:00,21:00,Fuzhou South Station,"119.391728,25.986348",25.986348,119.391728,2.3
Huoshi Buffet Restaurant (South Station Sunshine City Shopping Center Branch),Hangzhou,25.986880,119.384363,17.0,Chinese Restaurant;Chinese Restaurant,16:30,20:00,Fuzhou South Station,"119.391728,25.986348",25.986348,119.391728,3.9
Fuxialu Drive-Thru Restaurant,Hangzhou,25.981642,119.378788,100.0,Chinese Restaurant;Chinese Restaurant,11:00,21:00,Fuzhou South Station,"119.391728,25.986348",25.986348,119.391728,3.7
Lin Ji Stewed Cuisine Chinese Restaurant,Hangzhou,25.979412,119.379478,100.0,Chinese Restaurant;Chinese Restaurant,09:00,20:30,Fuzhou South Station,"119.391728,25.986348",25.986348,119.391728,4.3
Zhongnan Jinshan Restaurant,Hangzhou,30.223607,120.387163,100.0,Chinese Restaurant;Chinese Restaurant,11:00,21:00,Home Inn - Hangzhou Xiaoshan International Airport Branch,"120.399721,30.231844",30.231844,120.399721,4.3
Zhongze Mingzhou Restaurant,Hangzhou,30.221547,120.387442,100.0,Chinese Restaurant;Chinese Restaurant,11:00,21:00,Home Inn - Hangzhou Xiaoshan International Airport Branch,"120.399721,30.231844",30.231844,120.399721,4.1
Chengyuan Xinyiyang Restaurant (Wenyi West Road Branch),Hangzhou,30.287817,120.080820,103.0,Chinese Restaurant;Chinese Restaurant,17:00,21:00,Orange Hotel Hangzhou Sports and Culture Center Xixi Wetland,"120.079410,30.281383",30.281383,120.079410,4.5
Ningkang Restaurant (Xixi Wisdom Building Branch),Hangzhou,30.280132,120.087830,100.0,Chinese Restaurant;Chinese Restaurant,11:00,21:00,Orange Hotel Hangzhou Sports and Culture Center Xixi Wetland,"120.079410,30.281383",30.281383,120.079410,4.0
Xixi Posthouse Tea Restaurant,Hangzhou,30.280408,120.069749,100.0,Chinese Restaurant;Chinese Restaurant,11:00,21:00,Orange Hotel Hangzhou Sports and Culture Center Xixi Wetland,"120.079410,30.281383",30.281383,120.079410,3.8
Jiafeng Weijia Grand Hotel Yunshui Restaurant (Wanyue City Snail Plaza Branch),Hangzhou,30.460295,120.299338,136.0,Chinese Restaurant;Chinese Restaurant,17:00,21:00,Hanting Hotel Hangzhou Donghu North Road,"120.297000,30.460900",30.460900,120.297000,4.4
Yihaoyuan Self-Service Restaurant (Canal Branch),Hangzhou,30.462277,120.298998,100.0,Food Service Related;Food Service Related,09:00,21:00,Hanting Hotel Hangzhou Donghu North Road,"120.297000,30.460900",30.460900,120.297000,3.8
Shiwei Lai Restaurant,Hangzhou,30.453525,120.293075,100.0,Chinese Restaurant;Chinese Restaurant,10:30,01:30,Hanting Hotel Hangzhou Donghu North Road,"120.297000,30.460900",30.460900,120.297000,3.7
Lai's Noodle House (Binfen Community Store),Hangzhou,30.215658,120.225423,18.0,Chinese Restaurant;Chinese Restaurant,09:00,21:00,Hampton by Hilton Hangzhou Binjiang,"120.224650,30.214829",30.214829,120.224650,4.2
New Ji Restaurant (Colorful Community Store),Hangzhou,30.215693,120.225437,166.0,Chinese Restaurant;Chinese Restaurant,08:00,20:00,Hampton by Hilton Hangzhou Binjiang,"120.224650,30.214829",30.214829,120.224650,4.2
Xiangyi Art Restaurant (Xinglanli Branch),Hangzhou,30.214907,120.222038,102.0,Chinese Restaurant;Hunan Cuisine,16:30,21:30,Hampton by Hilton Hangzhou Binjiang,"120.224650,30.214829",30.214829,120.224650,4.2
Jin • JIN Restaurant (Xinglanli Branch),Hangzhou,30.214704,120.220826,229.0,Food Service Related;Food Service Related,11:00,22:00,Hampton by Hilton Hangzhou Binjiang,"120.224650,30.214829",30.214829,120.224650,4.5
Mei Chu Restaurant (Internet of Things Branch),Hangzhou,30.214613,120.220007,100.0,Chinese Restaurant;Chinese Restaurant,08:00,21:00,Hampton by Hilton Hangzhou Binjiang,"120.224650,30.214829",30.214829,120.224650,4.0
Wangchangmen Family Restaurant (Tangwan Mingyuan C District Branch),Hangzhou,30.185347,120.278092,100.0,Chinese Restaurant;Chinese Restaurant,11:00,21:00,Hangzhou Yinlonghui Leisure Theme Hotel,"120.285795,30.179290",30.179290,120.285795,3.5
Jinlaihui Restaurant,Hangzhou,30.181607,120.271366,97.0,Chinese Restaurant;Chinese Restaurant,16:30,22:30,Hangzhou Yinlonghui Leisure Theme Hotel,"120.285795,30.179290",30.179290,120.285795,4.3
Aru Restaurant (Yucai Xiyuan East District Branch),Hangzhou,30.166872,120.279363,100.0,Chinese Restaurant;Chinese Restaurant,10:00,22:00,Hangzhou Yinlonghui Leisure Theme Hotel,"120.285795,30.179290",30.179290,120.285795,4.0
Pizza Italian Restaurant (Xiaoshan MixC Store),Hangzhou,30.181674,120.269350,77.0,Foreign Restaurant;Italian Restaurant,10:00,22:00,Hangzhou Yinlonghui Leisure Theme Hotel,"120.285795,30.179290",30.179290,120.285795,4.2
Songlin Courtyard Restaurant,Hangzhou,29.473420,119.263381,100.0,Chinese Restaurant;Chinese Restaurant,11:00,21:00,Ji Hotel Jiande Xin'an River Riverside,"119.263000,29.473400",29.473400,119.263000,2.9
Jinglan Muzhou Chinese Restaurant,Hangzhou,29.474565,119.256898,100.0,Chinese Restaurant;Chinese Restaurant,09:00,22:30,Ji Hotel Jiande Xin'an River Riverside,"119.263000,29.473400",29.473400,119.263000,3.7
City Canopy Restaurant (Electric Power Lane),Hangzhou,29.473320,119.269756,58.0,Chinese Restaurant;Chinese Restaurant,11:00,21:00,Ji Hotel Jiande Xin'an River Riverside,"119.263000,29.473400",29.473400,119.263000,4.5
