restaurant_name,city,latitude,longitude,price_per_person,cuisine,opening_time,closing_time,nearby_attraction_name,nearby_attraction_coords,query_latitude,query_longitude,rating,tags
Jingbao Restaurant · Established in 1994,Guangzhou,23.125349,113.268271,32.0,Chinese Restaurant;Chinese Restaurant,10:30,22:00,Millennium Ancient Path Ruins,"113.268844,23.124873",23.124873,113.268844,3.8,Birthday Package
Sunset Ultimate Micro Restaurant · Day Coffee Night Wine,Guangzhou,23.125125,113.269625,100.0,Chinese Restaurant;Chinese Restaurant,11:00,21:00,Millennium Ancient Path Ruins,"113.268844,23.124873",23.124873,113.268844,2.9,Must-Eat Top 10;Waiting Area
Green Island Western Cuisine · Birthday Theme Restaurant (New Daxin Department Store Branch),Guangzhou,23.125801,113.268465,94.0,Foreign Restaurant;Foreign Restaurant,11:00,21:00,Millennium Ancient Path Ruins,"113.268844,23.124873",23.124873,113.268844,4.2,Waiting Area
Taiping Guan (Beijing Road Branch),Guangzhou,23.126347,113.268959,111.0,Foreign Restaurant;Western Restaurant,11:00,22:00,Millennium Ancient Path Ruins,"113.268844,23.124873",23.124873,113.268844,4.3,Birthday Package
Weiyuan Canteen (Beijing Road Branch),Guangzhou,23.124060,113.270218,40.0,Food Service Related;Food Service Related,10:30,21:00,Millennium Ancient Path Ruins,"113.268844,23.124873",23.124873,113.268844,4.6,Must-Eat Top 10;Online Queue
Ba Zhen Restaurant (Guangda Road Branch),Guangzhou,23.126140,113.267649,26.0,Chinese Restaurant;Chinese Restaurant,07:00,21:00,Millennium Ancient Path Ruins,"113.268844,23.124873",23.124873,113.268844,4.4,Birthday Package;Online Queue
Dim Dou Dak (Beijing Road Second Branch),Guangzhou,23.126571,113.268955,60.0,Chinese Restaurant;Chinese Restaurant,16:30,21:00,Millennium Ancient Path Ruins,"113.268844,23.124873",23.124873,113.268844,4.7,Private Room;Birthday Package
Cheese Castle Pasta Restaurant (Old Brand Street Branch),Guangzhou,23.126345,113.267659,58.0,Foreign Restaurant;Italian Restaurant,11:00,21:00,Millennium Ancient Path Ruins,"113.268844,23.124873",23.124873,113.268844,4.6,Must-Eat Top 10
Wang Ye Ice Room (Junyi Hui Branch),Guangzhou,23.123499,113.267525,51.0,Cold Beverage Shop;Cold Beverage Shop,10:30,22:30,Millennium Ancient Path Ruins,"113.268844,23.124873",23.124873,113.268844,4.2,Online Queue
Green Tea Restaurant (Guangzhou Yuexiu Mayflower Branch),Guangzhou,23.125839,113.267017,60.0,Chinese Restaurant;Chinese Restaurant,10:00,22:00,Millennium Ancient Path Ruins,"113.268844,23.124873",23.124873,113.268844,4.7,Private Room
Tai Hang Ice Room (Wanling Plaza Store),Guangzhou,23.114886,113.262822,37.0,Fast Food Restaurant;Tea Restaurant|Cold Beverage Shop;Cold Beverage Shop,08:00,21:00,Guangzhou Sacred Heart Cathedral,"113.260262,23.114589",23.114589,113.260262,4.3,Online Queue
Sheng Ji Seafood Restaurant,Guangzhou,23.111838,113.261435,459.0,Chinese Restaurant;Seafood Restaurant,11:00,24:00,Guangzhou Sacred Heart Cathedral,"113.260262,23.114589",23.114589,113.260262,4.2,Online Queue
Datai Tea Restaurant (Haizhu Square Branch),Guangzhou,23.112610,113.262807,30.0,Fast Food Restaurant;Fast Food Restaurant,09:30,21:30,Guangzhou Sacred Heart Cathedral,"113.260262,23.114589",23.114589,113.260262,4.4,Must-Eat Top 10;Outdoor Seating
Yang's Tea Restaurant,Guangzhou,23.113892,113.256611,26.0,Fast Food Restaurant;Tea Restaurant,07:00,21:00,Guangzhou Sacred Heart Cathedral,"113.260262,23.114589",23.114589,113.260262,4.2,Private Room
Kowloon Ice Room (Guangzhou Starry Sky Branch),Guangzhou,23.114047,113.264026,32.0,Food Service Related;Food Service Related,10:00,22:00,Guangzhou Sacred Heart Cathedral,"113.260262,23.114589",23.114589,113.260262,4.3,Must-Eat Top 10;Outdoor Seating
DimDouDuk (Xinghuan Branch),Guangzhou,23.113551,113.264038,100.0,Chinese Restaurant;Chinese Restaurant,08:00,21:00,Guangzhou Sacred Heart Cathedral,"113.260262,23.114589",23.114589,113.260262,4.6,Waiting Area;Online Queue
Wing Pin Xuan Hainanese Chicken Rice (Changdi Branch),Guangzhou,23.111040,113.258709,16.0,Fast Food Restaurant;Fast Food Restaurant,08:00,21:00,Guangzhou Sacred Heart Cathedral,"113.260262,23.114589",23.114589,113.260262,4.2,Must-Eat Top 10;Waiting Area
Haxnbauer German Restaurant (Guangzhou Xinghuan Branch),Guangzhou,23.113636,113.264520,139.0,Foreign Restaurant;German Cuisine,10:00,22:00,Guangzhou Sacred Heart Cathedral,"113.260262,23.114589",23.114589,113.260262,4.4,Private Room
Haiguang Tower Cantonese Cuisine Restaurant,Guangzhou,23.116348,113.264768,76.0,Chinese Restaurant;Chinese Restaurant,17:00,21:30,Guangzhou Sacred Heart Cathedral,"113.260262,23.114589",23.114589,113.260262,4.1,Private Room;Online Queue
Hakka Restaurant (Gaodi West Shoe Street Branch),Guangzhou,23.118181,113.263428,56.0,Chinese Restaurant;Cantonese Cuisine,17:30,22:00,Guangzhou Sacred Heart Cathedral,"113.260262,23.114589",23.114589,113.260262,3.9,Waiting Area
Cantonese Flavor (Jiefang North Road Branch),Guangzhou,23.137298,113.262015,40.0,Chinese Restaurant;Chinese Restaurant,11:00,20:30,Guangzhou Museum (Zhenhai Tower Exhibition Area),"113.265698,23.137723",23.137723,113.265698,4.2,Waiting Area
Huachengli · Mo Shang Hua Kai,Guangzhou,23.138076,113.269909,79.0,Foreign Restaurant;Western Restaurant,11:00,20:30,Guangzhou Museum (Zhenhai Tower Exhibition Area),"113.265698,23.137723",23.137723,113.265698,4.5,Waiting Area;Online Queue
Yuexiu Park · Yundao Soup and Garden Restaurant,Guangzhou,23.141657,113.268382,100.0,Chinese Restaurant;Chinese Restaurant,17:00,02:00,Guangzhou Museum (Zhenhai Tower Exhibition Area),"113.265698,23.137723",23.137723,113.265698,4.0,Must-Eat Top 10;Online Queue
Kaiser Xinjiang Restaurant,Guangzhou,23.134685,113.261613,86.0,Chinese Restaurant;Halal Restaurant,10:00,23:00,Guangzhou Museum (Zhenhai Tower Exhibition Area),"113.265698,23.137723",23.137723,113.265698,3.6,Outdoor Seating;Online Queue
Kowloon Ice Room (China Hotel Branch),Guangzhou,23.139943,113.260837,50.0,Chinese Restaurant;Chinese Restaurant,10:00,22:00,Guangzhou Museum (Zhenhai Tower Exhibition Area),"113.265698,23.137723",23.137723,113.265698,4.3,Private Room
Green Island Western Restaurant · Birthday Theme · Lawn Terrace Restaurant,Guangzhou,23.142096,113.268446,70.0,Foreign Restaurant;Foreign Restaurant,11:00,10:00,Guangzhou Museum (Zhenhai Tower Exhibition Area),"113.265698,23.137723",23.137723,113.265698,4.6,Outdoor Seating
Meat Times Restaurant,Guangzhou,23.141163,113.270362,117.0,Food Service Related;Food Service Related,10:00,24:00,Guangzhou Museum (Zhenhai Tower Exhibition Area),"113.265698,23.137723",23.137723,113.265698,4.1,Birthday Package
Harriman Restaurant,Guangzhou,23.141023,113.270484,17.0,Chinese Restaurant;Halal Restaurant,11:30,24:00,Guangzhou Museum (Zhenhai Tower Exhibition Area),"113.265698,23.137723",23.137723,113.265698,3.8,Outdoor Seating
Tao Tao Ju Restaurant (Jiefang North Road Branch),Guangzhou,23.133583,113.261670,106.0,Chinese Restaurant;Chinese Restaurant,17:00,21:00,Guangzhou Museum (Zhenhai Tower Exhibition Area),"113.265698,23.137723",23.137723,113.265698,4.5,Must-Eat Top 10;Waiting Area
Kemeng Ice Room,Guangzhou,23.140969,113.260656,100.0,Fast Food Restaurant;Tea Restaurant,11:00,21:00,Guangzhou Museum (Zhenhai Tower Exhibition Area),"113.265698,23.137723",23.137723,113.265698,4.0,Must-Eat Top 10;Waiting Area
Thai Savor Southeast Asian Cuisine Restaurant (Tangming Plaza Branch),Guangzhou,23.128637,113.244810,57.0,Foreign Restaurant;Foreign Restaurant,11:00,01:00,Chen Clan Ancestral Hall (Guangdong Folk Art Museum),"113.245409,23.126999",23.126999,113.245409,4.6,Outdoor Seating;Waiting Area
Jiangnan Family Chinese Restaurant,Guangzhou,23.128594,113.246464,15.0,Chinese Restaurant;Chinese Restaurant,10:00,22:00,Chen Clan Ancestral Hall (Guangdong Folk Art Museum),"113.245409,23.126999",23.126999,113.245409,4.6,Must-Eat Top 10;Private Room
"Knife, Fork, and Glass · American BBQ · Craft Beer · Music Bistro (Chen Clan Academy Branch)",Guangzhou,23.124866,113.245630,111.0,Food Service Related;Food Service Related,11:00,21:00,Chen Clan Ancestral Hall (Guangdong Folk Art Museum),"113.245409,23.126999",23.126999,113.245409,4.6,Outdoor Seating
Hong Pak Ice Room,Guangzhou,23.124911,113.246189,55.0,Food Service Related;Food Service Related,11:00,21:00,Chen Clan Ancestral Hall (Guangdong Folk Art Museum),"113.245409,23.126999",23.126999,113.245409,4.4,Waiting Area;Online Queue
Hao Guangwei Dim Sum (Liwan Road Branch),Guangzhou,23.127554,113.242929,41.0,Fast Food Restaurant;Tea Restaurant,17:00,21:00,Chen Clan Ancestral Hall (Guangdong Folk Art Museum),"113.245409,23.126999",23.126999,113.245409,4.3,Outdoor Seating;Private Room
Ice Love Restaurant,Guangzhou,23.129648,113.245025,64.0,Chinese Restaurant;Chinese Restaurant,11:00,21:00,Chen Clan Ancestral Hall (Guangdong Folk Art Museum),"113.245409,23.126999",23.126999,113.245409,4.4,Private Room
Oyster Song潮吧 Cantonese Cuisine Restaurant,Guangzhou,23.124163,113.245397,52.0,Chinese Restaurant;Cantonese Cuisine,11:00,00:30,Chen Clan Ancestral Hall (Guangdong Folk Art Museum),"113.245409,23.126999",23.126999,113.245409,4.4,Must-Eat Top 10;Outdoor Seating
Yuanhua Tea Restaurant (Zhongshan 7th Road Branch),Guangzhou,23.125489,113.248563,27.0,Fast Food Restaurant;Tea Restaurant,10:00,21:00,Chen Clan Ancestral Hall (Guangdong Folk Art Museum),"113.245409,23.126999",23.126999,113.245409,4.1,Birthday Package
Hui Suo Western Restaurant,Guangzhou,23.124377,113.247650,72.0,Foreign Restaurant;Western Restaurant,10:00,22:00,Chen Clan Ancestral Hall (Guangdong Folk Art Museum),"113.245409,23.126999",23.126999,113.245409,4.1,Private Room;Birthday Package
DimDouDuk (Da Tea House Branch),Guangzhou,23.123471,113.246339,54.0,Tea House;Tea House,11:00,21:00,Chen Clan Ancestral Hall (Guangdong Folk Art Museum),"113.245409,23.126999",23.126999,113.245409,4.6,Private Room;Birthday Package
Gulichike Russian Western Restaurant,Guangzhou,23.132148,113.327017,100.0,Foreign Restaurant;Foreign Restaurant,11:00,21:00,Grandview Mall,"113.327019,23.132145",23.132145,113.327019,4.3,Private Room
Li Chateau (Grandview Mall Branch),Guangzhou,23.132126,113.327019,210.0,Foreign Restaurant;Western Restaurant,17:00,22:00,Grandview Mall,"113.327019,23.132145",23.132145,113.327019,4.4,Private Room;Birthday Package
Tsui Wah Restaurant (Grandview Plaza Branch),Guangzhou,23.132202,113.327063,73.0,Chinese Restaurant;Chinese Restaurant,10:00,21:30,Grandview Mall,"113.327019,23.132145",23.132145,113.327019,4.5,Waiting Area;Birthday Package
Weixin Flower Kitchen (Grandview Mall Branch),Guangzhou,23.132086,113.327063,100.0,Chinese Restaurant;Chinese Restaurant,11:00,22:41,Grandview Mall,"113.327019,23.132145",23.132145,113.327019,3.9,Online Queue
Kowloon Ice Room (Grandview Mall Branch),Guangzhou,23.132125,113.327449,43.0,Chinese Restaurant;Cantonese Cuisine,10:00,22:00,Grandview Mall,"113.327019,23.132145",23.132145,113.327019,4.2,Outdoor Seating;Waiting Area
Wen Tong Ice Room (Grandview Mall Branch),Guangzhou,23.131747,113.326965,45.0,Cold Beverage Shop;Cold Beverage Shop,10:30,21:30,Grandview Mall,"113.327019,23.132145",23.132145,113.327019,4.6,Must-Eat Top 10;Private Room
Taotaoju (Grandview Mall Branch),Guangzhou,23.131723,113.327286,92.0,Chinese Restaurant;General Restaurant,10:00,21:30,Grandview Mall,"113.327019,23.132145",23.132145,113.327019,4.7,Waiting Area
Mr. Steak · Thick Cut Snowflake Steak Western Restaurant (Grandview Mall Branch),Guangzhou,23.131541,113.326537,73.0,Foreign Restaurant;Foreign Restaurant,10:30,22:00,Grandview Mall,"113.327019,23.132145",23.132145,113.327019,4.6,Birthday Package
Latin Restaurant (Grandview Mall Store),Guangzhou,23.132942,113.326957,104.0,Foreign Restaurant;巴西菜,17:00,22:00,Grandview Mall,"113.327019,23.132145",23.132145,113.327019,4.4,Waiting Area
Guangzhou Grandview Plaza Marriott Hotel · Marriott Cantonese Restaurant,Guangzhou,23.132717,113.326294,179.0,Food Service Related;Food Service Related,17:00,22:00,Grandview Mall,"113.327019,23.132145",23.132145,113.327019,4.3,Outdoor Seating
Yunshan Drunken Restaurant (Minghui Branch),Guangzhou,23.114582,113.247940,49.0,Chinese Restaurant;Chinese Restaurant,11:00,21:00,Shangxiajiu Pedestrian Street,"113.246895,23.114228",23.114228,113.246895,3.8,Online Queue
Saizeriya Italian Restaurant (002 Shangxiajiu Branch),Guangzhou,23.114666,113.248337,40.0,Foreign Restaurant;Italian Restaurant,11:00,22:00,Shangxiajiu Pedestrian Street,"113.246895,23.114228",23.114228,113.246895,4.8,Must-Eat Top 10;Outdoor Seating
Kowloon Tea Restaurant · World Culinary Master-Managed Restaurant (Tokyu New World Shopping Plaza Store),Guangzhou,23.114505,113.248544,100.0,Fast Food Restaurant;Tea Restaurant,11:00,22:00,Shangxiajiu Pedestrian Street,"113.246895,23.114228",23.114228,113.246895,4.1,Private Room
Shifu Pavilion Chinese Restaurant (Shifu Mingdu Mall Branch),Guangzhou,23.113319,113.245509,70.0,Chinese Restaurant;Chinese Restaurant,11:00,21:00,Shangxiajiu Pedestrian Street,"113.246895,23.114228",23.114228,113.246895,4.1,Outdoor Seating;Private Room
Guangzhou Shifu voco Hotel · TOCO Cafe · Giant Mouth Buffet Restaurant,Guangzhou,23.113153,113.245444,100.0,Accommodation Related;Accommodation Related,11:00,21:00,Shangxiajiu Pedestrian Street,"113.246895,23.114228",23.114228,113.246895,4.1,Birthday Package;Online Queue
Xi Chuan Music Restaurant & Bar,Guangzhou,23.113075,113.245125,100.0,Chinese Restaurant;Chinese Restaurant,19:30,03:00,Shangxiajiu Pedestrian Street,"113.246895,23.114228",23.114228,113.246895,3.5,Must-Eat Top 10;Private Room
Tao Tao Ju Restaurant (Dishifu Road Branch),Guangzhou,23.113365,113.242484,51.0,Chinese Restaurant;Cantonese Cuisine,08:00,21:00,Shangxiajiu Pedestrian Street,"113.246895,23.114228",23.114228,113.246895,4.6,Must-Eat Top 10;Private Room
Man Kee Yat Sum Chicken,Guangzhou,23.115184,113.241926,54.0,Chinese Restaurant;Chinese Restaurant,17:00,21:00,Shangxiajiu Pedestrian Street,"113.246895,23.114228",23.114228,113.246895,4.3,Waiting Area
Chen Tian Ji,Guangzhou,23.114907,113.241602,20.0,Chinese Restaurant;Chinese Restaurant,10:00,22:00,Shangxiajiu Pedestrian Street,"113.246895,23.114228",23.114228,113.246895,4.3,Online Queue
Jian Kee Noodle Shop (Yi Fu Noodles),Guangzhou,23.118214,113.250498,11.0,Chinese Restaurant;Chinese Restaurant,06:30,20:00,Shangxiajiu Pedestrian Street,"113.246895,23.114228",23.114228,113.246895,4.3,Waiting Area
Wentong Ice Room (Zhujiang New Town Branch),Guangzhou,23.120523,113.324423,100.0,Chinese Restaurant;Cantonese Cuisine,10:30,22:00,Flower City Square,"113.324593,23.120498",23.120498,113.324593,4.5,Outdoor Seating;Private Room
Gansimido Yunnan Art Restaurant (Huachenghui Branch),Guangzhou,23.120155,113.324504,52.0,Food Service Related;Food Service Related,11:00,22:00,Flower City Square,"113.324593,23.120498",23.120498,113.324593,4.3,Waiting Area
Fugui Dining Company Huachenghui Branch,Guangzhou,23.119710,113.324676,30.0,Chinese Restaurant;Chinese Restaurant,10:30,21:30,Flower City Square,"113.324593,23.120498",23.120498,113.324593,4.4,Must-Eat Top 10
Succu Western Restaurant (GT Land · Summer Plaza Branch),Guangzhou,23.120175,113.323773,100.0,Food Service Related;Food Service Related,11:00,21:00,Flower City Square,"113.324593,23.120498",23.120498,113.324593,4.0,Private Room
Fat Cat Tea Restaurant (Huachenghui Central District Branch),Guangzhou,23.119706,113.324315,65.0,Chinese Restaurant;Chinese Restaurant,10:30,21:00,Flower City Square,"113.324593,23.120498",23.120498,113.324593,4.5,Birthday Package;Online Queue
FRANCESCO YABE Garden Restaurant & Terrace Bar (Gaode Land Plaza · Autumn Store),Guangzhou,23.119912,113.325607,226.0,Foreign Restaurant;Western Restaurant,11:30,24:00,Flower City Square,"113.324593,23.120498",23.120498,113.324593,4.5,Must-Eat Top 10;Private Room
G·O Green Orexis New Green,Guangzhou,23.120745,113.323237,71.0,Foreign Restaurant;Western Restaurant,08:00,22:00,Flower City Square,"113.324593,23.120498",23.120498,113.324593,4.3,Birthday Package
Zhisheng Restaurant,Guangzhou,23.120005,113.325952,100.0,Chinese Restaurant;Chinese Restaurant,11:00,21:00,Flower City Square,"113.324593,23.120498",23.120498,113.324593,3.0,Waiting Area
The Eating Table (GT Land Winter Plaza Branch),Guangzhou,23.119722,113.326446,187.0,Entertainment Venue;Bar|Chinese Restaurant;Chinese Restaurant,11:30,22:00,Flower City Square,"113.324593,23.120498",23.120498,113.324593,4.6,Waiting Area
COLINMINT Simple Delight Kitchen,Guangzhou,23.120521,113.322541,104.0,Chinese Restaurant;Chinese Restaurant,17:00,21:30,Flower City Square,"113.324593,23.120498",23.120498,113.324593,4.7,Must-Eat Top 10
Wulin Chef Tea House (Duobao Road Branch),Guangzhou,23.116849,113.236430,65.0,Tea House;Tea House|Chinese Restaurant;Chinese Restaurant,11:00,21:00,Lychee Bay,"113.236659,23.116029",23.116029,113.236659,4.6,Must-Eat Top 10
San Paolo Cantonese Cuisine Restaurant,Guangzhou,23.116932,113.235996,38.0,Chinese Restaurant;Cantonese Cuisine,11:00,21:30,Lychee Bay,"113.236659,23.116029",23.116029,113.236659,4.2,Outdoor Seating
Big Sister Wok · Braised Abalone & Chicken Pot (Fengyuan Road Store),Guangzhou,23.117656,113.239570,63.0,Chinese Restaurant;Chinese Restaurant,17:00,02:00,Lychee Bay,"113.236659,23.116029",23.116029,113.236659,4.4,Online Queue
Li's Noodle House,Guangzhou,23.116421,113.240861,42.0,Chinese Restaurant;Chinese Restaurant,09:00,21:30,Lychee Bay,"113.236659,23.116029",23.116029,113.236659,4.4,Private Room;Online Queue
128 Fresh Simple Restaurant,Guangzhou,23.118674,113.240405,100.0,Chinese Restaurant;Cantonese Cuisine,10:00,20:00,Lychee Bay,"113.236659,23.116029",23.116029,113.236659,4.2,Private Room;Online Queue
Saizeriya Italian Restaurant (Hengbao Plaza Branch),Guangzhou,23.117333,113.241294,49.0,Foreign Restaurant;Italian Restaurant,10:00,22:00,Lychee Bay,"113.236659,23.116029",23.116029,113.236659,4.7,Private Room;Birthday Package
Sen Some Fusion (Liwan Branch),Guangzhou,23.118837,113.240548,75.0,Foreign Restaurant;Western Restaurant,11:30,21:30,Lychee Bay,"113.236659,23.116029",23.116029,113.236659,4.6,Outdoor Seating
Wen Ji Food Shop,Guangzhou,23.118774,113.240604,26.0,Chinese Restaurant;Chinese Restaurant,17:00,20:00,Lychee Bay,"113.236659,23.116029",23.116029,113.236659,4.3,Waiting Area
Huang En Kee Tea Restaurant (Hengbao Plaza Branch),Guangzhou,23.117225,113.241474,42.0,Fast Food Restaurant;Fast Food Restaurant,10:30,21:00,Lychee Bay,"113.236659,23.116029",23.116029,113.236659,4.2,Waiting Area;Birthday Package
Panxi Restaurant,Guangzhou,23.121321,113.236214,81.0,Chinese Restaurant;General Restaurant|糕饼店;糕饼店,17:00,21:00,Xiguan Folk Customs Museum,"113.236027,23.119581",23.119581,113.236027,4.5,Online Queue
Shunji Ice Room (Lychee Bay Branch),Guangzhou,23.121364,113.236807,24.0,Food Service Related;Food Service Related,12:00,22:00,Xiguan Folk Customs Museum,"113.236027,23.119581",23.119581,113.236027,4.3,Online Queue
Xi Yue Bo Ya Hui Private Kitchen,Guangzhou,23.121817,113.234791,178.0,Chinese Restaurant;Cantonese Cuisine,17:00,21:30,Xiguan Folk Customs Museum,"113.236027,23.119581",23.119581,113.236027,4.4,Birthday Package
DimDouDuk (Li Hong Building),Guangzhou,23.117959,113.231403,53.0,Chinese Restaurant;Cantonese Cuisine,07:30,20:00,Xiguan Folk Customs Museum,"113.236027,23.119581",23.119581,113.236027,4.7,Online Queue
Xinqiao Airport Staff Restaurant,Guangzhou,31.971607,116.983558,20.0,Food Service Related;Food Service Related,11:00,21:00,Xinqiao International Airport,"116.978347,31.985386",31.985386,116.978347,4.1,Private Room
Staff Center Restaurant (NIO Advanced Manufacturing Xinqiao Second Factory),Guangzhou,31.996783,116.991051,19.0,Chinese Restaurant;Chinese Restaurant,07:00,18:00,Xinqiao International Airport,"116.978347,31.985386",31.985386,116.978347,4.5,Online Queue
Hui Jiuxiang Restaurant,Guangzhou,31.883734,117.318492,100.0,Chinese Restaurant;Anhui Cuisine,08:00,20:00,Hefei Station,"117.316937,31.885135",31.885135,117.316937,3.8,Online Queue
Wooden Barrel Stinky Mandarin Fish · Anhui Intangible Cultural Heritage Dish (Train Station Xindi Branch),Guangzhou,31.881246,117.318559,73.0,Chinese Restaurant;Chinese Restaurant,16:00,22:00,Hefei Station,"117.316937,31.885135",31.885135,117.316937,4.0,Outdoor Seating;Online Queue
Hefei Southeast Orthopedic Hospital Staff Canteen,Guangzhou,31.881689,117.313260,100.0,Chinese Restaurant;Chinese Restaurant,11:00,21:00,Hefei Station,"117.316937,31.885135",31.885135,117.316937,3.9,Waiting Area;Online Queue
Wooden Barrel Stinky Mandarin Fish · Hui Cuisine Restaurant (Bai Ma Old Store),Guangzhou,31.884821,117.310082,100.0,Chinese Restaurant;Chinese Restaurant,10:00,22:00,Hefei Station,"117.316937,31.885135",31.885135,117.316937,4.7,Waiting Area;Online Queue
Hui Shi Ji Restaurant (Zhonghuan International Building Branch),Guangzhou,31.880608,117.311680,100.0,Food Service Related;Food Service Related,09:00,21:00,Hefei Station,"117.316937,31.885135",31.885135,117.316937,3.6,Birthday Package
Chao Yue Xuan Restaurant,Guangzhou,22.988580,113.277198,100.0,Chinese Restaurant;Chinese Restaurant,06:00,01:30,Guangzhou South Station,"113.269097,22.988344",22.988344,113.269097,3.9,Birthday Package
Xiangyu Jiawei Restaurant,Guangzhou,22.981550,113.265371,100.0,Chinese Restaurant;Chinese Restaurant,11:00,24:00,Guangzhou South Station,"113.269097,22.988344",22.988344,113.269097,3.7,Private Room;Birthday Package
Chao Garden Restaurant,Guangzhou,22.988778,113.277390,100.0,Fast Food Restaurant;Fast Food Restaurant,11:00,21:00,Guangzhou South Station,"113.269097,22.988344",22.988344,113.269097,3.5,Outdoor Seating
Manmai Lai Thai Restaurant (Guangzhou East Center · Guanghui New World Branch),Guangzhou,23.133988,113.599260,100.0,Foreign Restaurant;Western Restaurant,17:00,22:00,Guangzhou Xintang Station,"113.606262,23.134057",23.134057,113.606262,4.8,Online Queue
Four Seasons Fusion Cuisine Restaurant (Guanghui Tiandi Branch),Guangzhou,23.134272,113.599019,146.0,Chinese Restaurant;Chinese Restaurant,11:00,22:00,Guangzhou Xintang Station,"113.606262,23.134057",23.134057,113.606262,4.3,Waiting Area;Birthday Package
MINBURN Mingben · Macau,Guangzhou,23.133767,113.599015,100.0,体育休闲服务场所;体育休闲服务场所,11:00,21:00,Guangzhou Xintang Station,"113.606262,23.134057",23.134057,113.606262,3.8,Outdoor Seating
Hui Jiu Xiang Restaurant (Hefei South Station Branch),Guangzhou,31.800640,117.289706,22.0,Chinese Restaurant;Chinese Restaurant,06:00,23:00,Hefei South Station,"117.290331,31.797955",31.797955,117.290331,4.5,Waiting Area;Birthday Package
Jiukoujia Restaurant (Hefei South Station Store),Guangzhou,31.801025,117.290345,100.0,Fast Food Restaurant;Fast Food Restaurant,07:00,21:30,Hefei South Station,"117.290331,31.797955",31.797955,117.290331,3.9,Private Room
Four Seasons Restaurant (South Station South Plaza Store),Guangzhou,31.794832,117.288801,100.0,Chinese Restaurant;Chinese Restaurant,09:00,21:00,Hefei South Station,"117.290331,31.797955",31.797955,117.290331,4.1,Outdoor Seating
Hui Yun Restaurant,Guangzhou,31.804275,117.294043,100.0,Chinese Restaurant;Chinese Restaurant,11:00,17:00,Hefei South Station,"117.290331,31.797955",31.797955,117.290331,3.8,Must-Eat Top 10;Waiting Area
Hong Kong · Gangpin Hui Roast Goose Tea Restaurant (Wanghu City Branch),Guangzhou,31.807087,117.295468,37.0,Chinese Restaurant;Chinese Restaurant,09:30,21:30,Hefei South Station,"117.290331,31.797955",31.797955,117.290331,4.1,Private Room;Waiting Area
Guangzhou Feng · Attitude Hotel Restaurant,Guangzhou,23.150938,113.258589,100.0,Chinese Restaurant;Chinese Restaurant,11:00,21:00,Guangzhou Station,"113.257331,23.149243",23.149243,113.257331,3.6,Outdoor Seating
iFUNANYA FOOD (Ifunanya Restaurant),Guangzhou,23.151352,113.256330,100.0,Foreign Restaurant;Foreign Restaurant,11:00,21:00,Guangzhou Station,"113.257331,23.149243",23.149243,113.257331,3.6,Birthday Package;Online Queue
A Pinch of Salt Restaurant and Café,Guangzhou,23.146393,113.257404,100.0,Food Service Related;Food Service Related,11:00,21:00,Guangzhou Station,"113.257331,23.149243",23.149243,113.257331,3.6,Must-Eat Top 10;Birthday Package
Pullman Guangzhou Baiyun Airport Hotel · Tianyuan Creative Chinese Restaurant,Guangzhou,23.388786,113.303939,195.0,Chinese Restaurant;Cantonese Cuisine,17:30,21:00,Baiyun International Airport,"113.307392,23.387375",23.387375,113.307392,4.3,Online Queue
Pullman Guangzhou Baiyun Airport Hotel · U8 Cuisine Restaurant,Guangzhou,23.388920,113.303728,175.0,Foreign Restaurant;Western Restaurant,11:00,21:00,Baiyun International Airport,"113.307392,23.387375",23.387375,113.307392,4.2,Must-Eat Top 10
Zhongtu Restaurant (Guangzhou Baiyun International Airport Terminal 1),Guangzhou,23.382661,113.305204,100.0,Fast Food Restaurant;Fast Food Restaurant,11:00,21:00,Baiyun International Airport,"113.307392,23.387375",23.387375,113.307392,3.7,Private Room;Waiting Area
Man Wah Ice Room (Guangzhou Oriental Baotai Branch),Guangzhou,23.149505,113.325236,58.0,Cold Beverage Shop;Cold Beverage Shop|Fast Food Restaurant;Fast Food Restaurant,08:00,22:00,Guangzhou East Station,"113.324964,23.150588",23.150588,113.324964,4.5,Private Room
Wen Tong Ice Room (Oriental Baotai Branch),Guangzhou,23.149907,113.323959,50.0,Chinese Restaurant;Cantonese Cuisine,10:00,21:30,Guangzhou East Station,"113.324964,23.150588",23.150588,113.324964,4.6,Online Queue
Saizeriya Italian Restaurant (072 Oriental Baotai Plaza Branch),Guangzhou,23.148721,113.325496,34.0,Foreign Restaurant;Italian Restaurant,10:00,22:00,Guangzhou East Station,"113.324964,23.150588",23.150588,113.324964,4.6,Birthday Package;Online Queue
Korean Palace BBQ Buffet Restaurant (Food City Branch),Guangzhou,23.376713,113.207555,49.0,Chinese Restaurant;Halal Restaurant,10:00,21:00,Guangzhou North Station,"113.203846,23.377273",23.377273,113.203846,3.9,Online Queue
Ya Xin Cuisine (Jincheng Plaza Branch),Guangzhou,23.378887,113.208881,15.0,Chinese Restaurant;Chinese Restaurant,17:00,21:00,Guangzhou North Station,"113.203846,23.377273",23.377273,113.203846,4.2,Must-Eat Top 10
